sentence1,event1,te_rel,sentence2,event2,s_id,s_id2,e_id,e_id2
Finally they called Notscha in to them and ordered him to be reconciled to his father. ,ordered,BEFORE,"But no sooner was Notscha free than he again fell into a rage, and renewed his pursuit of his father. ",renewed,150,152,1,2
"But no sooner was Notscha free than he again fell into a rage, and renewed his pursuit of his father. ",renewed,AFTER,He had again overtaken Li Dsing when still another saint came forward to defend the latter. ,overtaken,152,153,2,1
He had again overtaken Li Dsing when still another saint came forward to defend the latter. ,overtaken,BEFORE,"When Notscha attempted to battle with him he raised his arm, and a pagoda shaped itself out of red, whirling clouds and closed around Notscha. ",attempted,153,155,1,0
"When Notscha attempted to battle with him he raised his arm, and a pagoda shaped itself out of red, whirling clouds and closed around Notscha. ",attempted,BEFORE,Then Radiance of Light placed both his hands on the pagoda and a fire arose within it which burned Notscha so that he cried loudly for mercy. ,burned,155,156,0,2
Then Radiance of Light placed both his hands on the pagoda and a fire arose within it which burned Notscha so that he cried loudly for mercy. ,burned,BEFORE,Then he had to promise to beg his father's forgiveness and always to obey him in the future. ,promise,156,157,2,1
Then he had to promise to beg his father's forgiveness and always to obey him in the future. ,promise,BEFORE,Not till he had promised all this did the Buddha let him out of the pagoda again. ,promised,157,158,1,1
Not till he had promised all this did the Buddha let him out of the pagoda again. ,promised,BEFORE,And he gave the pagoda to Li Dsing; ,gave,158,159,1,0
And he gave the pagoda to Li Dsing; ,gave,BEFORE, and taught him a magic saying which would give him the mastery over Notscha. ,taught,159,160,0,0
 and taught him a magic saying which would give him the mastery over Notscha. ,taught,BEFORE,It is for this reason that Li Dsing is called the Pagoda-bearing King of Heaven. ,called,160,161,0,2
It is for this reason that Li Dsing is called the Pagoda-bearing King of Heaven. ,called,BEFORE,"Later on Li Dsing and his three sons, Gintscha, Mutscha and Notscha, aided King Wu of the Dschou dynasty to destroy the tyrant Dschou-Sin. ",aided,161,162,2,0
"Later on Li Dsing and his three sons, Gintscha, Mutscha and Notscha, aided King Wu of the Dschou dynasty to destroy the tyrant Dschou-Sin. ",aided,BEFORE,Only once did a sorcerer succeed in wounding Notscha in the left arm. ,wounding,162,164,0,2
Only once did a sorcerer succeed in wounding Notscha in the left arm. ,wounding,BEFORE,Any other would have died of the wound. ,died,164,165,2,2
Any other would have died of the wound. ,died,BEFORE,"But the Great One carried him into his cave, healed his wound and gave him three goblets of the wine of the gods to drink, and three fire-dates to eat. ",gave,165,166,2,2
"But the Great One carried him into his cave, healed his wound and gave him three goblets of the wine of the gods to drink, and three fire-dates to eat. ",gave,BEFORE,When Notscha had eaten and drunk he suddenly heard a crash at his left side and another arm grew out from it. ,heard,166,167,2,2
When Notscha had eaten and drunk he suddenly heard a crash at his left side and another arm grew out from it. ,heard,BEFORE,He could not speak and his eyes stood out from their sockets with horror. ,speak,167,168,2,1
He could not speak and his eyes stood out from their sockets with horror. ,speak,BEFORE,"But it went on as it had begun: six more arms grew out of his body and two more heads, so that finally he had three heads and eight arms. ",grew,168,169,1,3
"But it went on as it had begun: six more arms grew out of his body and two more heads, so that finally he had three heads and eight arms. ",grew,BEFORE,"But the latter only laughed and said: ""All is as it should be. ",said,169,171,3,1
"But the latter only laughed and said: ""All is as it should be. ",said,BEFORE,Then he taught him a magic incantation by means of which he could make his arms and heads visible or invisible as he chose. ,taught,171,173,1,0
Then he taught him a magic incantation by means of which he could make his arms and heads visible or invisible as he chose. ,taught,AFTER,"When the tyrant Dschou-Sin had been destroyed, Li Dsing and his three sons, while still on earth, were taken up into heaven and seated among the gods.",destroyed,173,174,0,2
