sentence1,event1,te_rel,sentence2,event2,s_id,s_id2,e_id,e_id2
"When all was ready, the dwarfs, in new green suits, came bustling in, very happy and merry, and took their seats at the table. ",took,AFTER,"But in a moment they all sprang up with a cry, and ran away screaming, for Barbaik had placed pans of hot coals under their feet, and all their poor little toes were burnt.'",placed,100,101,3,4
"But in a moment they all sprang up with a cry, and ran away screaming, for Barbaik had placed pans of hot coals under their feet, and all their poor little toes were burnt.'",placed,BEFORE,"'You won't forget that in a hurry,' she said, smiling grimly to herself, but in a moment they were back again with large pots of water, which they poured on the fire. ",poured,101,102,4,5
"'You won't forget that in a hurry,' she said, smiling grimly to herself, but in a moment they were back again with large pots of water, which they poured on the fire. ",poured,BEFORE,"Then they joined hands and danced round it, singing: Wicked traitress, Barne Riou, Our poor toes are burned by you; ",danced,102,103,5,1
"Then they joined hands and danced round it, singing: Wicked traitress, Barne Riou, Our poor toes are burned by you; ",danced,BEFORE, Now we hurry from your hall-- Bad luck light upon you all. ,hurry,103,104,1,0
 Now we hurry from your hall-- Bad luck light upon you all. ,hurry,AFTER,"That evening they left the country for ever, and Jegu, without their help, grew poorer and poorer, and at last died of misery, while Barbaik was glad to find work in the market of Morlaix.",grew,104,105,0,1
