sentence_id,text,start,end
260,"Before lying down, she said to her husband, ""No one but yourself must pass on this side of the lodge."" ",21475,21578
261,"The winter passed away with snows, and sports and stones in the lodge; ",21578,21649
262," and when the sap of the maple began to flow, the wife of Wassamo wakened, and she immediately set about work as before. ",21648,21769
263,She helped at the maple-trees with the others; ,21769,21816
264," and, as if luck were in her presence, the sugar-harvest was greater than had been ever known in all that region. ",21815,21929
265,"The gifts of tobacco, after this, came in even more freely than they had at first; ",21929,22012
266," and as each brought his bundle to the lodge of Wassamo, he asked for the usual length of life, for success as a hunter, and for a plentiful supply of food. ",22011,22168
267,"They particularly desired that the sand-hills might be kept quiet, so that their lands might be moist, and their eyes clear of dust to sight the game. ",22168,22319
268,Wassamo replied that he would mention each of their requests to his father-in-law. ,22319,22402
269,"The tobacco was stored in sacks, and on the outside of the skins, that there might be no mistake as to their wants, each one who had given tobacco had painted and marked in distinct characters the totem or family emblem of his family and tribe. ",22402,22647
270,"These the old Sand-Spirit could read at his leisure, and do what he thought best for each of his various petitioners. ",22647,22765
271,"When the time for his return arrived, Wassamo warned his people that they should not follow him nor attempt to take note how he disappeared. ",22765,22906
272,"He then took the moose-skin sacks filled with tobacco, and bade farewell to all but Netawis. ",22906,22999
273,"He insisted on the privilege of attending Wassamo and his wife for a distance, and when they reached the sand-banks he expressed the strongest wish to proceed with them on their journey. ",22999,23186
274,Wassamo told him that it could not be; ,23186,23225
275," that only spirits could exert the necessary power, and that there were no such spirits at hand. ",23224,23321
276,"They then took an affectionate leave of each other, Wassamo enjoining it upon his cousin, at risk of his life, to not look back when he had once started to return. ",23321,23485
277,"The cousin, sore at heart, but constrained to obey, parted from them, and as he walked sadly away, he heard a gliding noise as of the sound of waters that were cleaved. ",23485,23654
278,"He returned home, and told his friends that Wassamo and his wife had disappeared, but that he knew not how. ",23654,23762
279,No one doubted his word in any thing now. ,23762,23804
280,Wassamo with his wife soon reached their home at the hills. ,23804,23864
281,"The old Sand-Spirit was in excellent health, and delighted to see them. ",23864,23936
282,He hailed their return with open arms; ,23936,23975
283," and he opened his arms so very wide, that when he closed them he not only embraced Wassamo and his wife, but all of the tobacco-sacks which they had brought with them. ",23974,24143
284,The requests of the Indian people were made known to him; ,24143,24201
285," he replied that he would attend to all, but that he must first invite his friends to smoke with him. ",24200,24302
286,"Accordingly he at once dispatched his pipe-bearer and confidential aid to summon various Spirits of his acquaintance, and set the time for them to come. ",24302,24455
287,Meanwhile he had a word of advice for his son-in-law Wassamo. ,24455,24517
288,"""My son,"" said he, ""some of these Manitoes that I have asked to come here are of a very wicked temper, and I warn you especially of that Island Spirit who wished to marry my daughter. ",24517,24701
289,"He is a very bad-hearted Monedo, and would like to do you harm. ",24701,24765
290,"Some of the company you will, however, find to be very friendly. ",24765,24830
291,A caution for you. ,24830,24849
292,"When they come in, do you sit close by your wife; ",24849,24899
293," if you do not, you will be lost. ",24898,24932
294,She only can save you; ,24932,24955
295," for those who are expected to come are so powerful that they will otherwise draw you from your seat, and toss you out of the lodge as though you were a feather. ",24954,25116
296,"You have only to observe my words and all will be well."" ",25116,25173
297,"Wassamo took heed to what the Old Spirit said, and answered that he would obey. ",25173,25253
298,About mid-day the company began to assemble; ,25253,25298
299, and such a company Wassamo had never looked on before. ,25297,25353
300,There were Spirits from all parts of the country; ,25353,25403
301," such strange-looking persons, and in dresses so wild and outlandish! ",25402,25472
302,One entered who smiled on him. ,25472,25503
303,"This, Wassamo was informed, was a Spirit who had charge of the affairs of a tribe in the North, and he was as pleasant and cheery a Spirit as one would wish to see. ",25503,25668
304,"Soon after, Wassamo heard a great rumbling and roaring, as of waters tumbling over rocks; ",25668,25758
305," and presently, with a vast bluster, and fairly shaking the lodge with his deep-throated hail of welcome to the old Sand-Spirit, in rolled another, who was the Guardian Spirit and special director of a great cataract or water-fall not far off. ",25757,26001
306,"Then came with crashing steps the owner of several whirlwinds, which were in the habit of raging about in the neighboring country. ",26001,26132
307,"And following this one, glided in a sweet-spoken, gentle-faced little Spirit, who was understood to represent a summer-gale that was accustomed to blow, toward evening, in at the lodge-doors, and to be particularly well disposed toward young lovers. ",26132,26382
308,The last to appear was a great rocky-headed fellow; ,26382,26434
309, and he was twice as stony in his manners; ,26433,26476
310," and swaggered and strided in, and raised such a commotion with his great green blanket when he shook it, that Wassamo was nearly taken off his feet; ",26475,26625
311, and it was only by main force that he was able to cling by his wife. ,26624,26694
312,"This, which was the last to enter, was that wicked Island Spirit, who looked grim enough at Wassamo's wife, who had rejected him, as he passed in. ",26694,26841
313,"Soon after, the old Sand-Spirit, who was a great speech-maker, arose and addressed the assembly. ",26841,26938
314,"""Brothers,"" he said, ""I have invited you to partake with me of the offerings made by the mortals on earth, which have been brought by our relation,"" pointing to Wassamo. ",26938,27108
315,"""Brothers, you see their wishes and desires plainly set forth here,"" laying his hand upon the figured moose-skins. ",27108,27223
316,"""The offering is worthy of our consideration. ",27223,27269
317,"Brothers, I see nothing on my part to hinder our granting their requests; ",27269,27343
318, they do not appear to be unreasonable. ,27342,27382
319,"Brothers, the offer is gratifying. ",27382,27417
320,It is tobacco--an article which we have lacked until we scarcely knew how to use our pipes. ,27417,27509
321,Shall we grant their requests? ,27509,27540
322,One thing more I would say. ,27540,27568
323,"Brothers, it is this: There is my son-in law; ",27568,27614
324, he is mortal. ,27613,27628
325,"I wish to detain him with me, and it is with us jointly to make him one of us."" ",27628,27708
326,"""Hoke! ",27708,27715
327,"hoke!"" ",27715,27722
328,"ran through the whole company of Spirits, and ""Hoke! ",27722,27775
329,"hoke!"" ",27715,27722
330,they cried again. ,27782,27800
331,"And it was understood that the petitioners were to have all they asked, and that Wassamo was thenceforward fairly accepted as a member of the great family of Spirits. ",27800,27967
332,"As a wedding-gift, the Old Spirit asked his son-in-law to make one request, which should be promptly granted. ",27967,28077
333,"""Let there be no sand-squalls among my father's people for three months to come,"" said Wassamo. ",28077,28173
334,"""So shall it be,"" answered the old Sand-Spirit. ",28173,28221
335,The tobacco was now divided in equal shares among the company. ,28221,28284
336,"They filled their pipes--and huge pipes they were--and such clouds they blew, that they rushed forth out of the lodge and brought on night, in all the country round about, several hours before its time. ",28284,28487
337,"After a while passed in silence, the Spirits rose up, and bearing off their tobacco-sacks, they went smoking through the country, and losing themselves in their own fog, till a late hour in the morning, when all of their pipes being burned out, each departed on his own business. ",28487,28767
338,"The very next day the old Sand-Spirit, who was very much pleased with the turn affairs had taken at his entertainment, addressed Wassamo: ""Son-in-law, I have made up my mind to allow you another holiday as an acknowledgment of the handsome manner in which you acquitted yourself of your embassy. ",28767,29063
339,"You may visit your parents and relatives once more, to tell them that their wishes are granted, and to take your leave of them forever. ",29063,29199
340,"You can never, after, visit them again."" ",29199,29240
341,"Wassamo at once set out, reached his people, and was heartily welcomed. ",29240,29312
342,"They asked for his wife, and Wassamo informed them that she had tarried at home to look after a son, a fine little Sand-Spirit, who had been born to them since his return. ",29312,29484
343,"Having delivered all of his messages and passed a happy time, Wassamo said, ""I must now bid you all farewell forever."" ",29484,29603
344,His parents and friends raised their voices in loud lamentation; ,29603,29668
345," they clung to him, and as a special favor, which he could now grant, being himself a spirit, he allowed them to accompany him to the sand-banks. ",29667,29813
346,They all seated themselves to watch his last farewell. ,29813,29868
347,The day was mild; ,29868,29886
348," the sky clear, not a cloud appearing to dim the heavens, nor a breath of wind to ruffle the tranquil waters. ",29885,29995
349,A perfect silence fell upon the company. ,29995,30036
350,"They gazed with eager eyes fastened on Wassamo, as he waded out into the water, waving his hands. ",30036,30134
351,"They saw him descend, more and more, into the depths. ",30134,30188
352,"They beheld the waves close over his head, and a loud and piercing wail went up which rent the sky. ",30188,30288
353,They looked again; ,30288,30307
354," a red flame, as if the sun had glanced on a billow, lighted the spot for an instant; ",30306,30392
355," but the Feather of Flames, Wassamo of the Fire-Plume, had disappeared from home and kindred, and the familiar paths of his youth, forever.",30391,30531
