sentence_id,text,start,end
186,"Then he lifted a live peat from the smouldering fire, and went his way. ",22606,22678
187,"Down at the water's edge he found the King's boat lying, guarded by a single boatman, with its sails set and its prow turned in the direction of the Mester Stoorworm. ",22678,22845
188,"""It's a cold morning,"" said Assipattle. ",22845,22885
189,"""Art thou not well-nigh frozen sitting there? ",22885,22931
190,"If thou wilt come on shore, and run about, and warm thyself, I will get into the boat and guard it till thou returnest."" ",22931,23052
191,"""A likely story,"" replied the man. ",23052,23087
192,"""And what would the King say if he were to come, as I expect every moment he will do, and find me playing myself on the sand, and his good boat left to a smatchet like thee? ",23087,23261
193,"Twould be as much as my head is worth."" ",23261,23301
194,"""As thou wilt,"" answered Assipattle carelessly, beginning to search among the rocks. ",23301,23386
195,"""In the meantime, I must be looking for a wheen mussels to roast for my breakfast."" ",23386,23470
196,"And after he had gathered the mussels, he began to make a hole in the sand to put the live peat in. ",23470,23570
197,"The boatman watched him curiously, for he, too, was beginning to feel hungry. ",23570,23648
198,"Presently the lad gave a wild shriek, and jumped high in the air. ",23648,23714
199,"""Gold, gold!"" ",23714,23728
200,he cried. ,23728,23738
201,"""By the name of Thor, who would have looked to find gold here?"" ",23738,23802
202,This was too much for the boatman. ,23802,23837
203,"Forgetting all about his head and the King, he jumped out of the boat, and, pushing Assipattle aside, began to scrape among the sand with all his might. ",23837,23990
204,"While he was doing so, Assipattle seized his pot, jumped into the boat, pushed her off, and was half a mile out to sea before the outwitted man, who, needless to say, could find no gold, noticed what he was about. ",23990,24204
205,"And, of course, he was very angry, and the old King was more angry still when he came down to the shore, attended by his Nobles and carrying the great sword Sickersnapper, in the vain hope that he, poor feeble old man that he was, might be able in some way to defeat the Monster and save his daughter. ",24204,24506
206,But to make such an attempt was beyond his power now that his boat was gone. ,24506,24583
207,"So he could only stand on the shore, along with the fast assembling crowd of his subjects, and watch what would befall. ",24583,24703
208,And this was what befell! ,24703,24729
209,"Assipattle, sailing slowly over the sea, and watching the Mester Stoorworm intently, noticed that the terrible Monster yawned occasionally, as if longing for his weekly feast. ",24729,24905
210,"And as it yawned a great flood of sea-water went down its throat, and came out again at its huge gills. ",24905,25009
211,"So the brave lad took down his sail, and pointed the prow of his boat straight at the Monster's mouth, and the next time it yawned he and his boat were sucked right in, and, like Jonah, went straight down its throat into the dark regions inside its body. ",25009,25264
212,On and on the boat floated; ,25264,25292
213," but as it went the water grew less, pouring out of the Stoorworm's gills, till at last it stuck, as it were, on dry land. ",25291,25414
214,"And Assipattle jumped out, his pot in his hand, and began to explore. ",25414,25484
215,"Presently he came to the huge creature's liver, and having heard that the liver of a fish is full of oil, he made a hole in it and put in the live peat. ",25484,25637
216,Woe's me! ,25637,25647
217,but there was a conflagration! ,25647,25678
218,And Assipattle just got back to his boat in time; ,25678,25728
219," for the Mester Stoorworm, in its convulsions, threw the boat right out of its mouth again, and it was flung up, high and dry, on the bare land. ",25727,25872
220,"The commotion in the sea was so terrible that the King and his daughter--who by this time had come down to the shore dressed like a bride, in white, ready to be thrown to the Monster--and all his Courtiers, and all the country-folk, were fain to take refuge on the hill top, out of harm's way, and stand and see what happened next. ",25872,26204
221,And this was what happened next. ,26204,26237
222,"The poor, distressed creature--for it was now to be pitied, even although it was a great, cruel, awful Mester Stoorworm--tossed itself to and fro, twisting and writhing. ",26237,26407
223,"And as it tossed its awful head out of the water its tongue fell out, and struck the earth with such force that it made a great dent in it, into which the sea rushed. ",26407,26574
224,And that dent formed the crooked Straits which now divide Denmark from Norway and Sweden. ,26574,26664
225,"Then some of its teeth fell out and rested in the sea, and became the Islands that we now call the Orkney Isles; ",26664,26777
226," and a little afterwards some more teeth dropped out, and they became what we now call the Shetland Isles. ",26776,26883
227,After that the creature twisted itself into a great lump and died; ,26883,26950
228, and this lump became the Island of Iceland; ,26949,26994
229," and the fire which Assipattle had kindled with his live peat still burns on underneath it, and that is why there are mountains which throw out fire in that chilly land. ",26993,27163
230,"When at last it was plainly seen that the Mester Stoorworm was dead, the King could scarce contain himself with joy. ",27163,27280
231,"He put his arms round Assipattle's neck, and kissed him, and called him his son. ",27280,27361
232,"And he took off his own Royal Mantle and put it on the lad, and girded his good sword Sickersnapper round his waist. ",27361,27478
233,"And he called his daughter, the Princess Gemdelovely, to him, and put her hand in his, and declared that when the right time came she should be his wife, and that he should be ruler over all the Kingdom. ",27478,27682
234,"Then the whole company mounted their horses again, and Assipattle rode on Go-Swift by the Princess's side; ",27682,27789
235," and so they returned, with great joy, to the King's Palace. ",27788,27849
236,"But as they were nearing the gate Assipattle's sister, she who was the Princess's maid, ran out to meet him, and signed to the Princess to lout down, and whispered something in her ear. ",27849,28035
237,"The Princess's face grew dark, and she turned her horse's head and rode back to where her father was, with his Nobles. ",28035,28154
238,She told him the words that the maiden had spoken; ,28154,28205
239," and when he heard them his face, too, grew as black as thunder. ",28204,28269
240,"For the matter was this: The cruel Queen, full of joy at the thought that she was to be rid, once for all, of her step-daughter, had been making love to the wicked Sorcerer all the morning in the old King's absence. ",28269,28485
241,"""He shall be killed at once,"" cried the Monarch. ",28485,28534
242,"""Such behaviour cannot be overlooked."" ",28534,28573
243,"""Thou wilt have much ado to find him, your Majesty,"" said the girl, ""for it is more than an hour since he and the Queen fled together on the fleetest horses that they could find in the stables."" ",28573,28768
244,"""But I can find him,"" cried Assipattle; ",28768,28808
245, and he went off like the wind on his good horse Go-Swift. ,28807,28866
246,"It was not long before he came within sight of the fugitives, and he drew his sword and shouted to them to stop. ",28866,28979
247,"They heard the shout, and turned round, and they both laughed aloud in derision when they saw that it was only the boy who grovelled in the ashes who pursued them. ",28979,29143
248,"""The insolent brat! ",29143,29163
249,I will cut off his head for him! ,29163,29196
250,"I will teach him a lesson!"" ",29196,29224
251,cried the Sorcerer; ,29224,29244
252, and he rode boldly back to meet Assipattle. ,29243,29288
253,"For although he was no fighter, he knew that no ordinary weapon could harm his enchanted body; ",29288,29383
254, therefore he was not afraid. ,29382,29412
255,"But he did not count on Assipattle having the Sword of the great god Odin, with which he had slain all his enemies; ",29412,29528
256, and before this magic weapon he was powerless. ,29527,29575
257,"And, at one thrust, the young lad ran it through his body as easily as if he had been any ordinary man, and he fell from his horse, dead. ",29575,29713
258,"Then the Courtiers of the King, who had also set off in pursuit, but whose steeds were less fleet of foot than Go-Swift, came up, and seized the bridle of the Queen's horse, and led it and its rider back to the Palace. ",29713,29932
259,"She was brought before the Council, and judged, and condemned to be shut up in a high tower for the remainder of her life. ",29932,30055
260,Which thing surely came to pass. ,30055,30088
261,"As for Assipattle, when the proper time came he was married to the Princess Gemdelovely, with great feasting and rejoicing. ",30088,30212
262,And when the old King died they ruled the Kingdom for many a long year.,30212,30284
