sentence_id,text,start,end
248,Then the dogs flung themselves on the giant and tore him into countless pieces. ,21610,21690
249,"Then the youth took all the treasures that lay in the mountain, hitched the giant's horses to a gilded wagon, and drove off as fast as he could. ",21690,21835
250,"Now when the king's daughters met again there was great joy, as may well be imagined, and all thanked the youth for delivering them out of the power of the mountain trolls. ",21835,22008
251,"But the youth fell deeply in love with the youngest princess, and they promised to be true to each other. ",22008,22114
252,"So the king's daughters passed on their way with music and merriment of every kind, and the youth served them with all the honor and courtesy due maidens of gentle birth. ",22114,22285
253,"And while they were underway the princesses toyed with the youth's hair, and each tied her golden ring in his locks for remembrance. ",22285,22418
254,"One day while they were still underway, they met two wanderers, who were traveling the same road. ",22418,22516
255,"The clothes of the two strangers were torn and their feet were sore, and their whole appearance showed that they had a long journey behind them. ",22516,22661
256,"The youth stopped his wagon, and asked them who they were and whence they came. ",22661,22741
257,"The strangers answered that they were two princes, and had gone forth to search for the three maidens in the mountain. ",22741,22860
258,But fortune had not favored them; ,22860,22894
259, and now they had to return home more like journeymen than kings' sons. ,22893,22965
260,"When the youth heard this he felt sorry for the two wanderers, and asked whether they would like to ride with him in his handsome wagon. ",22965,23102
261,The princes thanked him profusely for his offer. ,23102,23151
262,"They drove on together, and came to the kingdom over which the father of the princesses reigned. ",23151,23248
263,"Now when the princes learned that the youth had delivered the king's three daughters, a great jealousy took possession of them, and they thought of how badly they had fared in their own venture. ",23248,23443
264,"And they took counsel together as to how they might get the better of the youth, and win power and glory for themselves. ",23443,23564
265,But they hid their evil plot till a favorable opportunity offered for carrying it out. ,23564,23651
266,"Then they suddenly threw themselves on their comrade, seized him by the throat and strangled him. ",23651,23749
267,And then they threatened to kill the princesses if they did not swear to keep silence. ,23749,23836
268,"And since the king's daughters were in the power of the princes, they did not dare say no. ",23836,23927
269,"But they felt very sorry for the youth who had given up his life for them, and the youngest princess mourned with all her heart, and all her happiness was at an end. ",23927,24093
270,"After this great wrong the princes drove to the royal castle, and one may well imagine how happy the king was to get back his three daughters. ",24093,24236
271,In the meantime the poor youth lay like dead off in a gorge in the forest. ,24236,24311
272,"Yet he was not quite dead, and his faithful dogs lay about him, kept him warm, and licked his wounds. ",24311,24413
273,And they did not stop until their master came back to life again. ,24413,24479
274,"When he was once more well and strong he set out, and after many difficulties came to the royal castle in which the princesses dwelt. ",24479,24613
275,"When he came in the whole court was full of joy and merriment, and from the king's hall came the sound of dancing and string music. ",24613,24745
276,"That surprised him greatly, and he asked what it all meant. ",24745,24805
277,"The serving-man answered: ""You must come from far away, since you do not know that the king has regained his daughters who were in the power of the mountain troll. ",24805,24969
278,"This is the oldest princess's wedding-day."" ",24969,25013
279,"The youth then asked after the youngest princess, and when she was to marry. ",25013,25090
280,"But the serving-man said that she did not want a husband, and wept the live-long day, though no one knew why. ",25090,25200
281,Then the youth felt happy once more; ,25200,25237
282," for now he knew that she loved him, and had kept faith with him. ",25236,25302
283,"The youth now went to the keeper of the door, and bade him tell the king that a guest had arrived who would add to the merriment of the wedding festivities by showing his dogs. ",25302,25479
284,"This was to the king's liking, and he ordered that the stranger receive the best possible treatment. ",25479,25580
285,"And when the youth stepped into the hall, the whole wedding company were astounded by his skill and his manly bearing, and all agreed that so handsome a youth was rarely seen. ",25580,25756
286,"But no sooner had the king's three daughters recognized him, than they jumped up from the table, and flung themselves on his neck. ",25756,25887
287,And then the princes thought it best to make themselves scarce. ,25887,25951
288,"But the king's daughters told how the youth had freed them, and the rest of their adventures; ",25951,26045
289, and to make quite certain they looked for their rings among his locks. ,26044,26116
290,"Now when the king heard of the trickery and treachery the two strange princes had used, he grew very angry and had them driven ignominously forth from the castle. ",26116,26279
291,"But he received the brave youth with great honor, as he had deserved, and he was married to the king's youngest daughter that selfsame day. ",26279,26419
292,"After the king's death the youth was chosen king of all the land, and a gallant king he was. ",26419,26512
293,"And there he lives with his beautiful queen, and is reigning there happily to this very day. ",26512,26605
294,And that is all I have to do with it.,26605,26643
