sentence1,event1,te_rel,sentence2,event2,s_id,s_id2,e_id,e_id2
 but he gladly promised his aid. ,promised,BEFORE,"He began: ""I will tell you the truth just as it is. ",began,152,154,0,0
"He began: ""I will tell you the truth just as it is. ",began,AFTER,This day we are threatened by the danger of thunder. ,threatened,154,156,0,1
This day we are threatened by the danger of thunder. ,threatened,BEFORE,"If you care to save us, then there is a hope that we may manage to stay alive; ",save,156,157,1,1
"If you care to save us, then there is a hope that we may manage to stay alive; ",save,BEFORE," if not, then take your child and go, so that you are not involved in our danger."" ",take,157,158,1,0
" if not, then take your child and go, so that you are not involved in our danger."" ",take,BEFORE,But Kung vowed that he would share life and death with them. ,vowed,158,159,0,0
But Kung vowed that he would share life and death with them. ,vowed,BEFORE,"Then the youth begged him to stand in the door with a sword in his hand, and said: ""Now when the thunder begins to roll you must stand there and never stir."" ",stir,159,160,0,7
"Then the youth begged him to stand in the door with a sword in his hand, and said: ""Now when the thunder begins to roll you must stand there and never stir."" ",stir,BEFORE,"Kung looked about him, but the buildings had all disappeared, and behind him he could only see a high barrow, in which was a large cave whose interior was lost in darkness. ",looked,160,162,7,0
"Kung looked about him, but the buildings had all disappeared, and behind him he could only see a high barrow, in which was a large cave whose interior was lost in darkness. ",looked,BEFORE,In the midst of his fright he was surprised by a thunderbolt. ,surprised,162,163,0,1
In the midst of his fright he was surprised by a thunderbolt. ,surprised,BEFORE,Everything glimmered before his eyes and his ears were deafened. ,deafened,163,165,1,2
Everything glimmered before his eyes and his ears were deafened. ,deafened,BEFORE,"But he held his sword in his hand, and stood as firm as a rock. ",held,165,166,2,0
"But he held his sword in his hand, and stood as firm as a rock. ",held,BEFORE,"Suddenly in the midst of black smoke and flashes of lightning, he saw a monster with a pointed beak and long claws, which was carrying off a human body. ",saw,166,167,0,0
"Suddenly in the midst of black smoke and flashes of lightning, he saw a monster with a pointed beak and long claws, which was carrying off a human body. ",saw,BEFORE,When he looked more closely he recognized by the dress that it was Giauna. ,looked,167,168,0,0
When he looked more closely he recognized by the dress that it was Giauna. ,looked,BEFORE,"He leaped up at the monster and struck at him with his sword, and at once Giauna fell to the ground. ",leaped,168,169,0,0
"He leaped up at the monster and struck at him with his sword, and at once Giauna fell to the ground. ",leaped,BEFORE,"Giauna had regained consciousness, and when she saw Kung lying dead beside her she said amid sobs: ""He died for my sake! ",died,169,172,0,5
"Giauna had regained consciousness, and when she saw Kung lying dead beside her she said amid sobs: ""He died for my sake! ",died,BEFORE,"A-Sung also came out, and together they carried him into the cave. ",carried,172,174,5,1
"A-Sung also came out, and together they carried him into the cave. ",carried,BEFORE,Giauna told A-Sung to hold his head while her brother opened his mouth. ,told,174,175,1,0
Giauna told A-Sung to hold his head while her brother opened his mouth. ,told,BEFORE,"She herself took hold of his chin, and brought out her little red pellet. ",brought,175,176,0,1
"She herself took hold of his chin, and brought out her little red pellet. ",brought,BEFORE,"She pressed it against his lips with her own, and breathed into his lungs. ",pressed,176,177,1,0
"She pressed it against his lips with her own, and breathed into his lungs. ",pressed,AFTER,"So there was the whole family reunited again, and none of its members had come to harm. ",come,177,179,0,3
"So there was the whole family reunited again, and none of its members had come to harm. ",come,BEFORE,"They gradually recovered from their fright, and were quite happy: when suddenly a small boy brought the news that Giauna's husband and his whole family had been killed by the thunder. ",brought,179,180,3,2
"They gradually recovered from their fright, and were quite happy: when suddenly a small boy brought the news that Giauna's husband and his whole family had been killed by the thunder. ",brought,BEFORE,"Giauna broke down, weeping, and the others tried to comfort her. ",comfort,180,181,2,2
"Giauna broke down, weeping, and the others tried to comfort her. ",comfort,BEFORE,"Finally Kung said: ""It is not well to dwell too long amid the graves of the dead. ",said,181,182,2,0
"Finally Kung said: ""It is not well to dwell too long amid the graves of the dead. ",said,AFTER,"He assigned a deserted garden, which he carefully walled off, to his friend and his family as a dwelling-place. ",assigned,182,185,0,0
"He assigned a deserted garden, which he carefully walled off, to his friend and his family as a dwelling-place. ",assigned,BEFORE,Only when Kung and A-Sung came to visit them was the bolt drawn. ,came,185,186,0,0
Only when Kung and A-Sung came to visit them was the bolt drawn. ,came,BEFORE,"Then Giauna and her brother played chess, drank tea and chatted with them like members of the same family. ",chatted,186,187,0,1
"Then Giauna and her brother played chess, drank tea and chatted with them like members of the same family. ",chatted,BEFORE,"But Kung's little son had a somewhat pointed face, which resembled a fox's, and when he went along the street, the people would turn around and say: ""There goes the fox-child!""",went,187,188,1,2
