sentence1,event1,te_rel,sentence2,event2,s_id,s_id2,e_id,e_id2
"On his right hand was his only son, Art the Solitary, so called because he had no brothers. ",had,BEFORE,"The sons of Morna, who kept the boy Finn out of his rights and were at the time trying to kill him if they could, were here too. ",kill,3,4,2,3
"The sons of Morna, who kept the boy Finn out of his rights and were at the time trying to kill him if they could, were here too. ",kill,AFTER,"Chief amongst them was Gaul mac Morna, a huge and strong warrior, and Captain of all the Fians ever since that battle in which Finn's father had been killed. ",killed,4,5,3,3
"Chief amongst them was Gaul mac Morna, a huge and strong warrior, and Captain of all the Fians ever since that battle in which Finn's father had been killed. ",killed,BEFORE,"Yet, though it was a great feast, none of these warriors seemed to care about eating or drinking; ",eating,5,9,3,3
"Yet, though it was a great feast, none of these warriors seemed to care about eating or drinking; ",eating,BEFORE,It seemed as if they were expecting some calamity. ,expecting,9,11,3,2
It seemed as if they were expecting some calamity. ,expecting,AFTER,"Gaul mac Morna, Captain of the Fians, sat at the other end of the long table. ",sat,11,13,2,0
"Gaul mac Morna, Captain of the Fians, sat at the other end of the long table. ",sat,BEFORE,"Every warrior wore a bright banqueting mantle of silk or satin, scarlet or crimson, blue, green, or purple, fastened on the breast either with a great brooch or with a pin of gold or silver. ",wore,13,14,0,0
"Every warrior wore a bright banqueting mantle of silk or satin, scarlet or crimson, blue, green, or purple, fastened on the breast either with a great brooch or with a pin of gold or silver. ",wore,BEFORE,"Then was heard a low sound like thunder, and the earth seemed to tremble, and after that they distinctly heard a footfall like the slow, deliberate tread of a giant. ",heard,14,16,0,4
"Then was heard a low sound like thunder, and the earth seemed to tremble, and after that they distinctly heard a footfall like the slow, deliberate tread of a giant. ",heard,BEFORE,"The King leaned past his son Art the Solitary, and said to a certain Druid who sat beside Art, ""Is this the son of Midna come before his time?"" ",come,16,18,4,4
"The King leaned past his son Art the Solitary, and said to a certain Druid who sat beside Art, ""Is this the son of Midna come before his time?"" ",come,BEFORE,"""It is not,"" said the Druid, ""but it is the man who is to conquer Midna. ",said,18,19,4,1
"""It is not,"" said the Druid, ""but it is the man who is to conquer Midna. ",said,AFTER,"Shortly after that they heard the voices of the doorkeepers raised in contention, as if they would repel from the hall someone who wished to enter, then a slight scuffle, and after that a strange figure entered the chamber. ",repel,19,21,1,3
"Shortly after that they heard the voices of the doorkeepers raised in contention, as if they would repel from the hall someone who wished to enter, then a slight scuffle, and after that a strange figure entered the chamber. ",repel,BEFORE,"He stood in the doorway, and cried out in a strong and sonorous, but musical, voice: ""O Conn the Hundred-Fighter, son of Felimy, the righteous son of Tuthal the legitimate, O King of the Kings of Erin, a wronged and disinherited youth, possessing nowhere one rood of his patrimony, a wanderer and an outlaw, a hunter of the wildernesses and mountains, claims hospitality of thee, illustrious prince, on the eve of the great festival of Samhain."" ",possessing,21,29,3,3
"He stood in the doorway, and cried out in a strong and sonorous, but musical, voice: ""O Conn the Hundred-Fighter, son of Felimy, the righteous son of Tuthal the legitimate, O King of the Kings of Erin, a wronged and disinherited youth, possessing nowhere one rood of his patrimony, a wanderer and an outlaw, a hunter of the wildernesses and mountains, claims hospitality of thee, illustrious prince, on the eve of the great festival of Samhain."" ",possessing,BEFORE,"""Thou art welcome whoever thou art,"" answered the King, ""and doubly welcome because thou art unfortunate. ",answered,29,30,3,0
"""Thou art welcome whoever thou art,"" answered the King, ""and doubly welcome because thou art unfortunate. ",answered,BEFORE,"I think, such is thy face and form, that thou art the son of some mighty king on whom disaster has fallen undeserved. ",think,30,31,0,0
"I think, such is thy face and form, that thou art the son of some mighty king on whom disaster has fallen undeserved. ",think,BEFORE,The high gods of Erin grant thee speedy restoration and strong vengeance of thy many wrongs. ,grant,31,32,0,0
The high gods of Erin grant thee speedy restoration and strong vengeance of thy many wrongs. ,grant,BEFORE,"Sit here, O noble youth, between me and my only son, Art, heir to my kingdom."" ",Sit,32,33,0,0
"Sit here, O noble youth, between me and my only son, Art, heir to my kingdom."" ",Sit,BEFORE,"An attendant took his weapons from the youth and hung them on the wall with the rest, and Finn sat down between the King of Ireland and his only son. ",took,33,34,0,0
"An attendant took his weapons from the youth and hung them on the wall with the rest, and Finn sat down between the King of Ireland and his only son. ",took,BEFORE,"Choice food was set before him, which he ate, and old ale, which he drank. ",drank,34,35,0,3
"Choice food was set before him, which he ate, and old ale, which he drank. ",drank,AFTER,From the moment he entered no one thought of anything but of him. ,entered,35,36,3,0
From the moment he entered no one thought of anything but of him. ,entered,BEFORE,"When Finn had made an end of eating and drinking, he said to the King: ""O illustrious prince, though it is not right for a guest to even seem to observe aught that may be awry, or not as it should be, in the hall of his entertainer, yet the sorrow of a kindly host is a sorrow, too, to his guest, and sometimes unawares the man of the house finds succour and help in the stranger. ",said,36,37,0,3
"When Finn had made an end of eating and drinking, he said to the King: ""O illustrious prince, though it is not right for a guest to even seem to observe aught that may be awry, or not as it should be, in the hall of his entertainer, yet the sorrow of a kindly host is a sorrow, too, to his guest, and sometimes unawares the man of the house finds succour and help in the stranger. ",said,BEFORE,"If anyone who is dear to thee and thy people happens to be dead, I can do nothing. ",do,37,39,3,5
"If anyone who is dear to thee and thy people happens to be dead, I can do nothing. ",do,BEFORE,"But I say it, and it is not a vain boast, that even if a person is at the point of death, I can restore him to life and health, for there are marvellous powers of life-giving in my two hands."" ",restore,39,40,5,4
"But I say it, and it is not a vain boast, that even if a person is at the point of death, I can restore him to life and health, for there are marvellous powers of life-giving in my two hands."" ",restore,BEFORE," and why should I not tell a cause of shame, which is known far and wide? ",tell,40,42,4,1
" and why should I not tell a cause of shame, which is known far and wide? ",tell,AFTER,"Descending out of his wizard haunts, he standeth over against the city and shoots balls of fire out of his mouth against it, till it is consumed. ",standeth,42,47,1,1
"Descending out of his wizard haunts, he standeth over against the city and shoots balls of fire out of his mouth against it, till it is consumed. ",standeth,BEFORE,"This annual building of Tara, only to be annually consumed, is a shame to me, and till this enchanter declared war against me, I have lived without reproach."" ",declared,47,49,1,3
"This annual building of Tara, only to be annually consumed, is a shame to me, and till this enchanter declared war against me, I have lived without reproach."" ",declared,BEFORE,"""But,"" said Finn, ""how is it that thy young warriors, valiant and swift, do not repel him, or kill him?"" ",repel,49,50,3,3
"""But,"" said Finn, ""how is it that thy young warriors, valiant and swift, do not repel him, or kill him?"" ",repel,BEFORE,"said Conn, ""all our valour is in vain against this man. ",said,50,52,3,0
"said Conn, ""all our valour is in vain against this man. ",said,AFTER,"Our hosts encompass Tara on all sides, keeping watch and ward when the fatal night comes. ",ward,52,53,0,2
"Our hosts encompass Tara on all sides, keeping watch and ward when the fatal night comes. ",ward,BEFORE,"Then the son of Midna plays on his Druidic instrument of music, on his magic pipe and his magic lyre, and as the fairy music falls on our ears, our eyelids grow heavy, and soon all subside upon the grass in deep slumber. ",falls,53,54,2,1
"Then the son of Midna plays on his Druidic instrument of music, on his magic pipe and his magic lyre, and as the fairy music falls on our ears, our eyelids grow heavy, and soon all subside upon the grass in deep slumber. ",falls,BEFORE,"So comes this man against the city and shoots his fire-balls against it, and utterly consumes it. ",comes,54,55,1,0
"So comes this man against the city and shoots his fire-balls against it, and utterly consumes it. ",comes,AFTER,"Nine years he has burnt Tara in that manner, and this is the tenth. ",burnt,55,56,0,1
"Nine years he has burnt Tara in that manner, and this is the tenth. ",burnt,BEFORE,At midnight to-night he will come and do the same. ,come,56,57,1,1
At midnight to-night he will come and do the same. ,come,AFTER,"Last year (though it was a shame to me that I, who am the high King over all Ireland, should not be able myself to defend Tara) I summoned Gaul mac Morna and all the Fians to my assistance. ",defend,57,58,1,4
"Last year (though it was a shame to me that I, who am the high King over all Ireland, should not be able myself to defend Tara) I summoned Gaul mac Morna and all the Fians to my assistance. ",defend,BEFORE,"They came, but the pipe and lyre of the son of Midna prevailed over them too, so that Tara was burned as at other times. ",burned,58,59,4,3
"They came, but the pipe and lyre of the son of Midna prevailed over them too, so that Tara was burned as at other times. ",burned,BEFORE,"Nor have we any reason to believe that the son of Midna will not burn the city again to-night, as he did last year. ",burn,59,60,3,3
"Nor have we any reason to believe that the son of Midna will not burn the city again to-night, as he did last year. ",burn,BEFORE,All the women and children have been sent out of Tara this day. ,sent,60,61,3,2
All the women and children have been sent out of Tara this day. ,sent,BEFORE,"""What shall be my reward if I kill this man and save Tara?"" ",kill,61,65,2,2
"""What shall be my reward if I kill this man and save Tara?"" ",kill,BEFORE,"""Thy inheritance,"" answered the King, ""be it great or small, and whether it lies in Ireland or beyond Ireland; ",answered,65,67,2,0
"""Thy inheritance,"" answered the King, ""be it great or small, and whether it lies in Ireland or beyond Ireland; ",answered,BEFORE," and for securities I give you my son Art and Gaul mac Morna and the Chief of the Fians."" ",give,67,68,0,0
" and for securities I give you my son Art and Gaul mac Morna and the Chief of the Fians."" ",give,AFTER,"Gaul and the captains of the Fianna consented to that arrangement, though reluctantly, for their minds misgave them as to who the great youth might be. ",misgave,68,69,0,1
"Gaul and the captains of the Fianna consented to that arrangement, though reluctantly, for their minds misgave them as to who the great youth might be. ",misgave,BEFORE,"After that all arose and armed themselves and ringed Tara round with horse and foot, and thrice Conn the Hundred-Fighter raised his awful regal voice, enjoining vigilance upon his people, and thrice Gaul mac Morna did the same, addressing the Fians, and after that they filled their ears with wax and wool, and kept a stern and fierce watch, and many of them thrust the points of their swords into their flesh. ",arose,69,70,1,0
"After that all arose and armed themselves and ringed Tara round with horse and foot, and thrice Conn the Hundred-Fighter raised his awful regal voice, enjoining vigilance upon his people, and thrice Gaul mac Morna did the same, addressing the Fians, and after that they filled their ears with wax and wool, and kept a stern and fierce watch, and many of them thrust the points of their swords into their flesh. ",arose,BEFORE,"Now Finn was alone in the banqueting chamber after the rest had gone out, and he washed his face and his hands in pure water, and he took from the bag that was at his girdle the instruments of divination and magic, which had been his father's, and what use he made of them is not known; ",known,70,71,0,12
"Now Finn was alone in the banqueting chamber after the rest had gone out, and he washed his face and his hands in pure water, and he took from the bag that was at his girdle the instruments of divination and magic, which had been his father's, and what use he made of them is not known; ",known,AFTER," but ere long a man stood before him, holding a spear in one hand and a blue mantle in the other. ",stood,71,72,12,0
" but ere long a man stood before him, holding a spear in one hand and a blue mantle in the other. ",stood,BEFORE,"There were voices in it too, and the war-tunes of the enchanted races of Erin, whom they called the Tuatha De Danan, sounded from it. ",sounded,72,76,0,2
"There were voices in it too, and the war-tunes of the enchanted races of Erin, whom they called the Tuatha De Danan, sounded from it. ",sounded,BEFORE,"The man gave these things to Finn, and when he had instructed him in their use, he was not seen. ",instructed,76,78,2,2
"The man gave these things to Finn, and when he had instructed him in their use, he was not seen. ",instructed,BEFORE,"Then Finn arose and armed himself, and took the magic spear and mantle and went out. ",arose,78,79,2,0
"Then Finn arose and armed himself, and took the magic spear and mantle and went out. ",arose,AFTER,"There was a ring of flame round Tara that night, for the Fians and the warriors of Conn had torches in their hands, and all the royal buildings of Tara showed clear in the light, and also the dark serpentine course of the Boyne, which flowed past Tara on the north; ",had,79,80,0,1
"There was a ring of flame round Tara that night, for the Fians and the warriors of Conn had torches in their hands, and all the royal buildings of Tara showed clear in the light, and also the dark serpentine course of the Boyne, which flowed past Tara on the north; ",had,BEFORE,"Finn stood with his back to the palace, which was called the House-of-the-going-round-of-Mead, between the palace and Conn, and he grasped the magic spear strongly with one hand and the mantle with the other. ",stood,80,82,1,0
"Finn stood with his back to the palace, which was called the House-of-the-going-round-of-Mead, between the palace and Conn, and he grasped the magic spear strongly with one hand and the mantle with the other. ",stood,BEFORE,"As midnight drew nigh, he heard far away in the north, out of the mountains of Slieve Gullion, a fairy tune played, soft, low, and slow, as if on a silver flute; ",heard,82,83,0,1
"As midnight drew nigh, he heard far away in the north, out of the mountains of Slieve Gullion, a fairy tune played, soft, low, and slow, as if on a silver flute; ",heard,BEFORE," and at the same time the roar of Conn the Hundred-Fighter, and the voice of Gaul like thunder, and the responsive shouts of the captains, and the clamour of the host, for the host shouted all together, and clashed their swords against their shields in fierce defiance, when in spite of all obstructions the fairy music of the enchanter began to steal into their souls. ",shouted,83,84,1,0
" and at the same time the roar of Conn the Hundred-Fighter, and the voice of Gaul like thunder, and the responsive shouts of the captains, and the clamour of the host, for the host shouted all together, and clashed their swords against their shields in fierce defiance, when in spite of all obstructions the fairy music of the enchanter began to steal into their souls. ",shouted,BEFORE,Finn put the point of the spear to his forehead. ,put,84,87,0,0
Finn put the point of the spear to his forehead. ,put,BEFORE,"It burned him like fire, yet his stout heart did not fail. ",burned,87,88,0,0
"It burned him like fire, yet his stout heart did not fail. ",burned,AFTER,"Then the roar of the host slowly faded away as in a dream, though the captains were still shouting, and two-thirds of the torches fell to the ground. ",shouting,88,89,0,2
"Then the roar of the host slowly faded away as in a dream, though the captains were still shouting, and two-thirds of the torches fell to the ground. ",shouting,BEFORE,"Finn pressed the cruel spear-head closer to his forehead, and saw every torch fall, save one which wavered as if held by a drunken man, and beneath it a giant figure that reeled and tottered and strove in vain to keep its feet. ",saw,89,91,2,1
"Finn pressed the cruel spear-head closer to his forehead, and saw every torch fall, save one which wavered as if held by a drunken man, and beneath it a giant figure that reeled and tottered and strove in vain to keep its feet. ",saw,BEFORE,As he fell there was a roar as of many waters; ,fell,91,93,1,0
As he fell there was a roar as of many waters; ,fell,BEFORE,Finn passed through the fallen men and stood alone on the dark hill-side. ,stood,93,95,0,2
Finn passed through the fallen men and stood alone on the dark hill-side. ,stood,BEFORE,"He heard the feet of the enchanter splashing through the Boyne, and saw his huge form ascending the slopes of Tara. ",heard,95,96,2,0
"He heard the feet of the enchanter splashing through the Boyne, and saw his huge form ascending the slopes of Tara. ",heard,BEFORE,"When the enchanter saw that all was silent and dark there he laughed and from his mouth blew a red fire-ball at the Teck-Midcuarta, which he was accustomed first to set in flames. ",saw,96,97,0,0
"When the enchanter saw that all was silent and dark there he laughed and from his mouth blew a red fire-ball at the Teck-Midcuarta, which he was accustomed first to set in flames. ",saw,BEFORE,Finn caught the fire-ball in the magic mantle. ,caught,97,98,0,0
Finn caught the fire-ball in the magic mantle. ,caught,AFTER,"The enchanter blew a second and a third, and Finn caught them both. ",blew,98,99,0,0
"The enchanter blew a second and a third, and Finn caught them both. ",blew,BEFORE,"The man saw that his power over Tara was at an end, and that his magic arts had been defeated. ",saw,99,100,0,0
"The man saw that his power over Tara was at an end, and that his magic arts had been defeated. ",saw,BEFORE,"On the third occasion he saw Finn's face, and recognised his conqueror. ",saw,100,101,0,0
"On the third occasion he saw Finn's face, and recognised his conqueror. ",saw,BEFORE,"He turned to flee, and though slow was his coming, swifter than the wind was his going, that he might recover the protection of his enchanted palace before the ""fair-faced youth clad in skins"" should overtake him. ",coming,101,102,0,2
"He turned to flee, and though slow was his coming, swifter than the wind was his going, that he might recover the protection of his enchanted palace before the ""fair-faced youth clad in skins"" should overtake him. ",coming,AFTER,"Finn let fall the mantle as he had been instructed, and pursued him, but in vain. ",instructed,102,103,2,4
"Finn let fall the mantle as he had been instructed, and pursued him, but in vain. ",instructed,BEFORE,Soon he perceived that he could not possibly overtake the swift enchanter. ,overtake,103,104,4,2
Soon he perceived that he could not possibly overtake the swift enchanter. ,overtake,BEFORE,"""Go, then, if thou wilt,"" he said, and, poising, cast the spear from him. ",cast,104,106,2,3
"""Go, then, if thou wilt,"" he said, and, poising, cast the spear from him. ",cast,BEFORE,"Finn followed, and on the threshold of the enchanted palace he found the body of Midna. ",followed,106,109,3,0
"Finn followed, and on the threshold of the enchanted palace he found the body of Midna. ",followed,BEFORE,"Finn drew his sword and cut off the enchanter's head, and returned with it to Tara. ",drew,109,112,0,0
"Finn drew his sword and cut off the enchanter's head, and returned with it to Tara. ",drew,BEFORE,"When he came to the spot where he had dropped the mantle it was not seen, but smoke and flame issued there from a hole in the ground. ",came,112,113,0,0
"When he came to the spot where he had dropped the mantle it was not seen, but smoke and flame issued there from a hole in the ground. ",came,BEFORE,It was called the fire of the son of Midna. ,called,113,115,0,1
It was called the fire of the son of Midna. ,called,BEFORE,"Then the sickness and faintness of death came upon Finn, also a great horror and despair overshadowed him, so that he was about to give himself up for utterly lost. ",overshadowed,115,118,1,1
"Then the sickness and faintness of death came upon Finn, also a great horror and despair overshadowed him, so that he was about to give himself up for utterly lost. ",overshadowed,BEFORE,"Yet he recalled one of his marvellous attributes, and approaching a silver vessel, into which pure water ever flowed and which was always full, he made a cup with his two hands and, lifting it to his mouth, drank, and the blood began to circulate in his veins, and strength returned to his limbs, and the cheerful hue of rosy health to his cheeks. ",drank,118,119,1,6
"Yet he recalled one of his marvellous attributes, and approaching a silver vessel, into which pure water ever flowed and which was always full, he made a cup with his two hands and, lifting it to his mouth, drank, and the blood began to circulate in his veins, and strength returned to his limbs, and the cheerful hue of rosy health to his cheeks. ",drank,BEFORE,"Having rested himself sufficiently he went forth and shouted to the sleeping host, and called the captains by their names, beginning with Conn. ",shouted,119,120,6,3
"Having rested himself sufficiently he went forth and shouted to the sleeping host, and called the captains by their names, beginning with Conn. ",shouted,BEFORE,"They awoke and rose up, though dazed and stupid, for it was difficult for any man, no matter how he had stopped his ears, to avoid hearing Finn when he sent forth his voice of power. ",avoid,120,121,3,6
"They awoke and rose up, though dazed and stupid, for it was difficult for any man, no matter how he had stopped his ears, to avoid hearing Finn when he sent forth his voice of power. ",avoid,BEFORE,"They were astonished to find that Tara was still standing, for though the night was dark, the palaces and temples, all of hewn timber, were brilliantly coloured and of many hues, for in those days men delighted in splendid colours. ",astonished,121,122,6,1
"They were astonished to find that Tara was still standing, for though the night was dark, the palaces and temples, all of hewn timber, were brilliantly coloured and of many hues, for in those days men delighted in splendid colours. ",astonished,AFTER,"When the captains came together Finn said, ""I have slain Midna."" ",slain,122,123,1,3
"When the captains came together Finn said, ""I have slain Midna."" ",slain,BEFORE,"they asked, not because they disbelieved him, but because the heads of men slain in battle were always brought away for trophies. ",disbelieved,123,125,3,1
"they asked, not because they disbelieved him, but because the heads of men slain in battle were always brought away for trophies. ",disbelieved,BEFORE,"Conn and his only son and Gaul mac Morna followed the young hero into the Teck-Midcuarta, where the spear-long waxen candles were still burning, and when they saw the head of Midna impaled there at the end of the hall, the head of the man whom they believed to be immortal and not to be wounded or conquered, they were filled with great joy, and praised their deliverer and paid him many compliments. ",saw,125,127,1,3
"Conn and his only son and Gaul mac Morna followed the young hero into the Teck-Midcuarta, where the spear-long waxen candles were still burning, and when they saw the head of Midna impaled there at the end of the hall, the head of the man whom they believed to be immortal and not to be wounded or conquered, they were filled with great joy, and praised their deliverer and paid him many compliments. ",saw,AFTER,"said Conn. ""Surely thou art the son of some great king or champion, for heroic feats like thine are not performed by the sons of inconsiderable and unknown men."" ",performed,127,129,3,2
"said Conn. ""Surely thou art the son of some great king or champion, for heroic feats like thine are not performed by the sons of inconsiderable and unknown men."" ",performed,BEFORE,"Then Finn flung back his cloak of wild boars' skins, and holding his father's treasure-bag in his hand before them all, cried in a loud voice: ""I am Finn, the son of Cool, the son of Trenmor, the son of Basna; ",holding,129,130,2,1
"Then Finn flung back his cloak of wild boars' skins, and holding his father's treasure-bag in his hand before them all, cried in a loud voice: ""I am Finn, the son of Cool, the son of Trenmor, the son of Basna; ",holding,AFTER, I am he whom the sons of Morna have been seeking to destroy from the time that I was born; ,destroy,130,131,1,4
 I am he whom the sons of Morna have been seeking to destroy from the time that I was born; ,destroy,BEFORE," and here to-night, O King of the Kings of Erin, I claim the fulfilment of thy promise, and the restoration of my inheritance, which is the Fian leadership of Fail."" ",claim,131,132,4,0
