sentence1,event1,te_rel,sentence2,event2,s_id,s_id2,e_id,e_id2
"That done the old man said: ""Go on a bit and you will find a kettle of tar, and bring the kettle to me."" ",bring,AFTER,"The old man continued: ""Now put the kettle on the fire."" ",continued,130,132,5,0
"The old man continued: ""Now put the kettle on the fire."" ",continued,BEFORE,"When the tar began to boil, the old man said: ""Now throw your white lily into the kettle."" ",throw,132,134,0,3
"When the tar began to boil, the old man said: ""Now throw your white lily into the kettle."" ",throw,BEFORE,"The princess thought this a harsh command, and earnestly begged to be allowed to keep the lily. ",thought,134,135,3,0
"The princess thought this a harsh command, and earnestly begged to be allowed to keep the lily. ",thought,AFTER,"But the old man said: ""Did you not promise to obey my every command? ",obey,135,136,0,3
"But the old man said: ""Did you not promise to obey my every command? ",obey,BEFORE,"Do as I tell you or you will regret it."" ",tell,136,137,3,1
"Do as I tell you or you will regret it."" ",tell,AFTER,"The king's daughter turned away her eyes, and threw the lily into the boiling tar; ",turned,137,138,1,0
"The king's daughter turned away her eyes, and threw the lily into the boiling tar; ",turned,AFTER," but it was altogether against her will, so fond had she grown of the beautiful flower. ",grown,138,139,0,2
" but it was altogether against her will, so fond had she grown of the beautiful flower. ",grown,BEFORE,"The moment she did so a hollow roar, like that of some wild beast, sounded from the forest. ",sounded,139,140,2,1
"The moment she did so a hollow roar, like that of some wild beast, sounded from the forest. ",sounded,BEFORE,"Finally there was a cracking and breaking among the trees, the bushes were thrust aside, and the princess saw a great grey wolf come running out of the forest and straight up the hill. ",saw,140,142,1,4
"Finally there was a cracking and breaking among the trees, the bushes were thrust aside, and the princess saw a great grey wolf come running out of the forest and straight up the hill. ",saw,BEFORE,"But the old man said: ""Make haste, run to the edge of the hill and the moment the wolf comes along, upset the kettle on him!"" ",upset,142,144,4,4
"But the old man said: ""Make haste, run to the edge of the hill and the moment the wolf comes along, upset the kettle on him!"" ",upset,BEFORE,"The princess was terrified, and hardly knew what she was about. ",knew,144,145,4,2
"The princess was terrified, and hardly knew what she was about. ",knew,BEFORE,"Yet she did as the old man said, took the kettle, ran to the edge of the hill, and poured its contents over the wolf just as he was about to run up. ",said,145,146,2,1
"Yet she did as the old man said, took the kettle, ran to the edge of the hill, and poured its contents over the wolf just as he was about to run up. ",said,BEFORE,"And then a strange thing happened: no sooner had she done so, than the wolf was transformed, cast off his thick grey pelt, and in place of the horrible wild beast, there stood a handsome young man, looking up to the hill. ",looking,146,147,1,7
"And then a strange thing happened: no sooner had she done so, than the wolf was transformed, cast off his thick grey pelt, and in place of the horrible wild beast, there stood a handsome young man, looking up to the hill. ",looking,AFTER,"And when the king's daughter collected herself and looked at him, she saw that it was really and truly her lover, who had been turned into a werewolf. ",turned,147,148,7,6
"And when the king's daughter collected herself and looked at him, she saw that it was really and truly her lover, who had been turned into a werewolf. ",turned,BEFORE,It is easy to imagine how the princess felt. ,imagine,148,149,6,1
It is easy to imagine how the princess felt. ,imagine,BEFORE,"She opened her arms, and could neither ask questions nor reply to them, so moved and delighted was she. ",reply,149,150,1,3
"She opened her arms, and could neither ask questions nor reply to them, so moved and delighted was she. ",reply,BEFORE,"But the prince ran hastily up the hill, embraced her tenderly, and thanked her for delivering him. ",ran,150,151,3,0
"But the prince ran hastily up the hill, embraced her tenderly, and thanked her for delivering him. ",ran,BEFORE,"Nor did he forget the little old man, but thanked him with many civil expressions for his powerful aid. ",thanked,151,152,0,2
"Nor did he forget the little old man, but thanked him with many civil expressions for his powerful aid. ",thanked,AFTER,"The prince told how he had been turned into a wolf, and of all he had suffered while running about in the forest; ",turned,152,154,2,3
"The prince told how he had been turned into a wolf, and of all he had suffered while running about in the forest; ",turned,BEFORE," and the princess told of her grief, and the many tears she had shed while he had been gone. ",told,154,155,3,0
" and the princess told of her grief, and the many tears she had shed while he had been gone. ",told,BEFORE,"Then the old man said: ""Lovely maiden, turn around! ",said,155,159,0,0
"Then the old man said: ""Lovely maiden, turn around! ",said,AFTER,"Do you see anything out yonder?"" ",see,159,160,0,1
"Do you see anything out yonder?"" ",see,BEFORE,"""Yes,"" said the princess, ""I see a horseman on a foaming horse, riding as fast as he can."" ",riding,160,161,1,3
"""Yes,"" said the princess, ""I see a horseman on a foaming horse, riding as fast as he can."" ",riding,AFTER,"Then the old man said: ""He is a messenger sent on ahead by the king your father. ",sent,161,162,3,2
"Then the old man said: ""He is a messenger sent on ahead by the king your father. ",sent,BEFORE,"And your father with all his army is following him."" ",following,162,163,2,1
"And your father with all his army is following him."" ",following,BEFORE,"That pleased the princess above all things, and she wanted to descend the hill at once to meet her father. ",wanted,163,164,1,1
"That pleased the princess above all things, and she wanted to descend the hill at once to meet her father. ",wanted,BEFORE,"But the old man detained her and said: ""Wait a while, it is too early yet. ",said,164,165,1,1
"But the old man detained her and said: ""Wait a while, it is too early yet. ",said,AFTER,"Do you see anything down below?"" ",see,165,169,1,1
"Do you see anything down below?"" ",see,BEFORE,"""Yes,"" replied the princess, ""I see a number of people coming out of my father's castle, and some are going along the road, and others into the forest."" ",replied,169,170,1,0
"""Yes,"" replied the princess, ""I see a number of people coming out of my father's castle, and some are going along the road, and others into the forest."" ",replied,BEFORE,"The old man said: ""Those are your step-mother's servants. ",said,170,171,0,0
"The old man said: ""Those are your step-mother's servants. ",said,AFTER,"She has sent some to meet the king and welcome him but she has sent others to the forest to look for you."" ",meet,171,172,0,2
"She has sent some to meet the king and welcome him but she has sent others to the forest to look for you."" ",meet,BEFORE,"At these words the princess grew uneasy, and wished to go down to the queen's servants. ",wished,172,173,2,1
"At these words the princess grew uneasy, and wished to go down to the queen's servants. ",wished,BEFORE,"But the old man withheld her and said: ""Wait a while, and let us first see how everything turns out."" ",said,173,174,1,1
"But the old man withheld her and said: ""Wait a while, and let us first see how everything turns out."" ",said,BEFORE,"More time passed, and the king's daughter was still looking down the road from which the king would appear, when the old man said: ""Lovely maiden, turn around! ",said,174,175,1,5
"More time passed, and the king's daughter was still looking down the road from which the king would appear, when the old man said: ""Lovely maiden, turn around! ",said,BEFORE,"""Yes,"" answered the princess, ""there is a great commotion in my father's castle, and they are hanging it with black."" ",answered,175,177,5,0
"""Yes,"" answered the princess, ""there is a great commotion in my father's castle, and they are hanging it with black."" ",answered,BEFORE,"The old man said: ""That is your step-mother and her people. ",said,177,178,0,0
"The old man said: ""That is your step-mother and her people. ",said,BEFORE,"They will assure your father that you are dead."" ",assure,178,179,0,1
"They will assure your father that you are dead."" ",assure,BEFORE,"Then the king's daughter felt bitter anguish, and she implored from the depths of her heart: ""Let me go, let me go, so that I may spare my father this anguish!"" ",let,179,180,1,4
"Then the king's daughter felt bitter anguish, and she implored from the depths of her heart: ""Let me go, let me go, so that I may spare my father this anguish!"" ",let,BEFORE,"But the old man detained her and said: ""No, wait, it is still too early. ",said,180,181,4,1
"But the old man detained her and said: ""No, wait, it is still too early. ",said,AFTER,"The royal maid and youth still sat on the hill-top with the old man, where we had left them. ",sat,181,184,1,0
"The royal maid and youth still sat on the hill-top with the old man, where we had left them. ",sat,BEFORE,"Then they saw a little cloud rise against the horizon, far away in the distance, and the little cloud grew larger and larger, and came nearer and nearer along the road, and as it moved one could see it was agleam with weapons, and nodding helmets, and waving flags, one could hear the rattle of swords, and the neighing of horses, and finally recognize the banner of the king. ",recognize,184,185,0,11
"Then they saw a little cloud rise against the horizon, far away in the distance, and the little cloud grew larger and larger, and came nearer and nearer along the road, and as it moved one could see it was agleam with weapons, and nodding helmets, and waving flags, one could hear the rattle of swords, and the neighing of horses, and finally recognize the banner of the king. ",recognize,BEFORE,"It is not hard to imagine how pleased the king's daughter was, and how she insisted on going down and greeting her father. ",imagine,185,186,11,1
"It is not hard to imagine how pleased the king's daughter was, and how she insisted on going down and greeting her father. ",imagine,BEFORE,"But the old man held her back and said: ""Lovely maiden, turn around! ",said,186,187,1,1
"But the old man held her back and said: ""Lovely maiden, turn around! ",said,AFTER,"Do you see anything happening at the castle?"" ",see,187,188,1,1
"Do you see anything happening at the castle?"" ",see,BEFORE,"""Yes,"" answered the princess, ""I can see my step-mother and step-sisters coming out, dressed in mourning, holding white kerchiefs to their faces, and weeping bitterly."" ",answered,188,189,1,0
"""Yes,"" answered the princess, ""I can see my step-mother and step-sisters coming out, dressed in mourning, holding white kerchiefs to their faces, and weeping bitterly."" ",answered,BEFORE,"The old man answered: ""Now they are pretending to weep because of your death. ",answered,189,190,0,0
"The old man answered: ""Now they are pretending to weep because of your death. ",answered,BEFORE,"After a time the old man said again: ""Lovely maiden, turn around! ",said,190,193,0,0
"After a time the old man said again: ""Lovely maiden, turn around! ",said,AFTER,"""Yes,"" said the princess, ""I see people bringing a black coffin-now my father is having it opened. ",bringing,193,195,0,2
"""Yes,"" said the princess, ""I see people bringing a black coffin-now my father is having it opened. ",bringing,BEFORE,"Look, the queen and her daughters are down on their knees, and my father is threatening them with his sword!"" ",threatening,195,196,2,3
"Look, the queen and her daughters are down on their knees, and my father is threatening them with his sword!"" ",threatening,AFTER,"Then the old man said: ""Your father wished to see your body, and so your evil step-mother had to confess the truth."" ",wished,196,197,3,1
"Then the old man said: ""Your father wished to see your body, and so your evil step-mother had to confess the truth."" ",wished,BEFORE,"When the princess heard that she said earnestly: ""Let me go, let me go, so that I may comfort my father in his great sorrow!"" ",Let,197,198,1,2
"When the princess heard that she said earnestly: ""Let me go, let me go, so that I may comfort my father in his great sorrow!"" ",Let,BEFORE,"But the old man held her back and said: ""Take my advice and stay here a little while longer. ",said,198,199,2,1
"But the old man held her back and said: ""Take my advice and stay here a little while longer. ",said,AFTER,"Again time went by, and the king's daughter and the prince and the old man were still sitting on the hill-top. ",sitting,199,201,1,2
"Again time went by, and the king's daughter and the prince and the old man were still sitting on the hill-top. ",sitting,BEFORE,"""Yes,"" answered the princess, ""I see my father and my step-sisters and my step-mother with all their following moving this way."" ",answered,201,204,2,0
"""Yes,"" answered the princess, ""I see my father and my step-sisters and my step-mother with all their following moving this way."" ",answered,BEFORE,"The old man said: ""Now they have started out to look for you. ",said,204,205,0,0
"The old man said: ""Now they have started out to look for you. ",said,AFTER,The king's daughter did as he told her. ,told,205,207,0,1
The king's daughter did as he told her. ,told,BEFORE,"The old man continued: ""Now stand at the edge of the hill."" ",continued,207,208,1,0
"The old man continued: ""Now stand at the edge of the hill."" ",continued,BEFORE,"Now one could see the queen and her daughters coming along the way, and stopping just below the hill. ",coming,208,210,0,2
"Now one could see the queen and her daughters coming along the way, and stopping just below the hill. ",coming,BEFORE,"Then the old man said: ""Now throw down the wolf's pelt!"" ",said,210,211,2,0
"Then the old man said: ""Now throw down the wolf's pelt!"" ",said,BEFORE,"The princess obeyed him, and threw down the wolf's pelt according to his command. ",obeyed,211,212,0,0
"The princess obeyed him, and threw down the wolf's pelt according to his command. ",obeyed,BEFORE,It fell directly on the evil queen and her daughters. ,fell,212,213,0,0
It fell directly on the evil queen and her daughters. ,fell,BEFORE,"And then a most wonderful thing happened: no sooner had the pelt touched the three evil women than they immediately changed shape, and turning into three horrible werewolves, they ran away as fast as they could into the forest, howling dreadfully. ",howling,213,214,0,7
"And then a most wonderful thing happened: no sooner had the pelt touched the three evil women than they immediately changed shape, and turning into three horrible werewolves, they ran away as fast as they could into the forest, howling dreadfully. ",howling,BEFORE,"When he looked up and recognized the princess, he could not at first believe his eyes; ",looked,214,216,7,0
"When he looked up and recognized the princess, he could not at first believe his eyes; ",looked,BEFORE," but stood motionless, thinking her a vision. ",thinking,216,217,0,1
" but stood motionless, thinking her a vision. ",thinking,BEFORE,"Then the old man cried: ""Lovely maiden, now hasten, run down and make your father happy!"" ",cried,217,218,1,0
"Then the old man cried: ""Lovely maiden, now hasten, run down and make your father happy!"" ",cried,BEFORE,There was no need to tell the princess twice. ,tell,218,219,0,1
There was no need to tell the princess twice. ,tell,BEFORE,She took her lover by the hand and they ran down the hill. ,took,219,220,1,0
She took her lover by the hand and they ran down the hill. ,took,BEFORE,"When they came to the king, the princess ran on ahead, fell on her father's neck, and wept with joy. ",wept,220,221,0,3
"When they came to the king, the princess ran on ahead, fell on her father's neck, and wept with joy. ",wept,BEFORE,"And the young prince wept as well, and the king himself wept; ",wept,221,222,3,0
"And the young prince wept as well, and the king himself wept; ",wept,BEFORE,"There was great joy and many embraces, and the princess told of her evil step-mother and step-sisters and of her lover, and all that she had suffered, and of the old man who had helped them in such a wonderful way. ",told,222,224,0,1
"There was great joy and many embraces, and the princess told of her evil step-mother and step-sisters and of her lover, and all that she had suffered, and of the old man who had helped them in such a wonderful way. ",told,BEFORE,"But when the king turned around to thank the old man he had completely vanished, and from that day on no one could say who he had been or what had become of him. ",say,224,225,1,5
"But when the king turned around to thank the old man he had completely vanished, and from that day on no one could say who he had been or what had become of him. ",say,BEFORE,"The king and his whole retinue now returned to the castle, where the king had a splendid banquet prepared, to which he invited all the able and distinguished people throughout the kingdom, and bestowed his daughter on the young prince. ",returned,225,226,5,0
"The king and his whole retinue now returned to the castle, where the king had a splendid banquet prepared, to which he invited all the able and distinguished people throughout the kingdom, and bestowed his daughter on the young prince. ",returned,BEFORE,And I was told they were none other than the evil step-mother and her two daughters.,told,226,229,0,1
