sentence1,event1,te_rel,sentence2,event2,s_id,s_id2,e_id,e_id2
"Once upon a time there was a king, who reigned over a great kingdom. ",reigned,BEFORE,"He had a queen, but only a single daughter, a girl. ",had,0,1,1,0
"He had a queen, but only a single daughter, a girl. ",had,BEFORE,"They loved her above everything else in the world, and their dearest thought was the pleasure they would take in her when she was older. ",loved,1,3,0,0
"They loved her above everything else in the world, and their dearest thought was the pleasure they would take in her when she was older. ",loved,BEFORE,"Before the king's daughter began to grow up, the queen her mother fell ill and died. ",began,3,5,0,0
"Before the king's daughter began to grow up, the queen her mother fell ill and died. ",began,AFTER, for the queen had been beloved of all. ,beloved,5,7,0,2
 for the queen had been beloved of all. ,beloved,BEFORE,"The king grieved so that he would not marry again, and his one joy was the little princess. ",grieved,7,8,2,0
"The king grieved so that he would not marry again, and his one joy was the little princess. ",grieved,BEFORE,"A long time passed, and with each succeeding day the king's daughter grew taller and more beautiful, and her father granted her every wish. ",grew,8,9,0,2
"A long time passed, and with each succeeding day the king's daughter grew taller and more beautiful, and her father granted her every wish. ",grew,AFTER,Among them was a woman who had formerly married and had two daughters. ,had,9,11,2,3
Among them was a woman who had formerly married and had two daughters. ,had,BEFORE,"Now when the queen died, she at once began to plan how she might marry the king, so that her daughters might be kept like royal princesses. ",marry,11,14,3,4
"Now when the queen died, she at once began to plan how she might marry the king, so that her daughters might be kept like royal princesses. ",marry,BEFORE,"With this end in view, she drew the young princess to her. ",drew,14,15,4,0
"With this end in view, she drew the young princess to her. ",drew,AFTER,"She paid her the most fulsome compliments on everything she said and did, and was forever bringing the conversation around to how happy she would be were the king to take another wife. ",did,15,16,0,2
"She paid her the most fulsome compliments on everything she said and did, and was forever bringing the conversation around to how happy she would be were the king to take another wife. ",did,BEFORE,"There was much said on this head, early and late, and before very long the princess came to believe that the woman knew all there was to know about everything. ",came,16,17,2,2
"There was much said on this head, early and late, and before very long the princess came to believe that the woman knew all there was to know about everything. ",came,BEFORE,So she asked her what sort of a woman the king ought to choose for a wife. ,asked,17,18,2,0
So she asked her what sort of a woman the king ought to choose for a wife. ,asked,BEFORE,"The woman answered as sweet as honey: ""It is not my affair to give advice in this matter; ",answered,18,19,0,0
"The woman answered as sweet as honey: ""It is not my affair to give advice in this matter; ",answered,BEFORE, yet he should choose for queen some one who is kind to the little princess. ,choose,19,20,0,1
 yet he should choose for queen some one who is kind to the little princess. ,choose,BEFORE,"For one thing I know, and that is, were I fortunate enough to be chosen, my one thought would be to do all I could for the little princess, and if she wished to wash her hands, one of my daughters would have to hold the wash-bowl and the other hand her the towel."" ",wished,20,21,1,9
"For one thing I know, and that is, were I fortunate enough to be chosen, my one thought would be to do all I could for the little princess, and if she wished to wash her hands, one of my daughters would have to hold the wash-bowl and the other hand her the towel."" ",wished,BEFORE,"This and much more she told the king's daughter, and the princess believed it, as children will. ",told,21,22,9,0
"This and much more she told the king's daughter, and the princess believed it, as children will. ",told,BEFORE,"From that day forward the princess gave her father no peace, and begged him again and again to marry the good court lady. ",marry,22,23,0,2
"From that day forward the princess gave her father no peace, and begged him again and again to marry the good court lady. ",marry,BEFORE,Yet he did not want to marry her. ,marry,23,24,2,2
Yet he did not want to marry her. ,marry,BEFORE,But the king's daughter gave him no rest. ,gave,24,25,2,0
But the king's daughter gave him no rest. ,gave,BEFORE,"She urged him again and again, as the false court lady had persuaded her to do. ",urged,25,26,0,0
"She urged him again and again, as the false court lady had persuaded her to do. ",urged,BEFORE,"Finally, one day, when she again brought up the matter, the king cried: ""I can see you will end by having your own way about this, even though it be entirely against my will. ",end,26,27,0,5
"Finally, one day, when she again brought up the matter, the king cried: ""I can see you will end by having your own way about this, even though it be entirely against my will. ",end,BEFORE,"But I will do so only on one condition."" ",do,27,28,5,1
"But I will do so only on one condition."" ",do,AFTER,asked the princess. ,asked,28,30,1,0
asked the princess. ,asked,BEFORE,"""If I marry again,"" said the king, ""it is only because of your ceaseless pleading. ",said,30,31,0,1
"""If I marry again,"" said the king, ""it is only because of your ceaseless pleading. ",said,BEFORE,"Therefore you must promise that, if in the future you are not satisfied with your step-mother or your step-sisters, not a single lament or complaint on your part reaches my ears."" ",promise,31,32,1,1
"Therefore you must promise that, if in the future you are not satisfied with your step-mother or your step-sisters, not a single lament or complaint on your part reaches my ears."" ",promise,BEFORE,"This she promised the king, and it was agreed that he should marry the court lady and make her queen of the whole country. ",marry,32,33,1,4
"This she promised the king, and it was agreed that he should marry the court lady and make her queen of the whole country. ",marry,AFTER,"As time passed on, the king's daughter had grown to be the most beautiful maiden to be found far and wide. ",grown,33,34,4,2
"As time passed on, the king's daughter had grown to be the most beautiful maiden to be found far and wide. ",grown,BEFORE,"The queen's daughters, on the other hand, were homely, evil of disposition, and no one knew any good of them. ",knew,34,35,2,1
"The queen's daughters, on the other hand, were homely, evil of disposition, and no one knew any good of them. ",knew,BEFORE,Hence it was not surprising that many youths came from East and West to sue for the princess's hand; ,came,35,36,1,1
Hence it was not surprising that many youths came from East and West to sue for the princess's hand; ,came,BEFORE, but that none of them took any interest in the queen's daughters. ,took,36,37,1,0
 but that none of them took any interest in the queen's daughters. ,took,BEFORE,This made the step-mother very angry;.,made,37,38,0,0
This made the step-mother very angry;.,made,BEFORE,"She concealed her rage, and was as sweet and friendly as ever. ",concealed,38,40,0,0
"She concealed her rage, and was as sweet and friendly as ever. ",concealed,AFTER,"He was young and brave, and since he loved the princess dearly, she accepted his proposal and they plighted their troth. ",loved,40,42,0,1
"He was young and brave, and since he loved the princess dearly, she accepted his proposal and they plighted their troth. ",loved,BEFORE,"The queen observed this with an angry eye, for it would have pleased her had the prince chosen one of her own daughters. ",pleased,42,43,1,3
"The queen observed this with an angry eye, for it would have pleased her had the prince chosen one of her own daughters. ",pleased,BEFORE,"She therefor made up her mind that the young pair should never be happy together, and from that time on thought only of how she might part them from each other. ",part,43,44,3,4
"She therefor made up her mind that the young pair should never be happy together, and from that time on thought only of how she might part them from each other. ",part,BEFORE,"News came that the enemy had entered the land, and the king was compelled to go to war. ",came,44,46,4,0
"News came that the enemy had entered the land, and the king was compelled to go to war. ",came,BEFORE,Now the princess began to find out the kind of step-mother she had. ,began,46,47,0,0
Now the princess began to find out the kind of step-mother she had. ,began,AFTER,"For no sooner had the king departed than the queen showed her true nature, and was just as harsh and unkind as she formerly had pretended to be friendly and obliging. ",pretended,47,48,0,5
"For no sooner had the king departed than the queen showed her true nature, and was just as harsh and unkind as she formerly had pretended to be friendly and obliging. ",pretended,BEFORE,Not a day went by without her scolding and threatening the princess and the queen's daughters were every bit as malicious as their mother. ,threatening,48,49,5,2
Not a day went by without her scolding and threatening the princess and the queen's daughters were every bit as malicious as their mother. ,threatening,BEFORE,"But the king's son, the lover of the princess, found himself in even worse position. ",found,49,50,2,0
"But the king's son, the lover of the princess, found himself in even worse position. ",found,AFTER,"He had gone hunting one day, had lost his way, and could not find his people. ",lost,50,51,0,4
"He had gone hunting one day, had lost his way, and could not find his people. ",lost,BEFORE,"Then the queen used her black arts and turned him into a werewolf, to wander through the forest for the remainder of his life in that shape. ",turned,51,52,4,1
"Then the queen used her black arts and turned him into a werewolf, to wander through the forest for the remainder of his life in that shape. ",turned,BEFORE,"When evening came and there was no sign of the prince, his people returned home, and one can imagine what sorrow they caused when the princess learned how the hunt had ended. ",imagine,52,53,1,4
"When evening came and there was no sign of the prince, his people returned home, and one can imagine what sorrow they caused when the princess learned how the hunt had ended. ",imagine,BEFORE,"She grieved, wept day and night, and was not to be consoled. ",grieved,53,54,4,0
"She grieved, wept day and night, and was not to be consoled. ",grieved,BEFORE,"But the queen laughed at her grief, and her heart was filled with joy to think that all had turned out exactly as she wished. ",think,54,55,0,3
"But the queen laughed at her grief, and her heart was filled with joy to think that all had turned out exactly as she wished. ",think,BEFORE,"Now it chanced one day, as the king's daughter was sitting alone in her room, that she thought she would go herself into the forest where the prince had disappeared. ",thought,55,56,3,3
"Now it chanced one day, as the king's daughter was sitting alone in her room, that she thought she would go herself into the forest where the prince had disappeared. ",thought,BEFORE,"She went to her step-mother and begged permission to go out into the forest, in order to forget her surpassing grief. ",forget,56,57,3,3
"She went to her step-mother and begged permission to go out into the forest, in order to forget her surpassing grief. ",forget,BEFORE,"The queen did not want to grant her request, for she always preferred saying no to yes. ",want,57,58,3,1
"The queen did not want to grant her request, for she always preferred saying no to yes. ",want,BEFORE,"But the princess begged her so winningly that at last she was unable to say no, and she ordered one of her daughters to go along with her and watch her. ",ordered,58,59,1,3
"But the princess begged her so winningly that at last she was unable to say no, and she ordered one of her daughters to go along with her and watch her. ",ordered,AFTER,"That caused a great deal of discussion, for neither of the step-daughters wanted to go with her. ",wanted,59,60,3,1
"That caused a great deal of discussion, for neither of the step-daughters wanted to go with her. ",wanted,BEFORE,"Each made all sorts of excuses, and asked what pleasures were there in going with the king's daughter, who did nothing but cry. ",asked,60,61,1,1
"Each made all sorts of excuses, and asked what pleasures were there in going with the king's daughter, who did nothing but cry. ",asked,BEFORE,"But the queen had the last word in the end, and ordered that one of her daughters must accompany the princess, even though it be against her will. ",ordered,61,62,1,1
"But the queen had the last word in the end, and ordered that one of her daughters must accompany the princess, even though it be against her will. ",ordered,BEFORE,So the girls wandered out of the castle into the forest. ,wandered,62,63,1,0
So the girls wandered out of the castle into the forest. ,wandered,AFTER,"The king's daughter walked among the trees, and listened to the song of the birds, and thought of her lover, for whom she longed, and who was now no longer there. ",longed,63,64,0,2
"The king's daughter walked among the trees, and listened to the song of the birds, and thought of her lover, for whom she longed, and who was now no longer there. ",longed,BEFORE,"And the queen's daughter followed her, vexed, in her malice, with the king's daughter and her sorrow. ",followed,64,65,2,0
"And the queen's daughter followed her, vexed, in her malice, with the king's daughter and her sorrow. ",followed,BEFORE,"After they had walked a while, they came to a little hut, lying deep in the dark forest. ",came,65,66,0,2
"After they had walked a while, they came to a little hut, lying deep in the dark forest. ",came,AFTER,"But the queen's daughter was much annoyed and said: ""Is it not enough for me to be running around here in the wilderness with you? ",running,66,68,2,4
"But the queen's daughter was much annoyed and said: ""Is it not enough for me to be running around here in the wilderness with you? ",running,BEFORE,"Now you even want me, who am a princess, to enter that wretched little hut. ",want,68,69,4,0
"Now you even want me, who am a princess, to enter that wretched little hut. ",want,BEFORE,"No, I will not step a foot over the threshold! ",step,69,70,0,1
"No, I will not step a foot over the threshold! ",step,AFTER,The king's daughter lost no time; ,lost,70,72,1,0
The king's daughter lost no time; ,lost,AFTER," but did as her step-sister advised, and stepped into the little hut. ",advised,72,73,0,1
" but did as her step-sister advised, and stepped into the little hut. ",advised,BEFORE,"When she entered she saw an old woman sitting there on a bench, so enfeebled by age that her head shook. ",saw,73,74,1,1
"When she entered she saw an old woman sitting there on a bench, so enfeebled by age that her head shook. ",saw,BEFORE,"The princess spoke to her in her usual friendly way: ""Good evening, motherkin. ",spoke,74,75,1,0
"The princess spoke to her in her usual friendly way: ""Good evening, motherkin. ",spoke,BEFORE,"May I ask you for a drink of water?"" ",ask,75,76,0,1
"May I ask you for a drink of water?"" ",ask,BEFORE,"""You are heartily welcome to it,"" said the old woman. ",said,76,77,1,1
"""You are heartily welcome to it,"" said the old woman. ",said,AFTER,"""Who may you be, that step beneath my lowly roof and greet me in so winning a way?"" ",greet,77,78,1,2
"""Who may you be, that step beneath my lowly roof and greet me in so winning a way?"" ",greet,BEFORE,"The king's daughter told her who she was, and that she had gone out to relieve her heart, in order to forget her great grief. ",told,78,79,2,0
"The king's daughter told her who she was, and that she had gone out to relieve her heart, in order to forget her great grief. ",told,BEFORE,asked the old woman. ,asked,79,81,0,0
asked the old woman. ,asked,BEFORE,"""No doubt it is my fate to grieve,"" said the princess, ""and I can never be happy again. ",said,81,82,0,2
"""No doubt it is my fate to grieve,"" said the princess, ""and I can never be happy again. ",said,AFTER,"I have lost my only love, and God alone knows whether I shall ever see him again."" ",lost,82,83,2,1
"I have lost my only love, and God alone knows whether I shall ever see him again."" ",lost,BEFORE,"And she also told her why it was, and the tears ran down her cheeks in streams, so that any one would have felt sorry for her. ",told,83,84,1,0
"And she also told her why it was, and the tears ran down her cheeks in streams, so that any one would have felt sorry for her. ",told,BEFORE,"When she had ended the old woman said: ""You did well in confiding your sorrow to me. ",did,84,85,0,3
"When she had ended the old woman said: ""You did well in confiding your sorrow to me. ",did,BEFORE,I have lived long and may be able to give you a bit of good advice. ,give,85,86,3,4
I have lived long and may be able to give you a bit of good advice. ,give,BEFORE,When you leave here you will see a lily growing from the ground. ,leave,86,87,4,0
When you leave here you will see a lily growing from the ground. ,leave,BEFORE,"If you can do that then you need not worry, for then one will appear who will tell you what to do."" ",appear,87,90,0,5
"If you can do that then you need not worry, for then one will appear who will tell you what to do."" ",appear,AFTER,Then they parted and the king's daughter thanked her and went her way; ,thanked,90,91,5,1
Then they parted and the king's daughter thanked her and went her way; ,thanked,AFTER, while the old woman sat on the bench and wagged her head. ,sat,91,92,1,0
 while the old woman sat on the bench and wagged her head. ,sat,BEFORE,"But the queen's daughter had been standing without the hut the entire time, vexing herself, and grumbling because the king's daughter had taken so long. ",vexing,92,93,0,3
"But the queen's daughter had been standing without the hut the entire time, vexing herself, and grumbling because the king's daughter had taken so long. ",vexing,BEFORE,"So when the latter stepped out, she had to listen to all sorts of abuse from her step-sister, as was to be expected. ",listen,93,94,3,2
"So when the latter stepped out, she had to listen to all sorts of abuse from her step-sister, as was to be expected. ",listen,BEFORE,"Yet she paid no attention to her, and thought only of how she might find the flower of which the old woman had spoken. ",thought,94,95,2,1
"Yet she paid no attention to her, and thought only of how she might find the flower of which the old woman had spoken. ",thought,BEFORE,"They went through the forest, and suddenly she saw a beautiful white lily growing in their very path. ",saw,95,96,1,1
"They went through the forest, and suddenly she saw a beautiful white lily growing in their very path. ",saw,BEFORE,She was much pleased and ran up at once to pick it; ,pick,96,97,1,2
She was much pleased and ran up at once to pick it; ,pick,BEFORE,"The king's daughter was now filled with eagerness, no longer listened to her step-sister's calls, and kept right on running. ",running,97,99,2,4
"The king's daughter was now filled with eagerness, no longer listened to her step-sister's calls, and kept right on running. ",running,BEFORE,"Yet each time when she stooped to pick the lily, it suddenly disappeared and reappeared somewhat further away. ",pick,99,100,4,1
"Yet each time when she stooped to pick the lily, it suddenly disappeared and reappeared somewhat further away. ",pick,BEFORE,"Thus it went for some time, and the princess was drawn further and further into the deep forest. ",drawn,100,101,1,2
"Thus it went for some time, and the princess was drawn further and further into the deep forest. ",drawn,BEFORE,"At length the princess came to a high hill, and as she looked toward its summit, there stood the lily high on the naked rock, glittering as white and radiant as the brightest star. ",looked,101,103,2,1
"At length the princess came to a high hill, and as she looked toward its summit, there stood the lily high on the naked rock, glittering as white and radiant as the brightest star. ",looked,BEFORE,"The king's daughter now began to climb the hill, and in her eagerness she paid no attention to stones nor steepness. ",paid,103,104,1,2
"The king's daughter now began to climb the hill, and in her eagerness she paid no attention to stones nor steepness. ",paid,BEFORE,"And when at last she reached the summit of the hill, lo and behold! ",reached,104,105,2,0
"And when at last she reached the summit of the hill, lo and behold! ",reached,AFTER,the lily no longer evaded her grasp; ,evaded,105,106,0,0
the lily no longer evaded her grasp; ,evaded,BEFORE," but remained where it was, and the princess stooped and picked it and hid it in her bosom, and so heartfelt was her happiness that she forgot her step-sisters and everything else in the world. ",picked,106,107,0,3
" but remained where it was, and the princess stooped and picked it and hid it in her bosom, and so heartfelt was her happiness that she forgot her step-sisters and everything else in the world. ",picked,BEFORE,For a long time she did not tire of looking at the beautiful flower. ,tire,107,108,3,1
For a long time she did not tire of looking at the beautiful flower. ,tire,BEFORE,Then she suddenly began to wonder what her step-mother would say when she came home after having remained out so long. ,came,108,109,1,4
Then she suddenly began to wonder what her step-mother would say when she came home after having remained out so long. ,came,AFTER,"Below her lay the forest, so dark and shadowed that she had no faith in her ability to find the homeward path. ",had,109,112,4,2
"Below her lay the forest, so dark and shadowed that she had no faith in her ability to find the homeward path. ",had,BEFORE,"And now she grew very sad, for she could think of nothing better to do than to spend the night on the hill-top. ",grew,112,113,2,0
"And now she grew very sad, for she could think of nothing better to do than to spend the night on the hill-top. ",grew,BEFORE,"She seated herself on the rock, put her hand to her cheek, cried, and thought of her unkind step-mother and step-sisters, and of all the harsh words she would have to endure when she returned. ",cried,113,114,0,2
"She seated herself on the rock, put her hand to her cheek, cried, and thought of her unkind step-mother and step-sisters, and of all the harsh words she would have to endure when she returned. ",cried,BEFORE,"And she thought of her father, the king, who was away at war, and of the love of her heart, whom she would never see again. ",see,114,115,2,3
"And she thought of her father, the king, who was away at war, and of the love of her heart, whom she would never see again. ",see,BEFORE,She grieved so bitterly that she did not even know she wept. ,grieved,115,116,3,0
She grieved so bitterly that she did not even know she wept. ,grieved,BEFORE,"Night came and darkness, and the stars rose, and still the princess sat in the same spot and wept. ",sat,116,117,0,2
"Night came and darkness, and the stars rose, and still the princess sat in the same spot and wept. ",sat,BEFORE,"And while she sat there, lost in her thoughts, she heard a voice say: ""Good evening, lovely maiden! ",sat,117,118,2,0
"And while she sat there, lost in her thoughts, she heard a voice say: ""Good evening, lovely maiden! ",sat,BEFORE,"She stood up hastily, and felt much embarrassed, which was not surprising. ",felt,118,120,0,1
"She stood up hastily, and felt much embarrassed, which was not surprising. ",felt,BEFORE,"When she looked around there was nothing to be seen but a tiny old man, who nodded to her and seemed to be very humble. ",nodded,120,121,1,4
"When she looked around there was nothing to be seen but a tiny old man, who nodded to her and seemed to be very humble. ",nodded,BEFORE,"She answered: ""Yes, it is no doubt my fate to grieve, and never be happy again. ",grieve,121,122,4,2
"She answered: ""Yes, it is no doubt my fate to grieve, and never be happy again. ",grieve,AFTER,"I have lost my dearest love, and now I have lost my way in the forest, and am afraid of being devoured by wild beasts."" ",lost,122,123,2,1
"I have lost my dearest love, and now I have lost my way in the forest, and am afraid of being devoured by wild beasts."" ",lost,BEFORE,"""As to that,"" said the old man, ""you need have no fear. ",said,123,124,1,0
"""As to that,"" said the old man, ""you need have no fear. ",said,BEFORE,"If you will do exactly as I say, I will help you."" ",help,124,125,0,4
"If you will do exactly as I say, I will help you."" ",help,AFTER,This made the princess happy; ,made,125,126,4,0
This made the princess happy; ,made,AFTER, for she felt that all the rest of the world had abandoned her. ,felt,126,127,0,0
 for she felt that all the rest of the world had abandoned her. ,felt,BEFORE,"Then the old man drew out flint and steel and said: ""Lovely maiden, you must first build a fire."" ",build,127,128,0,3
"Then the old man drew out flint and steel and said: ""Lovely maiden, you must first build a fire."" ",build,BEFORE,"She did as he told her, gathered moss, brush and dry sticks, struck sparks and lit such a fire on the hill-top that the flame blazed up to the skies. ",told,128,129,3,1
"She did as he told her, gathered moss, brush and dry sticks, struck sparks and lit such a fire on the hill-top that the flame blazed up to the skies. ",told,BEFORE,"That done the old man said: ""Go on a bit and you will find a kettle of tar, and bring the kettle to me."" ",bring,129,130,1,5
