sentence1,event1,te_rel,sentence2,event2,s_id,s_id2,e_id,e_id2
"And when the three princesses saw who it was, they were full of joy, leaped up from their places, and ran over to him, much to the king's surprise, who asked what it all meant. ",saw,AFTER,"Then the youngest princess told him all that had happened, from beginning to end, and that Silverwhite had rescued them, while the courtier sat in a tree. ",rescued,135,136,0,5
"Then the youngest princess told him all that had happened, from beginning to end, and that Silverwhite had rescued them, while the courtier sat in a tree. ",rescued,AFTER,"To prove it beyond any chance of doubt, each of the king's daughters showed her father the ring she had wound in Silverwhite's locks. ",wound,136,137,5,3
"To prove it beyond any chance of doubt, each of the king's daughters showed her father the ring she had wound in Silverwhite's locks. ",wound,BEFORE,"But the king still did not know quite what to think of it all, until Silverwhite said: ""My lord king! ",said,137,138,3,3
"But the king still did not know quite what to think of it all, until Silverwhite said: ""My lord king! ",said,AFTER,"In order that you need not doubt what your daughters have told you, I will show you the eyes of the sea-trolls whom I slew."" ",told,138,139,3,3
"In order that you need not doubt what your daughters have told you, I will show you the eyes of the sea-trolls whom I slew."" ",told,BEFORE,Then the king and all the rest saw that the princesses had told the truth. ,saw,139,140,3,0
Then the king and all the rest saw that the princesses had told the truth. ,saw,BEFORE,The traitorous courtier received his just punishment. ,received,140,141,0,0
The traitorous courtier received his just punishment. ,received,AFTER,"Silverwhite was paid every honor, and was given the youngest daughter and half of the kingdom with her. ",paid,141,142,0,1
"Silverwhite was paid every honor, and was given the youngest daughter and half of the kingdom with her. ",paid,BEFORE,"One night, when all were sleeping, it chanced that he heard a knocking at the window, and a voice which said: ""Come, Silverwhite, I have to talk to you!"" ",talk,142,143,1,7
"One night, when all were sleeping, it chanced that he heard a knocking at the window, and a voice which said: ""Come, Silverwhite, I have to talk to you!"" ",talk,BEFORE,"The king, who did not want to wake his young wife, rose hastily, girded on his sword, called his dogs and went out. ",rose,143,144,7,3
"The king, who did not want to wake his young wife, rose hastily, girded on his sword, called his dogs and went out. ",rose,BEFORE,"When he reached the open air, there stood a huge and savage-looking troll. ",reached,144,145,3,0
"When he reached the open air, there stood a huge and savage-looking troll. ",reached,BEFORE,"The troll said: ""Silverwhite, you have slain my three brothers, and I have come to bid you go down to the sea-shore with me, that we may fight with one another."" ",come,145,146,0,4
"The troll said: ""Silverwhite, you have slain my three brothers, and I have come to bid you go down to the sea-shore with me, that we may fight with one another."" ",come,BEFORE,"This proposal suited the youth, and he followed the troll without protest. ",suited,146,147,4,0
"This proposal suited the youth, and he followed the troll without protest. ",suited,BEFORE,"When they reached the sea-shore, there lay three great dogs belonging to the troll. ",lay,147,148,0,1
"When they reached the sea-shore, there lay three great dogs belonging to the troll. ",lay,BEFORE,Silverwhite at once set his dogs at the troll-dogs. ,set,148,149,1,0
Silverwhite at once set his dogs at the troll-dogs. ,set,BEFORE,"The young king drew his sword, bravely attacked the troll and dealt him many a mighty blow. ",drew,149,151,0,0
"The young king drew his sword, bravely attacked the troll and dealt him many a mighty blow. ",drew,BEFORE,"But when the troll noticed he was getting the worst of it, he grew frightened, quickly ran to a high tree, and clambered into it. ",ran,151,153,0,4
"But when the troll noticed he was getting the worst of it, he grew frightened, quickly ran to a high tree, and clambered into it. ",ran,BEFORE,"Then the troll begged for his life and said: ""Dear Silverwhite, I will take wergild for my brothers, only bid your dogs be still, so that we may talk."" ",bid,153,155,4,4
"Then the troll begged for his life and said: ""Dear Silverwhite, I will take wergild for my brothers, only bid your dogs be still, so that we may talk."" ",bid,BEFORE,"The king bade his dogs be still, but in vain, they only barked the more loudly. ",bade,155,156,4,0
"The king bade his dogs be still, but in vain, they only barked the more loudly. ",bade,BEFORE,"Then the troll tore three hairs from his head, handed them to Silverwhite and said: ""Lay a hair on each of the dogs, and then they will be as quiet as can be."" ",said,156,157,0,2
"Then the troll tore three hairs from his head, handed them to Silverwhite and said: ""Lay a hair on each of the dogs, and then they will be as quiet as can be."" ",said,BEFORE,Now Silverwhite realized that he had been deceived; ,realized,157,159,2,0
Now Silverwhite realized that he had been deceived; ,realized,BEFORE,"The troll was already descending from the tree, and he drew his sword and again began to fight. ",drew,159,161,0,2
"The troll was already descending from the tree, and he drew his sword and again began to fight. ",drew,BEFORE,"But they had exchanged no more than a few blows, before Silverwhite received a mortal wound, and lay on the earth in a pool of blood. ",lay,161,162,2,3
"But they had exchanged no more than a few blows, before Silverwhite received a mortal wound, and lay on the earth in a pool of blood. ",lay,BEFORE,But now we must tell about Lillwacker. ,tell,162,163,3,1
But now we must tell about Lillwacker. ,tell,AFTER,The next morning he went to the spring by the cross-road and found it red with blood. ,found,163,164,1,1
The next morning he went to the spring by the cross-road and found it red with blood. ,found,BEFORE,Then he knew that Silverwhite was dead. ,knew,164,165,1,0
Then he knew that Silverwhite was dead. ,knew,BEFORE,"He called his dogs, hung his sword at his side, and went on until he came to a great city. ",hung,165,166,0,1
"He called his dogs, hung his sword at his side, and went on until he came to a great city. ",hung,AFTER,"Lillwacker asked why everybody was so happy, and they said: ""You must hail from distant parts, since you do not know that a famous hero has come here by the name of Silverwhite. ",come,166,168,1,8
"Lillwacker asked why everybody was so happy, and they said: ""You must hail from distant parts, since you do not know that a famous hero has come here by the name of Silverwhite. ",come,BEFORE,"He has rescued our three princesses, and is now the king's son-in-law."" ",rescued,168,169,8,1
"He has rescued our three princesses, and is now the king's son-in-law."" ",rescued,BEFORE,"Lillwacker then inquired how it had all come about, and then went his way, reaching the royal castle in which Silverwhite dwelt with his beautiful queen in the evening. ",went,169,170,1,3
"Lillwacker then inquired how it had all come about, and then went his way, reaching the royal castle in which Silverwhite dwelt with his beautiful queen in the evening. ",went,BEFORE,"When Lillwacker entered the castle gate, all greeted him as though he had been the king. ",greeted,170,171,3,1
"When Lillwacker entered the castle gate, all greeted him as though he had been the king. ",greeted,AFTER,For he resembled his foster-brother so closely that none could tell one from the other. ,tell,171,172,1,2
For he resembled his foster-brother so closely that none could tell one from the other. ,tell,BEFORE,"When the youth came to the queen's room, she also took him for Silverwhite. ",took,172,173,2,1
"When the youth came to the queen's room, she also took him for Silverwhite. ",took,BEFORE,"She went up to him and said: ""My lord king, where have you been so long? ",said,173,174,1,1
"She went up to him and said: ""My lord king, where have you been so long? ",said,AFTER,"I have been awaiting you with great anxiety."" ",awaiting,174,175,1,2
"I have been awaiting you with great anxiety."" ",awaiting,BEFORE,"Lillwacker said little, and was very taciturn. ",said,175,176,2,0
"Lillwacker said little, and was very taciturn. ",said,BEFORE,The young woman did not know what to think of his actions. ,know,176,178,0,1
The young woman did not know what to think of his actions. ,know,AFTER,Her husband did not act queerly at other times. ,act,178,179,1,1
Her husband did not act queerly at other times. ,act,BEFORE,"But she thought: ""One should not try to discover the secrets of others,"" and said nothing. ",thought,179,180,1,0
"But she thought: ""One should not try to discover the secrets of others,"" and said nothing. ",thought,BEFORE,"In the night, when all were sleeping, there was a knocking at the window, and a voice cried: ""Come, Lillwacker, I have to talk to you!"" ",talk,180,181,0,6
"In the night, when all were sleeping, there was a knocking at the window, and a voice cried: ""Come, Lillwacker, I have to talk to you!"" ",talk,BEFORE,"The youth rose hastily, took his good sword, called his dogs and went. ",went,181,182,6,3
"The youth rose hastily, took his good sword, called his dogs and went. ",went,BEFORE,"When he reached the open air, there stood the same troll who had slain Silverwhite. ",reached,182,183,3,0
"When he reached the open air, there stood the same troll who had slain Silverwhite. ",reached,BEFORE,"He said: ""Come with me, Lillwacker, and then you shall see your foster-brother!"" ",said,183,184,0,0
"He said: ""Come with me, Lillwacker, and then you shall see your foster-brother!"" ",said,BEFORE,"To this Lillwacker at once agreed, and the troll led the way. ",led,184,185,0,1
"To this Lillwacker at once agreed, and the troll led the way. ",led,AFTER,"When they came to the sea-shore, there lay the three great dogs whom the troll had brought with him. ",brought,185,186,1,3
"When they came to the sea-shore, there lay the three great dogs whom the troll had brought with him. ",brought,BEFORE,"Somewhat further away, where they had fought, lay Silverwhite in a pool of blood, and beside him his dogs were stretched out on the ground as though they had taken root in it. ",lay,186,187,3,2
"Somewhat further away, where they had fought, lay Silverwhite in a pool of blood, and beside him his dogs were stretched out on the ground as though they had taken root in it. ",lay,BEFORE,"Then Lillwacker saw how everything had happened, and thought that he would gladly venture his life, if he might in some way call his brother back from the dead. ",saw,187,188,2,0
"Then Lillwacker saw how everything had happened, and thought that he would gladly venture his life, if he might in some way call his brother back from the dead. ",saw,BEFORE,"He at once set his dogs at the troll-dogs, and they had a hard struggle, in which Lillwacker's dogs won the victory. ",set,188,189,0,0
"He at once set his dogs at the troll-dogs, and they had a hard struggle, in which Lillwacker's dogs won the victory. ",set,BEFORE,"Then the youth drew his sword, and attacked the troll with mighty blows. ",drew,189,190,0,0
"Then the youth drew his sword, and attacked the troll with mighty blows. ",drew,BEFORE,"But when the troll saw that he was getting the worst of it, he took refuge in a lofty tree. ",saw,190,191,0,0
"But when the troll saw that he was getting the worst of it, he took refuge in a lofty tree. ",saw,BEFORE,Lillwacker and his dogs ran after him and the dogs barked loudly. ,ran,191,192,0,0
Lillwacker and his dogs ran after him and the dogs barked loudly. ,ran,BEFORE,"Then the troll humbly begged for his life, and said: ""Dear Lillwacker, I will give you wergild for your brother, only bid your dogs be still, so that we may talk."" ",bid,192,193,0,4
"Then the troll humbly begged for his life, and said: ""Dear Lillwacker, I will give you wergild for your brother, only bid your dogs be still, so that we may talk."" ",bid,BEFORE,"At the same time the troll handed him three hairs from his head and added: ""Lay one of these hairs on each of your dogs, and then they will soon be quiet."" ",Lay,193,194,4,2
"At the same time the troll handed him three hairs from his head and added: ""Lay one of these hairs on each of your dogs, and then they will soon be quiet."" ",Lay,BEFORE,"But Lillwacker saw through his cunning scheme, took the three hairs and laid them on the troll-dogs, which at once fell on the ground and lay like dead. ",saw,194,195,2,0
"But Lillwacker saw through his cunning scheme, took the three hairs and laid them on the troll-dogs, which at once fell on the ground and lay like dead. ",saw,BEFORE,"When the troll saw that his attempt had failed, he was much alarmed and said: ""Dearest Lillwacker, I will give you wergild for your brother, if you will only leave me alone."" ",leave,195,196,0,8
"When the troll saw that his attempt had failed, he was much alarmed and said: ""Dearest Lillwacker, I will give you wergild for your brother, if you will only leave me alone."" ",leave,BEFORE,"But the youth answered: ""What is there you can give me that will compensate for my brother's life?"" ",answered,196,197,8,0
"But the youth answered: ""What is there you can give me that will compensate for my brother's life?"" ",answered,BEFORE,"The troll replied: ""Here are two flasks. ",replied,197,198,0,0
"The troll replied: ""Here are two flasks. ",replied,BEFORE,"In one is a liquid which, if you anoint a dead man with it, it will restore him to life. ",anoint,198,199,0,1
"In one is a liquid which, if you anoint a dead man with it, it will restore him to life. ",anoint,AFTER,"As to the liquid in the other flask, if you moisten anything with it, and some one touches the place you have moistened, he will be unable to move from the spot. ",moisten,199,200,1,0
"As to the liquid in the other flask, if you moisten anything with it, and some one touches the place you have moistened, he will be unable to move from the spot. ",moisten,BEFORE,"I think it would be hard to find anything more precious than the liquid in these flasks."" ",think,200,201,0,0
"I think it would be hard to find anything more precious than the liquid in these flasks."" ",think,AFTER,"Lillwacker said: ""Your proposal suits me, and I will accept it. ",suits,201,202,0,1
"Lillwacker said: ""Your proposal suits me, and I will accept it. ",suits,BEFORE,"But there is something else you must promise to do: that you will release my brother's dogs."" ",promise,202,203,1,2
"But there is something else you must promise to do: that you will release my brother's dogs."" ",promise,BEFORE,"The troll agreed, climbed down from the tree, breathed on the dogs and thus freed them. ",agreed,203,204,2,0
"The troll agreed, climbed down from the tree, breathed on the dogs and thus freed them. ",agreed,BEFORE,Then Lillwacker took the two flasks and went away from the sea-shore with the troll. ,took,204,205,0,0
Then Lillwacker took the two flasks and went away from the sea-shore with the troll. ,took,BEFORE,Lillwacker hastened on in advance and moistened it with liquid from the second flask. ,moistened,205,207,0,1
Lillwacker hastened on in advance and moistened it with liquid from the second flask. ,moistened,BEFORE,"Then, as he was going by, Lillwacker suddenly set all six of his dogs at the troll, who stepped back and touched the stone. ",set,207,208,1,2
"Then, as he was going by, Lillwacker suddenly set all six of his dogs at the troll, who stepped back and touched the stone. ",set,BEFORE,"There he stuck, and could move neither forward nor backward. ",stuck,208,209,2,0
"There he stuck, and could move neither forward nor backward. ",stuck,BEFORE,And when the troll saw the sun he burst--and was as dead as a doornail! ,saw,209,211,0,0
And when the troll saw the sun he burst--and was as dead as a doornail! ,saw,BEFORE,"Lillwacker now ran back to his brother and sprinkled him with the liquid in the other flask, so that he came to life again, and they were both very happy, as may well be imagined. ",sprinkled,211,212,0,1
"Lillwacker now ran back to his brother and sprinkled him with the liquid in the other flask, so that he came to life again, and they were both very happy, as may well be imagined. ",sprinkled,BEFORE,"The two foster-brothers then returned to the castle, recounting the story of their experiences and adventures on the way. ",returned,212,213,1,0
"The two foster-brothers then returned to the castle, recounting the story of their experiences and adventures on the way. ",returned,BEFORE,Lillwacker told how he had been taken for his brother. ,told,213,214,0,0
Lillwacker told how he had been taken for his brother. ,told,AFTER,"He even mentioned that he had lain down on a couch in a corner of the queen's room, and that she had never suspected that he was not her rightful husband. ",suspected,214,215,0,4
"He even mentioned that he had lain down on a couch in a corner of the queen's room, and that she had never suspected that he was not her rightful husband. ",suspected,BEFORE,"But when Silverwhite heard that, he thought that Lillwacker had offended against the queen's dignity, and he grew angry and fell into such a rage that he drew his sword, and thrust it into his brother's breast. ",drew,215,216,4,6
"But when Silverwhite heard that, he thought that Lillwacker had offended against the queen's dignity, and he grew angry and fell into such a rage that he drew his sword, and thrust it into his brother's breast. ",drew,BEFORE,"Lillwacker fell to earth dead, and Silverwhite went home to the castle alone. ",fell,216,217,6,0
"Lillwacker fell to earth dead, and Silverwhite went home to the castle alone. ",fell,BEFORE,"But Lillwacker's dogs would not leave their master, and lay around him, whining and licking his wound. ",lay,217,218,0,2
"But Lillwacker's dogs would not leave their master, and lay around him, whining and licking his wound. ",lay,BEFORE,"In the evening, when the young king and his wife retired, the queen asked him why he had been so taciturn and serious the evening before. ",asked,218,219,2,1
"In the evening, when the young king and his wife retired, the queen asked him why he had been so taciturn and serious the evening before. ",asked,BEFORE,"Then the queen said: ""I am very curious to know what has befallen you during the last few days, but what I would like to know most of all, is why you lay down on a couch in a corner of my room the other night?"" ",know,219,220,1,2
"Then the queen said: ""I am very curious to know what has befallen you during the last few days, but what I would like to know most of all, is why you lay down on a couch in a corner of my room the other night?"" ",know,AFTER,"Now it was clear to Silverwhite that the brother he had slain was innocent of all offense, and he felt bitter regret at having repaid his faithfulness so badly. ",slain,220,221,2,2
"Now it was clear to Silverwhite that the brother he had slain was innocent of all offense, and he felt bitter regret at having repaid his faithfulness so badly. ",slain,BEFORE,So King Silverwhite at once rose and went to the place where his brother was lying. ,rose,221,222,2,0
So King Silverwhite at once rose and went to the place where his brother was lying. ,rose,BEFORE,He poured the water of life from his flask and anointed his brother's wound. ,anointed,222,223,0,1
He poured the water of life from his flask and anointed his brother's wound. ,anointed,BEFORE,"In a moment Lillwacker was alive again, and the two brother's went joyfully back to the castle. ",went,223,224,1,1
"In a moment Lillwacker was alive again, and the two brother's went joyfully back to the castle. ",went,AFTER,"When they got there, Silverwhite told his queen how Lillwacker had rescued him from death, and all the rest of their adventures, and all were happy at the royal court. ",rescued,224,225,1,3
"When they got there, Silverwhite told his queen how Lillwacker had rescued him from death, and all the rest of their adventures, and all were happy at the royal court. ",rescued,BEFORE,They paid the youth the greatest honors and compliments. ,paid,225,226,3,0
They paid the youth the greatest honors and compliments. ,paid,BEFORE,After he had stayed there a time he sued for the hand of the second princess and obtained it. ,sued,226,227,0,2
After he had stayed there a time he sued for the hand of the second princess and obtained it. ,sued,BEFORE,"Thereupon the wedding was celebrated with great pomp, and Silverwhite divided his half of the kingdom with his foster-brother. ",divided,227,228,2,2
"Thereupon the wedding was celebrated with great pomp, and Silverwhite divided his half of the kingdom with his foster-brother. ",divided,BEFORE,"The two brothers continued to live together in peace and unity, and if they have not died, they are living still.",died,228,229,2,3
