sentence1,event1,te_rel,sentence2,event2,s_id,s_id2,e_id,e_id2
"""You silly old man,"" said she, ""Why did you not bring the large box? ",bring,BEFORE,"she screamed, and then went to bed as angry as she could be. ",screamed,106,110,2,0
"she screamed, and then went to bed as angry as she could be. ",screamed,BEFORE,"The old man now wished that he had said nothing about the big box, but it was too late; ",said,110,111,0,2
"The old man now wished that he had said nothing about the big box, but it was too late; ",said,BEFORE," the greedy old woman, not contented with the good luck which had so unexpectedly befallen them and which she so little deserved, made up her mind, if possible, to get more. ",contented,111,112,2,0
" the greedy old woman, not contented with the good luck which had so unexpectedly befallen them and which she so little deserved, made up her mind, if possible, to get more. ",contented,BEFORE,Early the next morning she got up and made the old man describe the way to the sparrow's house. ,describe,112,113,0,2
Early the next morning she got up and made the old man describe the way to the sparrow's house. ,describe,BEFORE,"When he saw what was in her mind he tried to keep her from going, but it was useless. ",saw,113,114,2,0
"When he saw what was in her mind he tried to keep her from going, but it was useless. ",saw,BEFORE,She would not listen to one word he said. ,said,114,115,0,2
She would not listen to one word he said. ,said,AFTER,It is strange that the old woman did not feel ashamed of going to see the sparrow after the cruel way she had treated her in cutting off her tongue in a fit of rage. ,treated,115,116,2,6
It is strange that the old woman did not feel ashamed of going to see the sparrow after the cruel way she had treated her in cutting off her tongue in a fit of rage. ,treated,BEFORE,But her greed to get the big box made her forget everything else. ,forget,116,117,6,2
But her greed to get the big box made her forget everything else. ,forget,BEFORE,"It did not even enter her thoughts that the sparrows might be angry with her-as, indeed, they were-and might punish her for what she had done. ",punish,117,118,2,6
"It did not even enter her thoughts that the sparrows might be angry with her-as, indeed, they were-and might punish her for what she had done. ",punish,AFTER,"Ever since the Lady Sparrow had returned home in the sad plight in which they had first found her, weeping and bleeding from the mouth, her whole family and relations had done little else but speak of the cruelty of the old woman. ",speak,118,119,6,7
"Ever since the Lady Sparrow had returned home in the sad plight in which they had first found her, weeping and bleeding from the mouth, her whole family and relations had done little else but speak of the cruelty of the old woman. ",speak,BEFORE,"""How could she,"" they asked each other, ""inflict such a heavy punishment for such a trifling offense as that of eating some rice-paste by mistake?"" ",asked,119,120,7,1
"""How could she,"" they asked each other, ""inflict such a heavy punishment for such a trifling offense as that of eating some rice-paste by mistake?"" ",asked,BEFORE,"They all loved the old man who was so kind and good and patient under all his troubles, but the old woman they hated, and they determined, if ever they had the chance, to punish her as she deserved. ",punish,120,121,1,5
"They all loved the old man who was so kind and good and patient under all his troubles, but the old woman they hated, and they determined, if ever they had the chance, to punish her as she deserved. ",punish,AFTER,"After walking for some hours the old woman had at last found the bamboo grove which she had made her husband carefully describe, and now she stood before it crying out: ""Where is the tongue-cut sparrow's house? ",describe,121,123,5,5
"After walking for some hours the old woman had at last found the bamboo grove which she had made her husband carefully describe, and now she stood before it crying out: ""Where is the tongue-cut sparrow's house? ",describe,BEFORE,At last she saw the eaves of the house peeping out from amongst the bamboo foliage. ,saw,123,125,5,0
At last she saw the eaves of the house peeping out from amongst the bamboo foliage. ,saw,BEFORE,She hastened to the door and knocked loudly. ,hastened,125,126,0,0
She hastened to the door and knocked loudly. ,hastened,BEFORE,"When the servants told the Lady Sparrow that her old mistress was at the door asking to see her, she was somewhat surprised at the unexpected visit, after all that had taken place, and she wondered not a little at the boldness of the old woman in venturing to come to the house. ",wondered,126,127,0,7
"When the servants told the Lady Sparrow that her old mistress was at the door asking to see her, she was somewhat surprised at the unexpected visit, after all that had taken place, and she wondered not a little at the boldness of the old woman in venturing to come to the house. ",wondered,BEFORE,"The Lady Sparrow, however, was a polite bird, and so she went out to greet the old woman, remembering that she had once been her mistress. ",greet,127,128,7,2
"The Lady Sparrow, however, was a polite bird, and so she went out to greet the old woman, remembering that she had once been her mistress. ",greet,BEFORE,"The old woman intended, however, to waste no time in words, she went right to the point, without the least shame, and said: ""You need not trouble to entertain me as you did my old man. ",entertain,128,129,2,5
"The old woman intended, however, to waste no time in words, she went right to the point, without the least shame, and said: ""You need not trouble to entertain me as you did my old man. ",entertain,BEFORE,I have come myself to get the box which he so stupidly left behind. ,come,129,130,5,1
I have come myself to get the box which he so stupidly left behind. ,come,BEFORE,"I shall soon take my leave if you will give me the big box-that is all I want!"" ",want,130,131,1,5
"I shall soon take my leave if you will give me the big box-that is all I want!"" ",want,BEFORE,"The Lady Sparrow at once consented, and told her servants to bring out the big box. ",told,131,132,5,1
"The Lady Sparrow at once consented, and told her servants to bring out the big box. ",told,BEFORE,"The old woman eagerly seized it and hoisted it on her back, and without even stopping to thank the Lady Sparrow began to hurry homewards. ",thank,132,133,1,3
"The old woman eagerly seized it and hoisted it on her back, and without even stopping to thank the Lady Sparrow began to hurry homewards. ",thank,AFTER,"The box was so heavy that she could not walk fast, much less run, as she would have liked to do, so anxious was she to get home and see what was inside the box, but she had often to sit down and rest herself by the way. ",rest,133,134,3,14
"The box was so heavy that she could not walk fast, much less run, as she would have liked to do, so anxious was she to get home and see what was inside the box, but she had often to sit down and rest herself by the way. ",rest,BEFORE,"While she was staggering along under the heavy load, her desire to open the box became too great to be resisted. ",resisted,134,135,14,4
"While she was staggering along under the heavy load, her desire to open the box became too great to be resisted. ",resisted,AFTER,"She could wait no longer, for she supposed this big box to be full of gold and silver and precious jewels like the small one her husband had received. ",received,135,136,4,5
"She could wait no longer, for she supposed this big box to be full of gold and silver and precious jewels like the small one her husband had received. ",received,BEFORE,"At last this greedy and selfish old woman put down the box by the wayside and opened it carefully, expecting to gloat her eyes on a mine of wealth. ",opened,136,137,5,1
"At last this greedy and selfish old woman put down the box by the wayside and opened it carefully, expecting to gloat her eyes on a mine of wealth. ",opened,BEFORE,"What she saw, however, so terrified her that she nearly lost her senses. ",saw,137,138,1,0
"What she saw, however, so terrified her that she nearly lost her senses. ",saw,BEFORE,"As soon as she lifted the lid, a number of horrible and frightful looking demons bounced out of the box and surrounded her as if they intended to kill her. ",intended,138,139,0,4
"As soon as she lifted the lid, a number of horrible and frightful looking demons bounced out of the box and surrounded her as if they intended to kill her. ",intended,BEFORE,"A demon with one huge eye right in the middle of its forehead came and glared at her, monsters with gaping mouths looked as if they would devour her, a huge snake coiled and hissed about her, and a big frog hopped and croaked towards her. ",looked,139,141,4,2
"A demon with one huge eye right in the middle of its forehead came and glared at her, monsters with gaping mouths looked as if they would devour her, a huge snake coiled and hissed about her, and a big frog hopped and croaked towards her. ",looked,BEFORE,"The old woman had never been so frightened in her life, and ran from the spot as fast as her quaking legs would carry her, glad to escape alive. ",carry,141,142,2,4
"The old woman had never been so frightened in her life, and ran from the spot as fast as her quaking legs would carry her, glad to escape alive. ",carry,BEFORE,"When she reached home she fell to the floor and told her husband with tears all that had happened to her, and how she had been nearly killed by the demons in the box. ",told,142,143,4,2
"When she reached home she fell to the floor and told her husband with tears all that had happened to her, and how she had been nearly killed by the demons in the box. ",told,BEFORE,"Then she began to blame the sparrow, but the old man stopped her at once, saying: ""Don't blame the sparrow, it is your wickedness which has at last met with its reward. ",stopped,143,144,2,2
"Then she began to blame the sparrow, but the old man stopped her at once, saying: ""Don't blame the sparrow, it is your wickedness which has at last met with its reward. ",stopped,BEFORE,"I only hope this may be a lesson to you in the future!"" ",hope,144,145,2,0
"I only hope this may be a lesson to you in the future!"" ",hope,AFTER,"The old woman said nothing more, and from that day she repented of her cross, unkind ways, and by degrees became a good old woman, so that her husband hardly knew her to be the same person, and they spent their last days together happily, free from want or care, spending carefully the treasure the old man had received from his pet, the tongue-cut sparrow.",received,145,146,0,8
