sentence1,event1,te_rel,sentence2,event2,s_id,s_id2,e_id,e_id2
As the kind general gradually unfolded his plan the mother's heart was filled with a great joy. ,unfolded,BEFORE,She saw that here was a wonderful chance of the one wish of her life being fulfilled-that of seeing Kintaro a samurai before she died. ,saw,174,175,0,0
She saw that here was a wonderful chance of the one wish of her life being fulfilled-that of seeing Kintaro a samurai before she died. ,saw,BEFORE,"Bowing her head to the ground, she replied: ""I will then entrust my son to you if you really mean what you say."" ",say,175,176,0,5
"Bowing her head to the ground, she replied: ""I will then entrust my son to you if you really mean what you say."" ",say,AFTER,Kintaro had all this time been sitting by his mother's side listening to what they said. ,listening,176,177,5,3
Kintaro had all this time been sitting by his mother's side listening to what they said. ,listening,BEFORE,"When his mother finished speaking, he exclaimed: ""Oh, joy! ",exclaimed,177,178,3,2
"When his mother finished speaking, he exclaimed: ""Oh, joy! ",exclaimed,BEFORE,"I am to go with the general and one day I shall be a samurai!"" ",go,178,180,2,1
"I am to go with the general and one day I shall be a samurai!"" ",go,AFTER,"Thus Kintaro's fate was settled, and the general decided to start for the Capital at once, taking Kintaro with him. ",settled,180,181,1,1
"Thus Kintaro's fate was settled, and the general decided to start for the Capital at once, taking Kintaro with him. ",settled,AFTER,"It need hardly be said that Yama-uba was sad at parting with her boy, for he was all that was left to her. ",left,181,182,1,7
"It need hardly be said that Yama-uba was sad at parting with her boy, for he was all that was left to her. ",left,BEFORE,But she hid her grief with a strong face. ,hid,182,183,7,0
But she hid her grief with a strong face. ,hid,BEFORE,She knew that it was for her boy's good that he should leave her now. ,leave,183,184,0,3
She knew that it was for her boy's good that he should leave her now. ,leave,BEFORE,She must not discourage him just as he was setting out. ,discourage,184,185,3,1
She must not discourage him just as he was setting out. ,discourage,BEFORE,"Kintaro promised never to forget her, and said that as soon as he was a knight wearing two swords he would build her a home and take care of her in her old age. ",build,185,186,1,6
"Kintaro promised never to forget her, and said that as soon as he was a knight wearing two swords he would build her a home and take care of her in her old age. ",build,AFTER,"All the animals, those he had tamed to serve him, the bear, the deer, the monkey, and the hare, as soon as they found out that he was going away, came to ask if they might attend him as usual. ",tamed,186,187,6,1
"All the animals, those he had tamed to serve him, the bear, the deer, the monkey, and the hare, as soon as they found out that he was going away, came to ask if they might attend him as usual. ",tamed,BEFORE,When they learned that he was going away for good they followed him to the foot of the mountain to see him off. ,followed,187,188,1,3
When they learned that he was going away for good they followed him to the foot of the mountain to see him off. ,followed,BEFORE,"""Kimbo,"" said his mother, ""mind and be a good boy."" ",said,188,189,3,0
"""Kimbo,"" said his mother, ""mind and be a good boy."" ",said,BEFORE,"""Mr. Kintaro,"" said the faithful animals, ""we wish you good health on your travels."" ",wish,189,190,0,1
"""Mr. Kintaro,"" said the faithful animals, ""we wish you good health on your travels."" ",wish,BEFORE,Then they all climbed a tree to see the last of him. ,see,190,191,1,1
Then they all climbed a tree to see the last of him. ,see,BEFORE,"From that height they watched him and his shadow gradually grow smaller and smaller, till he was lost to sight. ",watched,191,192,1,0
"From that height they watched him and his shadow gradually grow smaller and smaller, till he was lost to sight. ",watched,AFTER,The general Sadamitsu went on his way rejoicing at having so unexpectedly found such a prodigy as Kintaro. ,found,192,193,0,3
The general Sadamitsu went on his way rejoicing at having so unexpectedly found such a prodigy as Kintaro. ,found,BEFORE,"Having arrived at their destination the general took Kintaro at once to his Lord, Minamoto-no-Raiko. ",took,193,194,3,2
"Having arrived at their destination the general took Kintaro at once to his Lord, Minamoto-no-Raiko. ",took,BEFORE,He told him all about Kintaro and how he had found the child. ,told,194,195,2,0
He told him all about Kintaro and how he had found the child. ,told,BEFORE,"Lord Raiko was delighted with the story, and having commanded Kintaro to be brought to him, made him one of his vassals at once. ",brought,195,196,0,4
"Lord Raiko was delighted with the story, and having commanded Kintaro to be brought to him, made him one of his vassals at once. ",brought,BEFORE,These warriors were chosen by himself from amongst the bravest and strongest of his soldiers. ,chosen,196,198,4,1
These warriors were chosen by himself from amongst the bravest and strongest of his soldiers. ,chosen,BEFORE,When Kintaro grew up to be a man his master made him the Chief of the Four Braves. ,made,198,200,1,2
When Kintaro grew up to be a man his master made him the Chief of the Four Braves. ,made,BEFORE,"Soon after this event, news was brought to the city that a cannibal monster had taken up his abode not far away and that people were stricken with fear. ",stricken,200,202,2,5
"Soon after this event, news was brought to the city that a cannibal monster had taken up his abode not far away and that people were stricken with fear. ",stricken,BEFORE,Lord Raiko ordered Kintaro to the rescue. ,ordered,202,203,5,0
Lord Raiko ordered Kintaro to the rescue. ,ordered,BEFORE,"He immediately started off, delighted at the prospect of trying his sword. ",trying,203,204,0,1
"He immediately started off, delighted at the prospect of trying his sword. ",trying,BEFORE,"Surprising the monster in its den, he made short work of cutting off its great head, which he carried back in triumph to his master. ",Surprising,204,205,1,0
"Surprising the monster in its den, he made short work of cutting off its great head, which he carried back in triumph to his master. ",Surprising,BEFORE,"Kintaro now rose to be the greatest hero of his country, and great was the power and honor and wealth that came to him. ",rose,205,206,0,0
"Kintaro now rose to be the greatest hero of his country, and great was the power and honor and wealth that came to him. ",rose,BEFORE,"He now kept his promise and built a comfortable home for his old mother, who lived happily with him in the Capital to the end of her days. ",built,206,207,0,1
