sentence1,event1,te_rel,sentence2,event2,s_id,s_id2,e_id,e_id2
"Long, long ago, one bright autumn day in Japan, it happened, that a pink-faced monkey and a yellow crab were playing together along the bank of a river. ",playing,BEFORE,"As they were running about, the crab found a rice-dumpling and the monkey a persimmon-seed. ",found,0,1,2,2
"As they were running about, the crab found a rice-dumpling and the monkey a persimmon-seed. ",found,BEFORE,"The crab picked up the rice-dumpling and showed it to the monkey, saying: ""Look what a nice thing I have found!"" ",Look,1,2,2,4
"The crab picked up the rice-dumpling and showed it to the monkey, saying: ""Look what a nice thing I have found!"" ",Look,BEFORE,"Then the monkey held up his persimmon-seed and said: ""I also have found something good! ",said,2,3,4,1
"Then the monkey held up his persimmon-seed and said: ""I also have found something good! ",said,AFTER,"Now though the monkey is always very fond of persimmon fruit, he had no use for the seed he had just found. ",had,3,5,1,1
"Now though the monkey is always very fond of persimmon fruit, he had no use for the seed he had just found. ",had,BEFORE,"He, therefore, in his greedy nature, felt very envious of the crab's nice dumpling, and he proposed an exchange. ",proposed,5,7,1,1
"He, therefore, in his greedy nature, felt very envious of the crab's nice dumpling, and he proposed an exchange. ",proposed,BEFORE,"The crab naturally did not see why he should give up his prize for a hard stone-like seed, and would not consent to the monkey's proposition. ",consent,7,8,1,5
"The crab naturally did not see why he should give up his prize for a hard stone-like seed, and would not consent to the monkey's proposition. ",consent,BEFORE,"Then the cunning monkey began to persuade the crab, saying: ""How unwise you are not to think of the future! ",began,8,9,5,0
"Then the cunning monkey began to persuade the crab, saying: ""How unwise you are not to think of the future! ",began,AFTER,"Your rice-dumpling can be eaten now, and is certainly much bigger than my seed; ",eaten,9,10,0,2
"Your rice-dumpling can be eaten now, and is certainly much bigger than my seed; ",eaten,BEFORE," but if you sow this seed in the ground it will soon grow and become a great tree in a few years, and bear an abundance of fine ripe persimmons year after year. ",sow,10,11,2,0
" but if you sow this seed in the ground it will soon grow and become a great tree in a few years, and bear an abundance of fine ripe persimmons year after year. ",sow,BEFORE,If only I could show it to you then with the yellow fruit hanging on its branches! ,show,11,12,0,1
If only I could show it to you then with the yellow fruit hanging on its branches! ,show,BEFORE,"Of course, if you don't believe me I shall sow it myself; ",sow,12,13,1,3
"Of course, if you don't believe me I shall sow it myself; ",sow,AFTER," though I am sure, later on, you will be very sorry that you did not take my advice."" ",take,13,14,3,4
" though I am sure, later on, you will be very sorry that you did not take my advice."" ",take,BEFORE,The simple-minded crab could not resist the monkey's clever persuasion. ,resist,14,15,4,1
The simple-minded crab could not resist the monkey's clever persuasion. ,resist,BEFORE,"He at last gave in and consented to the monkey's proposal, and the exchange was made. ",consented,15,16,1,1
"He at last gave in and consented to the monkey's proposal, and the exchange was made. ",consented,BEFORE,"He would have liked to keep that too, but he was afraid of making the crab angry and of being pinched by his sharp scissor-like claws. ",liked,16,18,1,2
"He would have liked to keep that too, but he was afraid of making the crab angry and of being pinched by his sharp scissor-like claws. ",liked,BEFORE,As soon as the crab reached home he put the persimmon-seed in the ground as the monkey had told him. ,told,18,20,2,3
As soon as the crab reached home he put the persimmon-seed in the ground as the monkey had told him. ,told,BEFORE,In the following spring the crab was delighted to see the shoot of a young tree push its way up through the ground. ,see,20,21,3,1
In the following spring the crab was delighted to see the shoot of a young tree push its way up through the ground. ,see,BEFORE,he said to himself. ,said,21,26,1,0
he said to himself. ,said,AFTER,"At last, one day, he knew the persimmons must be quite ripe and he wanted very much to taste one. ",knew,26,27,0,0
"At last, one day, he knew the persimmons must be quite ripe and he wanted very much to taste one. ",knew,BEFORE,"He made several attempts to climb the tree, in the vain hope of reaching one of the beautiful persimmons hanging above him; ",climb,27,28,0,1
"He made several attempts to climb the tree, in the vain hope of reaching one of the beautiful persimmons hanging above him; ",climb,BEFORE," but he failed each time, for a crab's legs are not made for climbing trees but only for running along the ground and over stones, both of which he can do most cleverly. ",failed,28,29,1,0
" but he failed each time, for a crab's legs are not made for climbing trees but only for running along the ground and over stones, both of which he can do most cleverly. ",failed,AFTER,"In his dilemma he thought of his old playmate the monkey, who, he knew, could climb trees better than any one else in the world. ",climb,29,30,0,4
"In his dilemma he thought of his old playmate the monkey, who, he knew, could climb trees better than any one else in the world. ",climb,BEFORE,"He determined to ask the monkey to help him, and set out to find him. ",help,30,31,4,2
"He determined to ask the monkey to help him, and set out to find him. ",help,AFTER,"Running crab-fashion up the stony river bank, over the pathways into the shadowy forest, the crab at last found the monkey taking an afternoon nap in his favorite pine-tree, with his tail curled tight around a branch to prevent him from falling off in his dreams. ",Running,31,32,2,0
"Running crab-fashion up the stony river bank, over the pathways into the shadowy forest, the crab at last found the monkey taking an afternoon nap in his favorite pine-tree, with his tail curled tight around a branch to prevent him from falling off in his dreams. ",Running,BEFORE,"He was soon wide awake, however, when he heard himself called, and eagerly listening to what the crab told him. ",told,32,33,0,4
"He was soon wide awake, however, when he heard himself called, and eagerly listening to what the crab told him. ",told,AFTER,"When he heard that the seed which he had long ago exchanged for a rice-dumpling had grown into a tree and was now bearing good fruit, he was delighted, for he at once devised a cunning plan which would give him all the persimmons for himself. ",exchanged,33,34,4,2
"When he heard that the seed which he had long ago exchanged for a rice-dumpling had grown into a tree and was now bearing good fruit, he was delighted, for he at once devised a cunning plan which would give him all the persimmons for himself. ",exchanged,BEFORE,He consented to go with the crab to pick the fruit for him. ,consented,34,35,2,0
He consented to go with the crab to pick the fruit for him. ,consented,BEFORE,"He quickly climbed the tree and began to pluck and eat, as fast as he could, one persimmon after another. ",climbed,35,37,0,0
"He quickly climbed the tree and began to pluck and eat, as fast as he could, one persimmon after another. ",climbed,BEFORE,"Each time he chose the best and ripest he could find, and went on eating till he could eat no more. ",eat,37,38,0,7
"Each time he chose the best and ripest he could find, and went on eating till he could eat no more. ",eat,BEFORE,"Not one would he give to the poor hungry crab waiting below, and when he had finished there was little but the hard, unripe fruit left. ",finished,38,39,7,4
"Not one would he give to the poor hungry crab waiting below, and when he had finished there was little but the hard, unripe fruit left. ",finished,AFTER,"You can imagine the feelings of the poor crab after waiting patiently, for so long as he had done, for the tree to grow and the fruit to ripen, when he saw the monkey devouring all the good persimmons. ",waiting,39,40,4,2
"You can imagine the feelings of the poor crab after waiting patiently, for so long as he had done, for the tree to grow and the fruit to ripen, when he saw the monkey devouring all the good persimmons. ",waiting,BEFORE,He was so disappointed that he ran round and round the tree calling to the monkey to remember his promise. ,remember,40,41,2,4
He was so disappointed that he ran round and round the tree calling to the monkey to remember his promise. ,remember,BEFORE,"The monkey at first took no notice of the crab's complaints, but at last he picked out the hardest, greenest persimmon he could find and aimed it at the crab's head. ",aimed,41,42,4,4
"The monkey at first took no notice of the crab's complaints, but at last he picked out the hardest, greenest persimmon he could find and aimed it at the crab's head. ",aimed,BEFORE,The monkey's missile struck home and the crab was sorely hurt by the blow. ,struck,42,44,4,0
The monkey's missile struck home and the crab was sorely hurt by the blow. ,struck,BEFORE,"Again and again, as fast as he could pick them, the monkey pulled off the hard persimmons and threw them at the defenseless crab till he dropped dead, covered with wounds all over his body. ",pick,44,45,0,1
"Again and again, as fast as he could pick them, the monkey pulled off the hard persimmons and threw them at the defenseless crab till he dropped dead, covered with wounds all over his body. ",pick,AFTER,There he lay a pitiful sight at the foot of the tree he had himself planted. ,planted,45,46,1,2
There he lay a pitiful sight at the foot of the tree he had himself planted. ,planted,BEFORE,"When the wicked monkey saw that he had killed the crab he ran away from the spot as fast as he could, in fear and trembling, like a coward as he was. ",killed,46,47,2,2
"When the wicked monkey saw that he had killed the crab he ran away from the spot as fast as he could, in fear and trembling, like a coward as he was. ",killed,AFTER,Now the crab had a son who had been playing with a friend not far from the spot where this sad work had taken place. ,playing,47,48,2,3
Now the crab had a son who had been playing with a friend not far from the spot where this sad work had taken place. ,playing,BEFORE,"On the way home he came across his father dead, in a most dreadful condition-his head was smashed and his shell broken in several places, and around his body lay the unripe persimmons which had done their deadly work. ",smashed,48,49,3,2
"On the way home he came across his father dead, in a most dreadful condition-his head was smashed and his shell broken in several places, and around his body lay the unripe persimmons which had done their deadly work. ",smashed,BEFORE,At this dreadful sight the poor young crab sat down and wept. ,wept,49,50,2,1
At this dreadful sight the poor young crab sat down and wept. ,wept,BEFORE,But when he had wept for some time he told himself that this crying would do no good; ,told,50,51,1,2
But when he had wept for some time he told himself that this crying would do no good; ,told,BEFORE," it was his duty to avenge his father's murder, and this he determined to do. ",avenge,51,52,2,1
" it was his duty to avenge his father's murder, and this he determined to do. ",avenge,BEFORE,He looked about for some clue which would lead him to discover the murderer. ,looked,52,53,1,0
He looked about for some clue which would lead him to discover the murderer. ,looked,AFTER,"Looking up at the tree he noticed that the best fruit had gone, and that all around lay bits of peel and numerous seeds strewn on the ground as well as the unripe persimmons which had evidently been thrown at his father. ",lay,53,54,0,4
"Looking up at the tree he noticed that the best fruit had gone, and that all around lay bits of peel and numerous seeds strewn on the ground as well as the unripe persimmons which had evidently been thrown at his father. ",lay,AFTER,"Then he understood that the monkey was the murderer, for he now remembered that his father had once told him the story of the rice-dumpling and the persimmon-seed. ",told,54,55,4,4
"Then he understood that the monkey was the murderer, for he now remembered that his father had once told him the story of the rice-dumpling and the persimmon-seed. ",told,BEFORE,"The young crab knew that monkeys liked persimmons above all other fruit, and he felt sure that his greed for the coveted fruit had been the cause of the old crab's death. ",knew,55,56,4,0
"The young crab knew that monkeys liked persimmons above all other fruit, and he felt sure that his greed for the coveted fruit had been the cause of the old crab's death. ",knew,BEFORE,"He at first thought of going to attack the monkey at once, for he burned with rage. ",burned,56,58,0,2
"He at first thought of going to attack the monkey at once, for he burned with rage. ",burned,BEFORE,"Second thoughts, however, told him that this was useless, for the monkey was an old and cunning animal and would be hard to overcome. ",told,58,59,2,0
"Second thoughts, however, told him that this was useless, for the monkey was an old and cunning animal and would be hard to overcome. ",told,BEFORE,"He must meet cunning with cunning and ask some of his friends to help him, for he knew it would be quite out of his power to kill him alone. ",help,59,60,0,4
"He must meet cunning with cunning and ask some of his friends to help him, for he knew it would be quite out of his power to kill him alone. ",help,AFTER,"The young crab set out at once to call on the mortar, his father's old friend, and told him of all that had happened. ",told,60,61,4,2
"The young crab set out at once to call on the mortar, his father's old friend, and told him of all that had happened. ",told,BEFORE,He besought the mortar with tears to help him avenge his father's death. ,avenge,61,62,2,2
He besought the mortar with tears to help him avenge his father's death. ,avenge,BEFORE,The mortar was very sorry when he heard the woful tale and promised at once to help the young crab punish the monkey to death. ,help,62,63,2,3
The mortar was very sorry when he heard the woful tale and promised at once to help the young crab punish the monkey to death. ,help,BEFORE,"He warned him that he must be very careful in what he did, for the monkey was a strong and cunning enemy. ",did,63,64,3,3
"He warned him that he must be very careful in what he did, for the monkey was a strong and cunning enemy. ",did,BEFORE,The mortar now sent to fetch the bee and the chestnut (also the crab's old friends) to consult them about the matter. ,consult,64,65,3,2
The mortar now sent to fetch the bee and the chestnut (also the crab's old friends) to consult them about the matter. ,consult,BEFORE,"When they were told all the details of the old crab's death and of the monkey's wickedness and greed, they both gladly consented to help the young crab in his revenge. ",told,65,67,2,1
"When they were told all the details of the old crab's death and of the monkey's wickedness and greed, they both gladly consented to help the young crab in his revenge. ",told,BEFORE,"After talking for a long time as to the ways and means of carrying out their plans they separated, and Mr. Mortar went home with the young crab to help him bury his poor father. ",help,67,68,1,4
"After talking for a long time as to the ways and means of carrying out their plans they separated, and Mr. Mortar went home with the young crab to help him bury his poor father. ",help,AFTER,While all this was taking place the monkey was congratulating himself (as the wicked often do before their punishment comes upon them) on all he had done so neatly. ,congratulating,68,69,4,3
While all this was taking place the monkey was congratulating himself (as the wicked often do before their punishment comes upon them) on all he had done so neatly. ,congratulating,BEFORE,He thought it quite a fine thing that he had robbed his friend of all his ripe persimmons and then that he had killed him. ,killed,69,70,3,4
He thought it quite a fine thing that he had robbed his friend of all his ripe persimmons and then that he had killed him. ,killed,BEFORE,"Still, smile as hard as he might, he could not banish altogether the fear of the consequences should his evil deeds be discovered. ",discovered,70,71,4,6
"Still, smile as hard as he might, he could not banish altogether the fear of the consequences should his evil deeds be discovered. ",discovered,BEFORE,IF he were found out (and he told himself that this could not be for he had escaped unseen) the crab's family would be sure to bear him hatred and seek to take revenge on him. ,told,71,72,6,2
IF he were found out (and he told himself that this could not be for he had escaped unseen) the crab's family would be sure to bear him hatred and seek to take revenge on him. ,told,AFTER,"He found this kind of life, however, extremely dull, accustomed as he was to the free life of the woods, and at last he said: ""No one knows that it was I who killed the crab! ",killed,72,74,2,6
"He found this kind of life, however, extremely dull, accustomed as he was to the free life of the woods, and at last he said: ""No one knows that it was I who killed the crab! ",killed,BEFORE,I am sure that the old thing breathed his last before I left him. ,breathed,74,75,6,1
I am sure that the old thing breathed his last before I left him. ,breathed,BEFORE,Dead crabs have no mouths! ,have,75,76,1,0
Dead crabs have no mouths! ,have,BEFORE,Who is there to tell that I am the murderer? ,tell,76,77,0,1
Who is there to tell that I am the murderer? ,tell,AFTER,"Since no one knows, what is the use of shutting myself up and brooding over the matter? ",shutting,77,78,1,2
"Since no one knows, what is the use of shutting myself up and brooding over the matter? ",shutting,BEFORE,With this he wandered out into the crab settlement and crept about as slyly as possible near the crab's house and tried to hear the neighbors' gossip round about. ,hear,78,80,2,3
With this he wandered out into the crab settlement and crept about as slyly as possible near the crab's house and tried to hear the neighbors' gossip round about. ,hear,AFTER,"He wanted to find out what the crabs were saying about their chief's death, for the old crab had been the chief of the tribe. ",saying,80,81,3,3
"He wanted to find out what the crabs were saying about their chief's death, for the old crab had been the chief of the tribe. ",saying,AFTER,"But he heard nothing and said to himself: ""They are all such fools that they don't know and don't care who murdered their chief!"" ",murdered,81,82,3,7
"But he heard nothing and said to himself: ""They are all such fools that they don't know and don't care who murdered their chief!"" ",murdered,BEFORE,"Little did he know in his so-called ""monkey's wisdom"" that this seeming unconcern was part of the young crab's plan. ",know,82,83,7,1
"Little did he know in his so-called ""monkey's wisdom"" that this seeming unconcern was part of the young crab's plan. ",know,AFTER,"He purposely pretended not to know who killed his father, and also to believe that he had met his death through his own fault. ",killed,83,84,1,2
"He purposely pretended not to know who killed his father, and also to believe that he had met his death through his own fault. ",killed,BEFORE,"By this means he could the better keep secret the revenge on the monkey, which he was meditating. ",meditating,84,85,2,4
"By this means he could the better keep secret the revenge on the monkey, which he was meditating. ",meditating,BEFORE,So the monkey returned home from his walk quite content. ,returned,85,86,4,0
So the monkey returned home from his walk quite content. ,returned,BEFORE,He told himself he had nothing now to fear. ,told,86,87,0,0
He told himself he had nothing now to fear. ,told,BEFORE,"One fine day, when the monkey was sitting at home, he was surprised by the appearance of a messenger from the young crab. ",surprised,87,88,0,3
"One fine day, when the monkey was sitting at home, he was surprised by the appearance of a messenger from the young crab. ",surprised,AFTER,"While he was wondering what this might mean, the messenger bowed before him and said: ""I have been sent by my master to inform you that his father died the other day in falling from a persimmon tree while trying to climb the tree after fruit. ",climb,88,89,3,13
"While he was wondering what this might mean, the messenger bowed before him and said: ""I have been sent by my master to inform you that his father died the other day in falling from a persimmon tree while trying to climb the tree after fruit. ",climb,BEFORE,"This, being the seventh day, is the first anniversary after his death, and my master has prepared a little festival in his father's honor, and bids you come to participate in it as you were one of his best friends. ",participate,89,90,13,5
"This, being the seventh day, is the first anniversary after his death, and my master has prepared a little festival in his father's honor, and bids you come to participate in it as you were one of his best friends. ",participate,BEFORE,"My master hopes you will honor his house with your kind visit."" ",honor,90,91,5,2
"My master hopes you will honor his house with your kind visit."" ",honor,AFTER,"When the monkey heard these words he rejoiced in his inmost heart, for all his fears of being suspected were now at rest. ",heard,91,92,2,0
"When the monkey heard these words he rejoiced in his inmost heart, for all his fears of being suspected were now at rest. ",heard,BEFORE,He could not guess that a plot had just been set in motion against him. ,guess,92,93,0,1
He could not guess that a plot had just been set in motion against him. ,guess,BEFORE,"He pretended to be very surprised at the news of the crab's death, and said: ""I am, indeed, very sorry to hear of your chief's death. ",hear,93,94,1,4
"He pretended to be very surprised at the news of the crab's death, and said: ""I am, indeed, very sorry to hear of your chief's death. ",hear,AFTER,We were great friends as you know. ,know,94,95,4,1
We were great friends as you know. ,know,BEFORE,I remember that we once exchanged a rice-dumpling for a persimmon-seed. ,remember,95,96,1,0
I remember that we once exchanged a rice-dumpling for a persimmon-seed. ,remember,BEFORE,It grieves me much to think that that seed was in the end the cause of his death. ,grieves,96,97,0,0
It grieves me much to think that that seed was in the end the cause of his death. ,grieves,BEFORE,I accept your kind invitation with many thanks. ,accept,97,98,0,0
I accept your kind invitation with many thanks. ,accept,BEFORE,"I shall be delighted to do honor to my poor old friend!"" ",do,98,99,0,2
"I shall be delighted to do honor to my poor old friend!"" ",do,AFTER,And he screwed some false tears from his eyes. ,screwed,99,100,2,0
And he screwed some false tears from his eyes. ,screwed,BEFORE,"The messenger laughed inwardly and thought, ""The wicked monkey is now dropping false tears, but within a short time he shall shed real ones."" ",thought,100,101,0,1
"The messenger laughed inwardly and thought, ""The wicked monkey is now dropping false tears, but within a short time he shall shed real ones."" ",thought,BEFORE,But aloud he thanked the monkey politely and went home. ,thanked,101,102,1,0
But aloud he thanked the monkey politely and went home. ,thanked,BEFORE,"When he had gone, the wicked monkey laughed aloud at what he thought was the young crab's innocence, and without the least feeling began to look forward to the feast to be held that day in honor of the dead crab, to which he had been invited. ",thought,102,103,0,3
"When he had gone, the wicked monkey laughed aloud at what he thought was the young crab's innocence, and without the least feeling began to look forward to the feast to be held that day in honor of the dead crab, to which he had been invited. ",thought,BEFORE,He changed his dress and set out solemnly to visit the young crab. ,visit,103,104,3,2
He changed his dress and set out solemnly to visit the young crab. ,visit,BEFORE,He found all the members of the crab's family and his relatives waiting to receive and welcome him. ,receive,104,105,2,2
He found all the members of the crab's family and his relatives waiting to receive and welcome him. ,receive,BEFORE,As soon as the bows of meeting were over they led him to a hall. ,led,105,106,2,1
As soon as the bows of meeting were over they led him to a hall. ,led,BEFORE,Here the young chief mourner came to receive him. ,receive,106,107,1,1
Here the young chief mourner came to receive him. ,receive,BEFORE,"Expressions of condolence and thanks were exchanged between them, and then they all sat down to a luxurious feast and entertained the monkey as the guest of honor. ",entertained,107,108,1,3
"Expressions of condolence and thanks were exchanged between them, and then they all sat down to a luxurious feast and entertained the monkey as the guest of honor. ",entertained,BEFORE,"The feast over, he was next invited to the tea-ceremony room to drink a cup of tea. ",invited,108,109,3,1
"The feast over, he was next invited to the tea-ceremony room to drink a cup of tea. ",invited,BEFORE,When the young crab had conducted the monkey to the tearoom he left him and retired. ,left,109,110,1,2
When the young crab had conducted the monkey to the tearoom he left him and retired. ,left,BEFORE,Time passed and still he did not return. ,return,110,111,2,2
Time passed and still he did not return. ,return,BEFORE,At last the monkey became impatient. ,became,111,112,2,0
At last the monkey became impatient. ,became,BEFORE,"He said to himself: ""This tea ceremony is always a very slow affair. ",said,112,113,0,0
