sentence1,event1,te_rel,sentence2,event2,s_id,s_id2,e_id,e_id2
"He said to himself: ""This tea ceremony is always a very slow affair. ",said,AFTER,"I am very thirsty after drinking so much sake at the dinner!"" ",drinking,113,115,0,1
"I am very thirsty after drinking so much sake at the dinner!"" ",drinking,BEFORE,"He then approached the charcoal fire-place and began to pour out some hot water from the kettle boiling there, when something burst out from the ashes with a great pop and hit the monkey right in the neck. ",began,115,116,1,1
"He then approached the charcoal fire-place and began to pour out some hot water from the kettle boiling there, when something burst out from the ashes with a great pop and hit the monkey right in the neck. ",began,AFTER,"It was the chestnut, one of the crab's friends, who had hidden himself in the fireplace. ",hidden,116,117,1,2
"It was the chestnut, one of the crab's friends, who had hidden himself in the fireplace. ",hidden,BEFORE,"The bee, who was hiding outside the screens, now flew out and stung him on the cheek. ",stung,117,119,2,3
"The bee, who was hiding outside the screens, now flew out and stung him on the cheek. ",stung,BEFORE,"The monkey was in great pain, his neck was burned by the chestnut and his face badly stung by the bee, but he ran on screaming and chattering with rage. ",stung,119,120,3,3
"The monkey was in great pain, his neck was burned by the chestnut and his face badly stung by the bee, but he ran on screaming and chattering with rage. ",stung,BEFORE,"Now the stone mortar had hidden himself with several other stones on the top of the crab's gate, and as the monkey ran underneath, the mortar and all fell down on the top of the monkey's head. ",ran,120,121,3,2
"Now the stone mortar had hidden himself with several other stones on the top of the crab's gate, and as the monkey ran underneath, the mortar and all fell down on the top of the monkey's head. ",ran,BEFORE,Was it possible for the monkey to bear the weight of the mortar falling on him from the top of the gate? ,falling,121,122,2,2
Was it possible for the monkey to bear the weight of the mortar falling on him from the top of the gate? ,falling,BEFORE,"He lay crushed and in great pain, quite unable to get up. ",lay,122,123,2,0
"He lay crushed and in great pain, quite unable to get up. ",lay,AFTER,"As he lay there helpless the young crab came up, and, holding his great claw scissors over the monkey, he said: ""Do you now remember that you murdered my father?"" ",murdered,123,124,0,7
"As he lay there helpless the young crab came up, and, holding his great claw scissors over the monkey, he said: ""Do you now remember that you murdered my father?"" ",murdered,BEFORE,gasped the monkey brokenly. ,gasped,124,126,7,0
gasped the monkey brokenly. ,gasped,BEFORE,"""Of course,"" said the young crab. ",said,126,127,0,0
"""Of course,"" said the young crab. ",said,AFTER,gasped the unrepentant monkey. ,gasped,127,129,0,0
gasped the unrepentant monkey. ,gasped,BEFORE,"I will soon put an end to your breath!"" ",put,129,131,0,1
"I will soon put an end to your breath!"" ",put,AFTER,and with that he cut off the monkey's head with his pitcher claws. ,cut,131,132,1,0
and with that he cut off the monkey's head with his pitcher claws. ,cut,BEFORE,"Thus the wicked monkey met his well-merited punishment, and the young crab avenged his father's death. ",avenged,132,133,0,2
