sentence1,event1,te_rel,sentence2,event2,s_id,s_id2,e_id,e_id2
And then he saw the youth. ,saw,AFTER,"He was standing in a boat, with a broom in one hand, as though he meant to give the ship a final cleaning; ",standing,172,173,0,1
"He was standing in a boat, with a broom in one hand, as though he meant to give the ship a final cleaning; ",standing,BEFORE," but when he saw the king coming, he threw away the broom and cried: ""Now the ship is finished. ",coming,173,174,1,1
" but when he saw the king coming, he threw away the broom and cried: ""Now the ship is finished. ",coming,BEFORE,"Do I get your daughter now?"" ",get,174,175,1,1
"Do I get your daughter now?"" ",get,BEFORE,"""That is all very fine,"" said the king, ""but you must stand yet another test. ",stand,175,176,1,3
"""That is all very fine,"" said the king, ""but you must stand yet another test. ",stand,BEFORE,"If you can build a castle that is just like mine in every particular within an hour or so, then we will go further into the matter."" ",build,176,177,3,1
"If you can build a castle that is just like mine in every particular within an hour or so, then we will go further into the matter."" ",build,BEFORE,cried the youth. ,cried,177,179,1,0
cried the youth. ,cried,BEFORE,"After he had strolled around for a long while, and the time set was nearly over, he wished that a castle might stand there that resembled the king's castle in every particular. ",wished,179,180,0,4
"After he had strolled around for a long while, and the time set was nearly over, he wished that a castle might stand there that resembled the king's castle in every particular. ",wished,BEFORE,"And it did not take long, either, before the king, together with the queen and the princess, came to look at the new castle. ",came,180,182,4,2
"And it did not take long, either, before the king, together with the queen and the princess, came to look at the new castle. ",came,BEFORE,"The youth stood there with his broom again, and swept and cleaned. ",stood,182,183,2,0
"The youth stood there with his broom again, and swept and cleaned. ",stood,BEFORE,"Do I get her now?"" ",get,183,185,0,1
"Do I get her now?"" ",get,AFTER,"""That's all very fine,"" declared the king, ""just come in and we'll talk it over,"" said he, for he had noticed that the youth knew a thing or two, and he was thinking over how he might get rid of him. ",noticed,185,187,1,7
"""That's all very fine,"" declared the king, ""just come in and we'll talk it over,"" said he, for he had noticed that the youth knew a thing or two, and he was thinking over how he might get rid of him. ",noticed,BEFORE,"The king went on ahead, and after him the queen, and then went the princess, just in advance of the youth. ",went,187,188,7,1
"The king went on ahead, and after him the queen, and then went the princess, just in advance of the youth. ",went,BEFORE,"Then he at once wished to be the handsomest man in the world, and so he was, that very minute. ",wished,188,189,1,0
"Then he at once wished to be the handsomest man in the world, and so he was, that very minute. ",wished,BEFORE,"When the princess saw what a splendid figure he suddenly cut, she nudged the queen, who in turn nudged the king, and after they had stared at him long enough, they at last realized that the youth was more than he had at first appeared to be, in his rags. ",saw,189,190,0,0
"When the princess saw what a splendid figure he suddenly cut, she nudged the queen, who in turn nudged the king, and after they had stared at him long enough, they at last realized that the youth was more than he had at first appeared to be, in his rags. ",saw,BEFORE,"So they decided that the princess was to treat him nicely, in order to find out how matters really stood, and the princess was as sweet and amiable as sugar-bread, and flattered the youth, and said that she could not do without him, night or day. ",said,190,191,0,7
"So they decided that the princess was to treat him nicely, in order to find out how matters really stood, and the princess was as sweet and amiable as sugar-bread, and flattered the youth, and said that she could not do without him, night or day. ",said,BEFORE,"And when it came toward the end of the first evening, she said: ""Since you and I are to be married in any case, I am sure you will have no secrets from me, and you will not want to hide from me how you managed to do all these fine things."" ",married,191,192,7,4
"And when it came toward the end of the first evening, she said: ""Since you and I are to be married in any case, I am sure you will have no secrets from me, and you will not want to hide from me how you managed to do all these fine things."" ",married,BEFORE,"""O, yes,"" said the youth. ",said,192,193,4,0
"""O, yes,"" said the youth. ",said,BEFORE,"""You shall know about it, but first of all let us be married; ",know,193,194,0,1
"""You shall know about it, but first of all let us be married; ",know,AFTER,The following evening the princess pretended to be quite unhappy. ,pretended,194,196,1,1
The following evening the princess pretended to be quite unhappy. ,pretended,AFTER,"She was well aware, said she, that he did not attach much importance to her love, when he would not even tell her what she wanted so much to know. ",wanted,196,197,1,6
"She was well aware, said she, that he did not attach much importance to her love, when he would not even tell her what she wanted so much to know. ",wanted,BEFORE,"If he could not even oblige her in such a small matter, his love could not amount to a great deal. ",oblige,197,198,6,1
"If he could not even oblige her in such a small matter, his love could not amount to a great deal. ",oblige,BEFORE,"Then the youth fell into despair, and to make up with her again, he told her everything. ",told,198,199,1,2
"Then the youth fell into despair, and to make up with her again, he told her everything. ",told,BEFORE,"She lost no time, and let the king and queen know all about it. ",know,199,200,2,2
"She lost no time, and let the king and queen know all about it. ",know,BEFORE,"Thereupon they agreed as to how they would go about getting the youth's ring away from him, and then, thought they, it would not really be hard to get rid of him. ",agreed,200,201,2,0
"Thereupon they agreed as to how they would go about getting the youth's ring away from him, and then, thought they, it would not really be hard to get rid of him. ",agreed,BEFORE,"In the evening the princess came with a sleeping potion, and said she wanted to give her lover a drink that would increase his love for her, since it was plain he did not love her enough. ",wanted,201,202,0,3
"In the evening the princess came with a sleeping potion, and said she wanted to give her lover a drink that would increase his love for her, since it was plain he did not love her enough. ",wanted,BEFORE,"The youth suspected nothing, and drank, and at once fell so fast asleep that they could have pulled down the house over his head. ",drank,202,203,3,1
"The youth suspected nothing, and drank, and at once fell so fast asleep that they could have pulled down the house over his head. ",drank,BEFORE,"Then the princess drew the ring from his finger, put it on herself, and wished the youth might be lying on the garbage-pile in the street, just as tattered and torn as he had come to them, and in his place she wanted the handsomest prince in the world. ",wanted,203,204,1,10
"Then the princess drew the ring from his finger, put it on herself, and wished the youth might be lying on the garbage-pile in the street, just as tattered and torn as he had come to them, and in his place she wanted the handsomest prince in the world. ",wanted,BEFORE,And that very minute everything happened just as she wished. ,wished,204,205,10,1
And that very minute everything happened just as she wished. ,wished,BEFORE,"After a time the youth woke up, out on the garbage-pile, and at first thought he was dreaming: but when he saw the ring was gone, he understood how it all had happened, and fell into such despair that he got up and wanted to jump right into the sea. ",wanted,205,206,1,11
"After a time the youth woke up, out on the garbage-pile, and at first thought he was dreaming: but when he saw the ring was gone, he understood how it all had happened, and fell into such despair that he got up and wanted to jump right into the sea. ",wanted,AFTER,But then he met the cat his master had bought for him. ,bought,206,207,11,2
But then he met the cat his master had bought for him. ,bought,BEFORE,she asked. ,asked,207,209,2,0
she asked. ,asked,BEFORE,"""To throw myself into the sea and drown,"" was the youth's reply. ",throw,209,210,0,0
"""To throw myself into the sea and drown,"" was the youth's reply. ",throw,BEFORE,"""Do not do so on any account,"" said the cat. ",said,210,211,0,2
"""Do not do so on any account,"" said the cat. ",said,BEFORE,"""You will get your ring again."" ",get,211,212,2,1
"""You will get your ring again."" ",get,BEFORE,"""Yes, if that were so, then ..."" said the youth. ",said,212,213,1,1
"""Yes, if that were so, then ..."" said the youth. ",said,AFTER,Suddenly a rat crossed her path. ,crossed,213,215,1,0
Suddenly a rat crossed her path. ,crossed,BEFORE,"""Now I will pounce on you!"" ",pounce,215,216,0,1
"""Now I will pounce on you!"" ",pounce,BEFORE,"""O do not do that,"" said the rat, ""you shall have the ring again!"" ",have,216,218,1,4
"""O do not do that,"" said the rat, ""you shall have the ring again!"" ",have,BEFORE,"""Well, if that is so, then ..."" said the cat. ",said,218,219,4,1
"""Well, if that is so, then ..."" said the cat. ",said,AFTER,"When the folk at the castle had gone to bed, the rat crept around, and sniffed and spied out the room of the prince and princess; ",spied,219,220,1,4
"When the folk at the castle had gone to bed, the rat crept around, and sniffed and spied out the room of the prince and princess; ",spied,BEFORE, and at last he found a little hole through which he crawled. ,crawled,220,221,4,1
 and at last he found a little hole through which he crawled. ,crawled,BEFORE,"Then he heard the prince and princess talking to each other, and saw that the prince was wearing the ring on his finger. ",saw,221,222,1,2
"Then he heard the prince and princess talking to each other, and saw that the prince was wearing the ring on his finger. ",saw,BEFORE,"Before she went, the princess said: ""Good night. ",said,222,223,2,1
"Before she went, the princess said: ""Good night. ",said,BEFORE,"And see that you take good care of the ring, my dearest!"" ",see,223,224,1,0
"And see that you take good care of the ring, my dearest!"" ",see,AFTER,"no one will come in through the walls for the sake of a ring,"" said the prince, ""but if you think it is not safe enough on my hand, why, I can put it in my mouth."" ",think,224,226,0,3
"no one will come in through the walls for the sake of a ring,"" said the prince, ""but if you think it is not safe enough on my hand, why, I can put it in my mouth."" ",think,BEFORE,"After a time he lay down on his back, and prepared to go to sleep. ",prepared,226,227,3,1
"After a time he lay down on his back, and prepared to go to sleep. ",prepared,AFTER,"But just then the ring slipped down his throat, and he had to cough, so that the ring flew out and rolled along the ground. ",slipped,227,228,1,0
"But just then the ring slipped down his throat, and he had to cough, so that the ring flew out and rolled along the ground. ",slipped,BEFORE,"But in the meantime the king had caught the youth, and had had him put in a great tower and condemned to death, because he had made a mock of his daughter--so the king said. ",said,228,230,0,8
"But in the meantime the king had caught the youth, and had had him put in a great tower and condemned to death, because he had made a mock of his daughter--so the king said. ",said,BEFORE,And the youth was to sit in the tower until he was beheaded. ,beheaded,230,231,8,3
And the youth was to sit in the tower until he was beheaded. ,beheaded,AFTER,"And then an eagle came along, caught her up in his claws and flew across the sea with her. ",caught,231,233,3,1
"And then an eagle came along, caught her up in his claws and flew across the sea with her. ",caught,BEFORE,"And suddenly a hawk appeared, and flung himself on the eagle, and the eagle let the cat fall into the sea. ",flung,233,234,1,1
"And suddenly a hawk appeared, and flung himself on the eagle, and the eagle let the cat fall into the sea. ",flung,BEFORE,"When she felt the water, she grew afraid, let the ring fall, and swam to land. ",swam,234,235,1,4
"When she felt the water, she grew afraid, let the ring fall, and swam to land. ",swam,AFTER,No sooner had she shaken the water from her fur than she met the dog whom the youth's master had bought for him. ,bought,235,236,4,4
No sooner had she shaken the water from her fur than she met the dog whom the youth's master had bought for him. ,bought,BEFORE,"""Well, what am I to do now?"" ",do,236,237,4,1
"""Well, what am I to do now?"" ",do,BEFORE,"said the cat, and wept and lamented. ",said,237,238,1,0
"said the cat, and wept and lamented. ",said,BEFORE,"""The ring is gone, and they want to murder the youth."" ",want,238,239,0,2
"""The ring is gone, and they want to murder the youth."" ",want,BEFORE,"""That I do not know,"" said the dog, ""but what I do know is that I have the very worst kind of an ache in my stomach,"" said he. ",said,239,240,2,7
"""That I do not know,"" said the dog, ""but what I do know is that I have the very worst kind of an ache in my stomach,"" said he. ",said,BEFORE,"""There you have it. ",have,240,241,7,0
"""There you have it. ",have,BEFORE,"You have surely over-eaten,"" said the cat. ",said,241,242,0,2
"You have surely over-eaten,"" said the cat. ",said,AFTER,"""I never eat more than I need,"" said the dog, ""and just now I have eaten nothing at all, save a dead fish that was left here by the ebb-tide."" ",eaten,242,243,2,4
"""I never eat more than I need,"" said the dog, ""and just now I have eaten nothing at all, save a dead fish that was left here by the ebb-tide."" ",eaten,BEFORE,asked the cat. ,asked,243,245,4,0
asked the cat. ,asked,AFTER,"""And must you, also, lose your life, because you cannot digest gold?"" ",digest,245,246,0,3
"""And must you, also, lose your life, because you cannot digest gold?"" ",digest,BEFORE,"""But then it would be best if I died at once, for then the youth might still be saved."" ",saved,246,248,3,5
"""But then it would be best if I died at once, for then the youth might still be saved."" ",saved,BEFORE,"said the rat--who was there, too--""I do not need a very large opening through which to crawl, and if the ring is really there, I am sure I can find it."" ",said,248,250,5,0
"said the rat--who was there, too--""I do not need a very large opening through which to crawl, and if the ring is really there, I am sure I can find it."" ",said,BEFORE,"And then the cat made her way to the tower, and clawed her way up till she found a hole through which she could thrust her paw, and thus brought back the ring to the youth. ",clawed,250,252,0,1
"And then the cat made her way to the tower, and clawed her way up till she found a hole through which she could thrust her paw, and thus brought back the ring to the youth. ",clawed,BEFORE,"No sooner was it on his finger than he wished that the tower might break down, and that very moment he was standing just before the tower-gate, and reviling the king and the queen and the king's daughter as though they were the lowest of the low. ",wished,252,253,1,1
"No sooner was it on his finger than he wished that the tower might break down, and that very moment he was standing just before the tower-gate, and reviling the king and the queen and the king's daughter as though they were the lowest of the low. ",wished,BEFORE,"The king hastily called together his army, and told it to surround the tower, and take the youth prisoner, dead or alive. ",told,253,254,1,1
"The king hastily called together his army, and told it to surround the tower, and take the youth prisoner, dead or alive. ",told,BEFORE,"But the youth only wished the whole army might be sticking up to their necks in the big swamp in the hills, and there they had trouble enough getting out--those among them who did not stick fast. ",wished,254,255,1,0
"But the youth only wished the whole army might be sticking up to their necks in the big swamp in the hills, and there they had trouble enough getting out--those among them who did not stick fast. ",wished,BEFORE,"Then he went right on reviling where he had stopped, and finally, when he had told them all just what he thought of them, he wished that the king, the queen and the king's daughter might sit for the rest of their lives in the tower into which they had thrust him. ",wished,255,256,0,7
"Then he went right on reviling where he had stopped, and finally, when he had told them all just what he thought of them, he wished that the king, the queen and the king's daughter might sit for the rest of their lives in the tower into which they had thrust him. ",wished,BEFORE,"And when they were sitting there, he took possession of the king's land and country on his own account. ",sitting,256,257,7,1
"And when they were sitting there, he took possession of the king's land and country on his own account. ",sitting,BEFORE,"Then the dog changed into a prince, and the cat into a princess, and he made the latter his wife, and they were married and celebrated their wedding long and profusely.",celebrated,257,258,1,4
