sentence1,event1,te_rel,sentence2,event2,s_id,s_id2,e_id,e_id2
"Heaven had not given a single one of them a child, and each of them wanted to have one. ",wanted,BEFORE,"And suddenly they saw a goose-egg of quite unheard-of size, well-nigh as large as a man's head. ",saw,1,2,2,0
"And suddenly they saw a goose-egg of quite unheard-of size, well-nigh as large as a man's head. ",saw,BEFORE,"""I saw it first,"" said the one. ",said,2,3,0,1
"""I saw it first,"" said the one. ",said,AFTER,"""I saw it at the same time that you did,"" insisted another. ",saw,3,4,1,0
"""I saw it at the same time that you did,"" insisted another. ",saw,BEFORE,"""But I want it, for I saw it first of all,"" maintained a third. ",want,4,5,0,0
"""But I want it, for I saw it first of all,"" maintained a third. ",want,BEFORE,"And thus they went on, and fought so about the egg that they nearly came to blows. ",fought,5,6,0,1
"And thus they went on, and fought so about the egg that they nearly came to blows. ",fought,BEFORE,"Finally they agreed that it should belong to all five of them, and that all of them should sit on it, as a goose would do, and hatch out the little gosling. ",sit,6,7,1,4
"Finally they agreed that it should belong to all five of them, and that all of them should sit on it, as a goose would do, and hatch out the little gosling. ",sit,BEFORE,"The first remained sitting on the egg for eight days, and hatched, and did not move or do a thing. ",remained,7,8,4,0
"The first remained sitting on the egg for eight days, and hatched, and did not move or do a thing. ",remained,BEFORE,During this time the rest had to feed her and themselves as well. ,feed,8,9,0,1
During this time the rest had to feed her and themselves as well. ,feed,BEFORE,One of them grew angry because of this and scolded. ,grew,9,10,1,0
One of them grew angry because of this and scolded. ,grew,AFTER,"""You did not crawl out of the egg either before you could cry peep!"" ",crawl,10,11,0,1
"""You did not crawl out of the egg either before you could cry peep!"" ",crawl,BEFORE,said the one who was sitting on the egg and hatching. ,said,11,12,1,0
said the one who was sitting on the egg and hatching. ,said,BEFORE,"""Yet I almost believe that a human child is going to slip out of the egg, for something is murmuring inside it without ever stopping: Herring and mush, porridge and milk,"" said she. ",said,12,13,0,7
"""Yet I almost believe that a human child is going to slip out of the egg, for something is murmuring inside it without ever stopping: Herring and mush, porridge and milk,"" said she. ",said,AFTER,"""And now you can sit on it for eight days, while we bring you food."" ",sit,13,14,7,1
"""And now you can sit on it for eight days, while we bring you food."" ",sit,BEFORE,"When the fifth day of the eight had passed, it was plain to her that there was a child in the egg, which kept on calling: ""Herring and mush, porridge and milk,"" and so she punched a hole in the egg. ",punched,14,15,1,6
"When the fifth day of the eight had passed, it was plain to her that there was a child in the egg, which kept on calling: ""Herring and mush, porridge and milk,"" and so she punched a hole in the egg. ",punched,BEFORE,Instead of a gosling out came a child. ,came,15,16,6,0
Instead of a gosling out came a child. ,came,BEFORE,So they named the child Murmur Goose-Egg. ,named,16,19,0,0
So they named the child Murmur Goose-Egg. ,named,BEFORE,"In spite of the child's homeliness, the women at first took a great deal of pleasure in him. ",took,19,20,0,0
"In spite of the child's homeliness, the women at first took a great deal of pleasure in him. ",took,BEFORE,"But before long, he grew so greedy that he devoured everything they had. ",grew,20,21,0,0
"But before long, he grew so greedy that he devoured everything they had. ",grew,BEFORE,"When they cooked a dish of mush or a potful of porridge that was to do for all six of them, the child swallowed it all by himself. ",swallowed,21,22,0,3
"When they cooked a dish of mush or a potful of porridge that was to do for all six of them, the child swallowed it all by himself. ",swallowed,BEFORE,So they did not want to keep him any longer. ,want,22,23,3,1
So they did not want to keep him any longer. ,want,BEFORE,"""I have not had a single full meal since the changling crawled out,"" said one of them. ",said,23,24,1,3
"""I have not had a single full meal since the changling crawled out,"" said one of them. ",said,BEFORE,"When Murmur Goose-Egg heard that, and the rest agreed, he said that he would gladly go his own gait, for ""if they had no need of him, then he had no need of them,"" and with that he went off. ",said,24,25,3,2
"When Murmur Goose-Egg heard that, and the rest agreed, he said that he would gladly go his own gait, for ""if they had no need of him, then he had no need of them,"" and with that he went off. ",said,BEFORE,"Finally he came to a farmstead that lay in a rocky section, and asked for work. ",came,25,26,2,0
"Finally he came to a farmstead that lay in a rocky section, and asked for work. ",came,BEFORE,"Yes, they needed a workman, and the master told him to gather up the stones in the field. ",told,26,27,0,1
"Yes, they needed a workman, and the master told him to gather up the stones in the field. ",told,BEFORE,"He picked up some that were so large that a number of horses could not have dragged them, and large and small, one and all, he put them in his pocket. ",put,27,29,1,5
"He picked up some that were so large that a number of horses could not have dragged them, and large and small, one and all, he put them in his pocket. ",put,BEFORE,"Before long he had finished his work, and wanted to know what he was to do next. ",wanted,29,30,5,2
"Before long he had finished his work, and wanted to know what he was to do next. ",wanted,BEFORE,said his master. ,said,30,32,2,0
said his master. ,said,AFTER,"""You cannot possibly have finished before you have really begun!"" ",finished,32,33,0,2
"""You cannot possibly have finished before you have really begun!"" ",finished,BEFORE,"But Murmur Goose-Egg emptied his pockets, and threw the stones on a pile. ",threw,33,34,2,1
"But Murmur Goose-Egg emptied his pockets, and threw the stones on a pile. ",threw,AFTER,"Then his master saw that he had finished his work, and that one would have to handle such a strong fellow with kid gloves. ",finished,34,35,1,2
"Then his master saw that he had finished his work, and that one would have to handle such a strong fellow with kid gloves. ",finished,BEFORE,So he told him to come in and eat. ,eat,35,36,2,2
So he told him to come in and eat. ,eat,AFTER,"That suited Murmur Goose-Egg, and he ate up everything that was to have supplied the master and his family, and the help, and then he was only half satisfied. ",supplied,36,37,2,3
"That suited Murmur Goose-Egg, and he ate up everything that was to have supplied the master and his family, and the help, and then he was only half satisfied. ",supplied,BEFORE," but a dangerous eater, like a bottomless cask, said the peasant. ",said,37,39,3,0
" but a dangerous eater, like a bottomless cask, said the peasant. ",said,BEFORE,"""Such a serving-man could eat up a poor peasant, house and ground, before he noticed it,"" said he. ",said,39,40,0,4
"""Such a serving-man could eat up a poor peasant, house and ground, before he noticed it,"" said he. ",said,AFTER,"He had no more work for him, and the best thing to do would be to go to the king's castle. ",had,40,41,4,0
"He had no more work for him, and the best thing to do would be to go to the king's castle. ",had,BEFORE,"So Murmur Goose-Egg went to the king, and was at once given a place, and there was enough to eat and drink in the castle. ",given,41,42,0,2
"So Murmur Goose-Egg went to the king, and was at once given a place, and there was enough to eat and drink in the castle. ",given,BEFORE,"He was to be the errand-boy, and help the maids fetch wood and water, and do other odd jobs. ",help,42,43,2,2
"He was to be the errand-boy, and help the maids fetch wood and water, and do other odd jobs. ",help,BEFORE,So he asked what he was to do first. ,asked,43,44,2,0
So he asked what he was to do first. ,asked,BEFORE,"For the time being he could chop fire-wood, said they. ",said,44,45,0,3
"For the time being he could chop fire-wood, said they. ",said,AFTER,"So Murmur Goose-Egg began to chop fire-wood, and hewed to the line in such fashion that the chips fairly flew. ",chop,45,46,3,1
"So Murmur Goose-Egg began to chop fire-wood, and hewed to the line in such fashion that the chips fairly flew. ",chop,BEFORE,"Before long he had chopped up all that there was, kindling wood and building wood, beams and boards, and when he was through with it, he came and asked what he was to do now. ",came,46,47,1,5
"Before long he had chopped up all that there was, kindling wood and building wood, beams and boards, and when he was through with it, he came and asked what he was to do now. ",came,BEFORE,"""You can finish chopping the fire-wood,"" said they. ",said,47,48,5,3
"""You can finish chopping the fire-wood,"" said they. ",said,BEFORE,"""There is none left,"" said Murmur Goose-Egg. ",said,48,49,3,2
"""There is none left,"" said Murmur Goose-Egg. ",said,BEFORE,"That could not be possible, said the superintendent, and looked into the wood-bin. ",said,49,50,2,2
"That could not be possible, said the superintendent, and looked into the wood-bin. ",said,AFTER,"Yes, indeed, Murmur Goose-Egg had chopped up everything, large and small, beams and boards. ",chopped,50,51,2,1
"Yes, indeed, Murmur Goose-Egg had chopped up everything, large and small, beams and boards. ",chopped,BEFORE,Therefore the superintendent said that Murmur Goose-Egg should have nothing to eat until he had chopped down just as much wood in the forest as he had just chopped up for fire-wood. ,said,51,53,1,0
Therefore the superintendent said that Murmur Goose-Egg should have nothing to eat until he had chopped down just as much wood in the forest as he had just chopped up for fire-wood. ,said,BEFORE,"Then Murmur Goose-Egg went into the smithy, and had the smith make an iron ax of five hundred-weights. ",make,53,54,0,2
"Then Murmur Goose-Egg went into the smithy, and had the smith make an iron ax of five hundred-weights. ",make,BEFORE,With that he went into the forest and began to chop. ,chop,54,55,2,2
With that he went into the forest and began to chop. ,chop,AFTER,"He chopped down big pine and fir trees, as thick as masts, and all that he found on the king's ground, as well as what he found on that of his neighbors. ",found,55,56,2,1
"He chopped down big pine and fir trees, as thick as masts, and all that he found on the king's ground, as well as what he found on that of his neighbors. ",found,BEFORE,"Then he loaded a sizable stack on the sled, and put to the horses. ",loaded,56,58,1,0
"Then he loaded a sizable stack on the sled, and put to the horses. ",loaded,BEFORE,"So he unharnessed them, and put himself to the sled, and went off alone with the load. ",unharnessed,58,60,0,0
"So he unharnessed them, and put himself to the sled, and went off alone with the load. ",unharnessed,BEFORE,"When he came to the king's castle, there stood the king with the master carpenter in the entrance, and they were ready to give him a warm reception, because of the destruction he had wrought in the forest. ",came,60,61,0,0
"When he came to the king's castle, there stood the king with the master carpenter in the entrance, and they were ready to give him a warm reception, because of the destruction he had wrought in the forest. ",came,AFTER,For the master carpenter had been there and seen the havoc he had made. ,seen,61,62,0,2
For the master carpenter had been there and seen the havoc he had made. ,seen,BEFORE,"But when Murmur Goose-Egg came along with half the forest, the king grew frightened as well as angry, and he thought that if Murmur was so strong, it would be best to handle him with care. ",came,62,63,2,0
"But when Murmur Goose-Egg came along with half the forest, the king grew frightened as well as angry, and he thought that if Murmur was so strong, it would be best to handle him with care. ",came,BEFORE,"""Why, you are a splendid workman,"" said the king, ""but tell me, how much do you really eat at once,"" he continued, ""for I am sure you are hungry?"" ",eat,63,64,0,4
"""Why, you are a splendid workman,"" said the king, ""but tell me, how much do you really eat at once,"" he continued, ""for I am sure you are hungry?"" ",eat,BEFORE,"If he were to have enough porridge, they would have to take twelve tons of meal to make it. ",have,64,65,4,1
"If he were to have enough porridge, they would have to take twelve tons of meal to make it. ",have,BEFORE,"After he had eaten that, then he could wait a while, said Murmur Goose-Egg. ",said,65,66,1,4
"After he had eaten that, then he could wait a while, said Murmur Goose-Egg. ",said,AFTER,"It took some time before so much porridge could be prepared, and in the meantime Murmur was to carry wood into the kitchen. ",carry,66,67,4,5
"It took some time before so much porridge could be prepared, and in the meantime Murmur was to carry wood into the kitchen. ",carry,BEFORE,So he piled the whole load of wood on a sled. ,piled,67,68,5,0
So he piled the whole load of wood on a sled. ,piled,BEFORE,"When he drove it through the door, he did not go to work about it very gently. ",drove,68,69,0,0
"When he drove it through the door, he did not go to work about it very gently. ",drove,BEFORE,"When at last dinner was ready, they sent him out into the field, to call the help. ",sent,69,71,0,1
"When at last dinner was ready, they sent him out into the field, to call the help. ",sent,BEFORE,He called so loudly that hill and vale reechoed the sound. ,called,71,72,1,0
He called so loudly that hill and vale reechoed the sound. ,called,BEFORE,But still the people did not come quick enough to suit him. ,come,72,73,0,1
But still the people did not come quick enough to suit him. ,come,BEFORE,"So he picked a quarrel with them, and killed twelve. ",killed,73,74,1,1
"So he picked a quarrel with them, and killed twelve. ",killed,BEFORE,"""You kill twelve of my people, and you eat for twelve times twelve of them, but how many men's work can you do?"" ",eat,74,75,1,1
"""You kill twelve of my people, and you eat for twelve times twelve of them, but how many men's work can you do?"" ",eat,BEFORE,asked the king. ,asked,75,76,1,0
asked the king. ,asked,BEFORE,"""I do the work of twelve times twelve, too,"" said Murmur. ",said,76,77,0,1
"""I do the work of twelve times twelve, too,"" said Murmur. ",said,AFTER,"When he had eaten, he was to go to the barn and thresh. ",eaten,77,78,1,1
"When he had eaten, he was to go to the barn and thresh. ",eaten,BEFORE,"So he pulled the beam out of the roof-tree, and made a flail out of it, and when the roof threatened to fall in, he took a pine-tree with all its boughs and branches, and set it up in place of the roof-beam. ",took,78,79,1,4
"So he pulled the beam out of the roof-tree, and made a flail out of it, and when the roof threatened to fall in, he took a pine-tree with all its boughs and branches, and set it up in place of the roof-beam. ",took,BEFORE,"Then he threshed corn and hay and straw, all together, and it seemed as though a cloud hung over the royal castle. ",threshed,79,80,4,0
"Then he threshed corn and hay and straw, all together, and it seemed as though a cloud hung over the royal castle. ",threshed,BEFORE,"When Murmur Goose-Egg had nearly finished threshing, the enemy broke into the land, and war began. ",finished,80,81,0,1
"When Murmur Goose-Egg had nearly finished threshing, the enemy broke into the land, and war began. ",finished,BEFORE,"Then the king told him to gather people about him, and go to meet the foe, and do battle with him, for he thought the enemy would probably kill him. ",told,81,82,1,0
"Then the king told him to gather people about him, and go to meet the foe, and do battle with him, for he thought the enemy would probably kill him. ",told,BEFORE,"No, said Murmur Goose-Egg, he did not want to have the king's people killed. ",want,82,83,0,2
"No, said Murmur Goose-Egg, he did not want to have the king's people killed. ",want,BEFORE,He would see that he dealt with the enemy himself. ,see,83,84,2,1
He would see that he dealt with the enemy himself. ,see,BEFORE,"All the better, thought the king, then I am sure to get rid of him. ",thought,84,85,1,0
"All the better, thought the king, then I am sure to get rid of him. ",thought,BEFORE,"But he would need a proper club, said Murmur. ",said,85,86,0,2
"But he would need a proper club, said Murmur. ",said,AFTER,"So they sent to the smith, and he forged a club of two hundred-weights. ",forged,86,87,2,1
"So they sent to the smith, and he forged a club of two hundred-weights. ",forged,BEFORE,"That would only do for a nut-cracker, said Murmur Goose-Egg. ",said,87,88,1,2
"That would only do for a nut-cracker, said Murmur Goose-Egg. ",said,AFTER,So he forged another that weighed six hundred-weights. ,forged,88,89,2,0
So he forged another that weighed six hundred-weights. ,forged,BEFORE,"That would do to hammer shoes with, said Murmur Goose-Egg. ",said,89,90,0,2
"That would do to hammer shoes with, said Murmur Goose-Egg. ",said,AFTER,But the smith told him that he and all his workmen together could not forge a larger one. ,forge,90,91,2,2
But the smith told him that he and all his workmen together could not forge a larger one. ,forge,BEFORE,"Then Murmur Goose-Egg went into the smithy himself, and forged himself a club of thirty hundred-weights. ",forged,91,92,2,1
"Then Murmur Goose-Egg went into the smithy himself, and forged himself a club of thirty hundred-weights. ",forged,BEFORE,It would have taken a hundred men just to turn it around on the anvil. ,taken,92,93,1,2
It would have taken a hundred men just to turn it around on the anvil. ,taken,BEFORE,"This might do at a pinch, said Murmur. ",said,93,94,2,2
"This might do at a pinch, said Murmur. ",said,AFTER,Then he wanted a knapsack with provisions. ,wanted,94,95,2,0
Then he wanted a knapsack with provisions. ,wanted,BEFORE,"Then Murmur wandered down the hill with the knapsack on his back, and the club over his shoulder. ",wandered,95,97,0,0
"Then Murmur wandered down the hill with the knapsack on his back, and the club over his shoulder. ",wandered,BEFORE,"When he came near enough for the soldiers to see him, they sent to ask whether he had a mind to attack them. ",ask,97,98,0,3
"When he came near enough for the soldiers to see him, they sent to ask whether he had a mind to attack them. ",ask,BEFORE,"""Just wait until I have eaten,"" said Murmur, and sat him down behind his knapsack to eat. ",sat,98,99,3,4
"""Just wait until I have eaten,"" said Murmur, and sat him down behind his knapsack to eat. ",sat,BEFORE,"But the enemy would not wait, and began to fire at him. ",began,99,100,4,2
"But the enemy would not wait, and began to fire at him. ",began,BEFORE,And it fairly rained and hailed musket-balls all around Murmur. ,hailed,100,101,2,1
And it fairly rained and hailed musket-balls all around Murmur. ,hailed,BEFORE,"""I don't care a fig for these blueberries,"" said Murmur Goose-Egg, and feasted on quite at ease. ",said,101,102,1,2
"""I don't care a fig for these blueberries,"" said Murmur Goose-Egg, and feasted on quite at ease. ",said,AFTER,"Neither lead nor iron could wound him, and his knapsack stood before him, and caught the bullets like a wall. ",stood,102,103,2,2
"Neither lead nor iron could wound him, and his knapsack stood before him, and caught the bullets like a wall. ",stood,BEFORE,"Then the enemy began to throw bombs at him, and shoot at him with cannon. ",began,103,104,2,0
"Then the enemy began to throw bombs at him, and shoot at him with cannon. ",began,BEFORE,He hardly moved when he was struck. ,struck,104,105,0,2
He hardly moved when he was struck. ,struck,BEFORE,"said he, and spat it out again, and then came a chain-bullet and fell into his butter-plate, and another tore away the bit of bread from between his fingers. ",fell,105,110,2,3
"said he, and spat it out again, and then came a chain-bullet and fell into his butter-plate, and another tore away the bit of bread from between his fingers. ",fell,BEFORE,"Then he grew angry, stood up, took his club, pounded the ground with it, and asked whether they wanted to take the food from his mouth with the blueberries they were blowing out at him from their clumsy blow-pipes. ",wanted,110,111,3,5
"Then he grew angry, stood up, took his club, pounded the ground with it, and asked whether they wanted to take the food from his mouth with the blueberries they were blowing out at him from their clumsy blow-pipes. ",wanted,BEFORE,"Then he struck a few more blows, so that the hills and valleys round about trembled, and all the enemy flew up into the air like chaff, and that was the end of the war. ",flew,111,112,5,2
"Then he struck a few more blows, so that the hills and valleys round about trembled, and all the enemy flew up into the air like chaff, and that was the end of the war. ",flew,BEFORE,"When Murmur came back and asked for more work, the king was at a loss, for he had felt sure that now he was rid of him. ",asked,112,113,2,1
"When Murmur came back and asked for more work, the king was at a loss, for he had felt sure that now he was rid of him. ",asked,BEFORE,So he knew of nothing better to do than to send him to the devil's place. ,send,113,114,1,2
So he knew of nothing better to do than to send him to the devil's place. ,send,BEFORE,"""Now you can go to the devil, and fetch the tribute from him,"" said the king. ",said,114,115,2,3
"""Now you can go to the devil, and fetch the tribute from him,"" said the king. ",said,AFTER,He had soon reached the right spot. ,reached,115,117,3,1
He had soon reached the right spot. ,reached,BEFORE,When he got there the devil was away at a trial. ,got,117,118,1,0
When he got there the devil was away at a trial. ,got,AFTER,"There was no one home but his grandmother, and she said she had never yet heard anything about a tribute, and that he was to come back some other time. ",heard,118,119,0,3
"There was no one home but his grandmother, and she said she had never yet heard anything about a tribute, and that he was to come back some other time. ",heard,BEFORE,"""Yes, indeed, come again to-morrow,"" said he. ",said,119,120,3,2
"""Yes, indeed, come again to-morrow,"" said he. ",said,AFTER,"""I know that old excuse!"" ",know,120,121,2,0
"""I know that old excuse!"" ",know,AFTER,"But since he was there, he would stay there, for he had to take home the tribute, and he had plenty of time to wait. ",had,121,122,0,5
"But since he was there, he would stay there, for he had to take home the tribute, and he had plenty of time to wait. ",had,BEFORE,"But when he had eaten all his provisions, he grew weary. ",eaten,122,123,5,1
"But when he had eaten all his provisions, he grew weary. ",eaten,BEFORE,He again demanded the tribute from the grandmother. ,demanded,123,124,1,0
He again demanded the tribute from the grandmother. ,demanded,BEFORE,"""You will get nothing from me, and that's as flat as the old fir-tree outside is fast,"" said the devil's grandmother. ",said,124,125,0,4
"""You will get nothing from me, and that's as flat as the old fir-tree outside is fast,"" said the devil's grandmother. ",said,AFTER,"The fir-tree stood in front of the gate to the devil's place, and was so large that fifteen men could hardly girdle it with their arms. ",girdle,125,126,4,3
"The fir-tree stood in front of the gate to the devil's place, and was so large that fifteen men could hardly girdle it with their arms. ",girdle,BEFORE,But Murmur climbed up into its top and bent and shook it to and fro as though it were a willow wand. ,climbed,126,127,3,0
But Murmur climbed up into its top and bent and shook it to and fro as though it were a willow wand. ,climbed,BEFORE,Then asked the devil's grandmother once more whether she would now pay him the tribute. ,asked,127,128,0,0
Then asked the devil's grandmother once more whether she would now pay him the tribute. ,asked,AFTER,"So she did not dare to refuse any longer, and brought out as much money as he could possibly carry in his knapsack. ",carry,128,129,0,5
"So she did not dare to refuse any longer, and brought out as much money as he could possibly carry in his knapsack. ",carry,BEFORE,"Now no sooner had he gone than the devil came home, and when he learned that Murmur had taken along a big bag of money. ",learned,129,131,5,3
"Now no sooner had he gone than the devil came home, and when he learned that Murmur had taken along a big bag of money. ",learned,BEFORE,"He first beat his grandmother, and then hurried after Murmur. ",hurried,131,132,3,1
"He first beat his grandmother, and then hurried after Murmur. ",hurried,BEFORE,"And he soon caught up to him, for he ran over sticks and stones, and sometimes flew in between; ",flew,132,133,1,2
"And he soon caught up to him, for he ran over sticks and stones, and sometimes flew in between; ",flew,BEFORE,"But with the devil at his heels, he began to run as fast as he could. ",began,133,135,2,0
"But with the devil at his heels, he began to run as fast as he could. ",began,BEFORE,"He stretched out the club behind him, to keep the devil from coming to close quarters. ",keep,135,136,0,1
"He stretched out the club behind him, to keep the devil from coming to close quarters. ",keep,BEFORE,"Murmur held the shaft and the devil the end of the club, until they reached a deep valley. ",held,136,138,1,0
"Murmur held the shaft and the devil the end of the club, until they reached a deep valley. ",held,BEFORE,"There Murmur jumped from one mountain-top to another, and the devil followed him so hotly that he ran into the club, fell down into the valley and broke his foot-and there he lay. ",lay,138,139,0,5
