sentence1,event1,te_rel,sentence2,event2,s_id,s_id2,e_id,e_id2
"There Murmur jumped from one mountain-top to another, and the devil followed him so hotly that he ran into the club, fell down into the valley and broke his foot-and there he lay. ",lay,BEFORE,"said Murmur Goose-Egg, when he had reached the royal castle, and he flung down the knapsack full of money before the king, so that the whole castle tottered. ",reached,139,141,5,2
"said Murmur Goose-Egg, when he had reached the royal castle, and he flung down the knapsack full of money before the king, so that the whole castle tottered. ",reached,BEFORE,"The king thanked him kindly, and promised him a good reward, and a good character, if he wanted it; ",wanted,141,142,2,2
"The king thanked him kindly, and promised him a good reward, and a good character, if he wanted it; ",wanted,BEFORE, but Murmur only wanted more work to do. ,wanted,142,143,2,0
 but Murmur only wanted more work to do. ,wanted,BEFORE,"""What shall I do now?"" ",do,143,144,0,1
"""What shall I do now?"" ",do,AFTER,he asked. ,asked,144,145,1,0
he asked. ,asked,AFTER,"The king reflected for a while, and then he said Murmur should travel to the hill-troll, who had robbed him of the sword of his ancestors. ",robbed,145,146,0,5
"The king reflected for a while, and then he said Murmur should travel to the hill-troll, who had robbed him of the sword of his ancestors. ",robbed,BEFORE,"Murmur was given a few cart-loads of provisions in his big knapsack, and once more set out. ",given,146,148,5,1
"Murmur was given a few cart-loads of provisions in his big knapsack, and once more set out. ",given,BEFORE,"Long he wandered, though, over field and wood, over hills and deep valleys, till he came to a great mountain where the troll lived who had robbed the king of the sword. ",came,148,149,1,1
"Long he wandered, though, over field and wood, over hills and deep valleys, till he came to a great mountain where the troll lived who had robbed the king of the sword. ",came,BEFORE,"But the troll was not out in the open, and the mountain was closed, so Murmur could not get it. ",get,149,150,1,3
"But the troll was not out in the open, and the mountain was closed, so Murmur could not get it. ",get,BEFORE,"So he joined a party of stone-breakers, who were working at a mountainside, and worked along with them. ",joined,150,151,3,0
"So he joined a party of stone-breakers, who were working at a mountainside, and worked along with them. ",joined,BEFORE,"They had never had such a helper, for Murmur hewed away at the rocks till they burst, and stone bowlders as large as houses came rolling down. ",hewed,151,152,0,2
"They had never had such a helper, for Murmur hewed away at the rocks till they burst, and stone bowlders as large as houses came rolling down. ",hewed,BEFORE,"But when he was about to rest and eat up the first cart-load of his provisions, it had already been eaten up. ",rest,152,153,2,1
"But when he was about to rest and eat up the first cart-load of his provisions, it had already been eaten up. ",rest,AFTER,"""I have a good appetite myself,"" said Murmur, ""but whoever got hold of it has an even better one, for he has eaten up the bones as well!"" ",eaten,153,154,1,5
"""I have a good appetite myself,"" said Murmur, ""but whoever got hold of it has an even better one, for he has eaten up the bones as well!"" ",eaten,BEFORE,"On the third day he went to work again, and took along the third cart-load, lay down behind it, and pretended to be sleeping. ",work,154,156,5,1
"On the third day he went to work again, and took along the third cart-load, lay down behind it, and pretended to be sleeping. ",work,BEFORE,"Then a troll with seven heads came out of the hill, began to smack his lips, and eat of his provisions. ",eat,156,157,1,3
"Then a troll with seven heads came out of the hill, began to smack his lips, and eat of his provisions. ",eat,BEFORE,"""Now the table is set, so now I am going to eat,"" said he. ",said,157,158,3,5
"""Now the table is set, so now I am going to eat,"" said he. ",said,AFTER,"Then he went into the hill out of which the troll had come, and inside stood a horse eating out of a barrel of glowing ashes, while behind him stood a barrel filled with oats. ",stood,158,160,5,6
"Then he went into the hill out of which the troll had come, and inside stood a horse eating out of a barrel of glowing ashes, while behind him stood a barrel filled with oats. ",stood,BEFORE,asked Murmur Goose-Egg. ,asked,160,162,6,0
asked Murmur Goose-Egg. ,asked,BEFORE,"""Because I cannot turn around,"" said the horse. ",said,162,163,0,2
"""Because I cannot turn around,"" said the horse. ",said,BEFORE,"""I will turn you around,"" said Murmur Goose-Egg. ",said,163,164,2,2
"""I will turn you around,"" said Murmur Goose-Egg. ",said,AFTER,"""Tear my head off instead,"" pleaded the horse. ",pleaded,164,165,2,1
"""Tear my head off instead,"" pleaded the horse. ",pleaded,AFTER,"He said that he had been enchanted, and turned into a horse by the troll. ",enchanted,165,167,1,3
"He said that he had been enchanted, and turned into a horse by the troll. ",enchanted,BEFORE,"Then he helped Murmur look for the sword, which the troll had hidden under the bed. ",helped,167,168,3,0
"Then he helped Murmur look for the sword, which the troll had hidden under the bed. ",helped,AFTER,"But in the bed lay the troll's grandmother, and she was snoring. ",lay,168,169,0,0
"But in the bed lay the troll's grandmother, and she was snoring. ",lay,BEFORE," but she could not get at them, hence she commenced to drink, so that the water went down and grew lower. ",drink,169,171,0,3
" but she could not get at them, hence she commenced to drink, so that the water went down and grew lower. ",drink,BEFORE,"But at last she could not drink up the whole sea, and so she burst. ",drink,171,172,3,1
"But at last she could not drink up the whole sea, and so she burst. ",drink,BEFORE,"When they came ashore, Murmur sent to the king, and had him told to have the sword fetched; ",sent,172,173,1,1
"When they came ashore, Murmur sent to the king, and had him told to have the sword fetched; ",sent,BEFORE," but though the king sent four horses, they could not move it from the spot. ",sent,173,174,1,0
" but though the king sent four horses, they could not move it from the spot. ",sent,BEFORE,"He sent eight, he sent twelve, but the sword remained where it was, and could not be moved from the spot by any means. ",sent,174,175,0,0
"He sent eight, he sent twelve, but the sword remained where it was, and could not be moved from the spot by any means. ",sent,BEFORE,"Then Murmur Goose-Egg took it up, and carried it alone. ",carried,175,176,0,1
"Then Murmur Goose-Egg took it up, and carried it alone. ",carried,BEFORE,The king could not believe his eyes when he saw Murmur once more; ,saw,176,177,1,2
The king could not believe his eyes when he saw Murmur once more; ,saw,BEFORE, but he was very friendly and promised him gold and green forests. ,promised,177,178,2,1
 but he was very friendly and promised him gold and green forests. ,promised,BEFORE,"But when Murmur asked for more work, he told him to travel to his troll's castle, where no one dared go, and to remain there until he had built a bridge across the sound, so that people could cross. ",asked,178,179,1,0
"But when Murmur asked for more work, he told him to travel to his troll's castle, where no one dared go, and to remain there until he had built a bridge across the sound, so that people could cross. ",asked,BEFORE,"If he could do that, he would reward him well, yes, he would even give him his daughter, said the king. ",said,179,180,0,6
"If he could do that, he would reward him well, yes, he would even give him his daughter, said the king. ",said,BEFORE,"He would attend to it, said Murmur. ",said,180,181,6,2
"He would attend to it, said Murmur. ",said,AFTER,Yet no human being had ever returned thence alive; ,returned,181,182,2,1
Yet no human being had ever returned thence alive; ,returned,BEFORE," all who had gotten so far, lay on the ground dead, and crushed to a jelly, and the king thought, when sending him there, that he would never see him again. ",sending,182,183,1,5
" all who had gotten so far, lay on the ground dead, and crushed to a jelly, and the king thought, when sending him there, that he would never see him again. ",sending,BEFORE,"He took with him his knapsack full of provisions, and a properly turned and twisted block of pine-wood, as well as an ax, a wedge and some wooden chips. ",took,183,185,5,0
"He took with him his knapsack full of provisions, and a properly turned and twisted block of pine-wood, as well as an ax, a wedge and some wooden chips. ",took,BEFORE,"When he reached the sound, the river was full of drifting ice, and it roared like a waterfall. ",reached,185,186,0,0
"When he reached the sound, the river was full of drifting ice, and it roared like a waterfall. ",reached,BEFORE,"But he planted his legs firmly on the ground, and waded along until he got across. ",waded,186,187,0,1
"But he planted his legs firmly on the ground, and waded along until he got across. ",waded,BEFORE,"When he had warmed himself and satisfied his hunger, he wanted to sleep; ",wanted,187,188,1,3
"When he had warmed himself and satisfied his hunger, he wanted to sleep; ",wanted,BEFORE,"The gate flew wide open, and Murmur saw nothing but a pair of yawning jaws that reached from the threshold to the top of the door. ",saw,188,190,3,1
"The gate flew wide open, and Murmur saw nothing but a pair of yawning jaws that reached from the threshold to the top of the door. ",saw,BEFORE,"""Let's see who you may be? ",Let,190,191,1,0
"""Let's see who you may be? ",Let,BEFORE,"Perhaps you are an old friend of mine,"" said Murmur. ",said,191,192,0,1
"Perhaps you are an old friend of mine,"" said Murmur. ",said,AFTER,The devil would gladly have won back some of the tribute Murmur had forced from his grandmother for the king. ,forced,192,195,1,4
The devil would gladly have won back some of the tribute Murmur had forced from his grandmother for the king. ,forced,BEFORE,"Yet, no matter how he played, Murmur always won; ",won,195,196,4,1
"Yet, no matter how he played, Murmur always won; ",won,AFTER, for he made a cross on the cards. ,made,196,197,1,0
 for he made a cross on the cards. ,made,BEFORE,"And after he had won all the devil had with him, the latter had to give him some of the gold and silver that was in the castle. ",won,197,198,0,1
"And after he had won all the devil had with him, the latter had to give him some of the gold and silver that was in the castle. ",won,BEFORE,"""Now we must split wood,"" said Murmur. ",said,198,200,1,2
"""Now we must split wood,"" said Murmur. ",said,AFTER,"He hewed into the block of pine-wood with his ax, and drove in the wedge, but the tree-stump was tough, and would not split at once, though Murmur gave himself all manner of pains. ",hewed,200,201,2,0
"He hewed into the block of pine-wood with his ax, and drove in the wedge, but the tree-stump was tough, and would not split at once, though Murmur gave himself all manner of pains. ",hewed,BEFORE,"""You are supposed to be strong,"" he said to the devil. ",said,201,202,0,3
"""You are supposed to be strong,"" he said to the devil. ",said,BEFORE,"""Spit on your hands, slap in your claws here, and pull the block apart, so that I can see what you can do!"" ",Spit,202,203,3,0
"""Spit on your hands, slap in your claws here, and pull the block apart, so that I can see what you can do!"" ",Spit,BEFORE,"The devil obediently thrust both hands into the split, and tore and clawed with all his might; ",tore,203,204,0,1
"The devil obediently thrust both hands into the split, and tore and clawed with all his might; ",tore,BEFORE," but suddenly Murmur Goose-Egg knocked out the wedge, and there the devil was caught in a vice, while Murmur belabored his back with the ax. ",caught,204,205,1,2
" but suddenly Murmur Goose-Egg knocked out the wedge, and there the devil was caught in a vice, while Murmur belabored his back with the ax. ",caught,BEFORE,"The devil wailed, and begged Murmur to let him go; ",let,205,206,2,2
"The devil wailed, and begged Murmur to let him go; ",let,BEFORE, but Murmur would hear nothing of it until he had promised never to come back and make a nuisance of himself again. ,promised,206,207,2,3
 but Murmur would hear nothing of it until he had promised never to come back and make a nuisance of himself again. ,promised,BEFORE,"Besides that, he had to promise to build a bridge over the sound, on which one could go back and forth at all seasons of the year. ",promise,207,208,3,1
"Besides that, he had to promise to build a bridge over the sound, on which one could go back and forth at all seasons of the year. ",promise,BEFORE,"said the devil, but there was nothing for it but to promise if he wished to go free. ",promise,208,211,1,2
"said the devil, but there was nothing for it but to promise if he wished to go free. ",promise,BEFORE,"Yet he made one condition, that he was to have the first soul that crossed the bridge as sound-toll. ",made,211,212,2,0
"Yet he made one condition, that he was to have the first soul that crossed the bridge as sound-toll. ",made,BEFORE,"He could have it, said Murmur. ",said,212,213,0,2
"He could have it, said Murmur. ",said,AFTER,"Then he let the devil out, and he ran straight home. ",ran,213,214,2,1
"Then he let the devil out, and he ran straight home. ",ran,BEFORE,But Murmur lay down and slept until far into the following day. ,slept,214,215,1,1
But Murmur lay down and slept until far into the following day. ,slept,BEFORE,"Then the king came to see whether Murmur Goose-Egg were lying crushed on the ground, or had merely been badly beaten. ",came,215,216,1,0
"Then the king came to see whether Murmur Goose-Egg were lying crushed on the ground, or had merely been badly beaten. ",came,BEFORE,He had to wade through piles of money before he could reach the bed. ,reach,216,217,0,3
He had to wade through piles of money before he could reach the bed. ,reach,AFTER,"The money was stacked up high along the walls in heaps and in bags, and Murmur lay in the bed and snored. ",lay,217,218,3,2
"The money was stacked up high along the walls in heaps and in bags, and Murmur lay in the bed and snored. ",lay,BEFORE,"""May heaven help me and my daughter!"" ",help,218,219,2,0
"""May heaven help me and my daughter!"" ",help,AFTER,"cried the king, when he saw that Murmur Goose-Egg was in the best of health. ",saw,219,220,0,1
"cried the king, when he saw that Murmur Goose-Egg was in the best of health. ",saw,BEFORE,"Yes, and no one could deny that everything had been well and thoroughly done, said the king. ",said,220,221,1,5
"Yes, and no one could deny that everything had been well and thoroughly done, said the king. ",said,AFTER," and on it stood the devil, ready to collect the toll promised him. ",promised,221,224,5,2
" and on it stood the devil, ready to collect the toll promised him. ",promised,BEFORE,Murmur Goose-Egg wanted the king to be the first to try the bridge with him. ,wanted,224,225,2,0
Murmur Goose-Egg wanted the king to be the first to try the bridge with him. ,wanted,BEFORE,"The king had no mind to do so, therefore Murmur himself mounted a horse, and swung up the fat dairy-maid from the castle before him on the saddle-bow-she looked almost like a gigantic block of wood-and dashed across the bridge with her so that the planks fairly thundered. ",dashed,225,226,0,5
"The king had no mind to do so, therefore Murmur himself mounted a horse, and swung up the fat dairy-maid from the castle before him on the saddle-bow-she looked almost like a gigantic block of wood-and dashed across the bridge with her so that the planks fairly thundered. ",dashed,BEFORE,cried the devil. ,cried,226,229,5,0
cried the devil. ,cried,BEFORE,"If you want her, you must spit on your hands and catch hold of her,"" said Murmur Goose-Egg. ",said,229,231,0,4
"If you want her, you must spit on your hands and catch hold of her,"" said Murmur Goose-Egg. ",said,BEFORE,"If she does not catch hold of me, then I'll certainly not catch hold of her,"" said the devil. ",said,231,233,4,4
"If she does not catch hold of me, then I'll certainly not catch hold of her,"" said the devil. ",said,AFTER,"""You caught me in a vice once, but you can't fool me a second time,"" said he, and flew straight home to his grandmother, and since then nothing more has been heard or seen of him. ",flew,233,234,4,4
"""You caught me in a vice once, but you can't fool me a second time,"" said he, and flew straight home to his grandmother, and since then nothing more has been heard or seen of him. ",flew,BEFORE,But Murmur Goose-Egg hurried back to the castle and asked for the reward the king had promised him. ,asked,234,235,4,1
But Murmur Goose-Egg hurried back to the castle and asked for the reward the king had promised him. ,asked,BEFORE,"And when the king hesitated and began to make all sorts of excuses, in order not to have to keep his promise. ",began,235,236,1,1
"And when the king hesitated and began to make all sorts of excuses, in order not to have to keep his promise. ",began,BEFORE,"Murmur said it would be best to have a substantial knapsackful of provisions made ready, since now he, Murmur, was going to take his reward himself. ",said,236,237,1,0
"Murmur said it would be best to have a substantial knapsackful of provisions made ready, since now he, Murmur, was going to take his reward himself. ",said,BEFORE,"This the king did, and when the knapsack was ready, Murmur took the king along with him in front of the castle, and gave him a proper shove, so that he flew high up into the air. ",flew,237,238,0,4
"This the king did, and when the knapsack was ready, Murmur took the king along with him in front of the castle, and gave him a proper shove, so that he flew high up into the air. ",flew,BEFORE,"And he threw the knapsack up after him, so that he would not be left altogether without provisions. ",threw,238,239,4,0
"And he threw the knapsack up after him, so that he would not be left altogether without provisions. ",threw,AFTER,"If he has not come down yet, then he, together with the knapsack, is floating between heaven and earth to this very day.",floating,239,240,0,3
