sentence1,event1,te_rel,sentence2,event2,s_id,s_id2,e_id,e_id2
"An old couple once lived in a hut under a grove of palm trees, and they had one son and one daughter. ",had,BEFORE,"They were all very happy together for many years, and then the father became very ill, and felt he was going to die. ",felt,0,1,1,2
"They were all very happy together for many years, and then the father became very ill, and felt he was going to die. ",felt,BEFORE,"He called his children to the place where he lay on the floor--for no one had any beds in that country--and said to his son, 'I have no herds of cattle to leave you--only the few things there are in the house--for I am a poor man, as you know. ",know,1,2,2,8
"He called his children to the place where he lay on the floor--for no one had any beds in that country--and said to his son, 'I have no herds of cattle to leave you--only the few things there are in the house--for I am a poor man, as you know. ",know,BEFORE,But choose: will you have my blessing or my property?' ,have,2,3,8,2
But choose: will you have my blessing or my property?' ,have,AFTER,"'Your property, certainly,' answered the son, and his father nodded. ",answered,3,4,2,0
"'Your property, certainly,' answered the son, and his father nodded. ",answered,BEFORE,"asked the old man of the girl, who stood by her brother. ",asked,4,6,0,0
"asked the old man of the girl, who stood by her brother. ",asked,BEFORE,"'I will have blessing,' she answered, and her father gave her much blessing. ",answered,6,7,0,2
"'I will have blessing,' she answered, and her father gave her much blessing. ",answered,BEFORE,"That night he died, and his wife and son and daughter mourned for him seven days, and gave him a burial according to the custom of his people. ",mourned,7,8,2,1
"That night he died, and his wife and son and daughter mourned for him seven days, and gave him a burial according to the custom of his people. ",mourned,BEFORE,"But hardly was the time of mourning over, than the mother was attacked by a disease which was common in that country. ",attacked,8,9,1,3
"But hardly was the time of mourning over, than the mother was attacked by a disease which was common in that country. ",attacked,BEFORE,"'I am going away from you,' she said to her children, in a faint voice; ",said,9,10,3,2
"'I am going away from you,' she said to her children, in a faint voice; ",said,BEFORE," 'but first, my son, choose which you will have: blessing or property.' ",choose,10,11,2,0
" 'but first, my son, choose which you will have: blessing or property.' ",choose,BEFORE,"'Property, certainly,' answered the son. ",answered,11,12,0,0
"'Property, certainly,' answered the son. ",answered,BEFORE,"'I will have blessing,' said the girl; ",said,12,14,0,2
"'I will have blessing,' said the girl; ",said,BEFORE," and her mother gave her much blessing, and that night she died. ",gave,14,15,2,0
" and her mother gave her much blessing, and that night she died. ",gave,BEFORE,"When the days of mourning were ended, the brother bade his sister put outside the hut all that belonged to his father and his mother. ",bade,15,16,0,2
"When the days of mourning were ended, the brother bade his sister put outside the hut all that belonged to his father and his mother. ",bade,BEFORE,"So the girl put them out, and he took them away, save only a small pot and a vessel in which she could clean her corn. ",clean,16,17,2,4
"So the girl put them out, and he took them away, save only a small pot and a vessel in which she could clean her corn. ",clean,BEFORE,But she had no corn to clean. ,had,17,18,4,0
But she had no corn to clean. ,had,BEFORE,"She sat at home, sad and hungry, when a neighbour knocked at the door. ",sat,18,19,0,0
"She sat at home, sad and hungry, when a neighbour knocked at the door. ",sat,BEFORE,"'My pot has cracked in the fire, lend me yours to cook my supper in, and I will give you a handful of corn in return.' ",cook,19,20,0,3
"'My pot has cracked in the fire, lend me yours to cook my supper in, and I will give you a handful of corn in return.' ",cook,BEFORE,"And the girl was glad, and that night she was able to have supper herself, and next day another woman borrowed her pot, and then another and another, for never were known so many accidents as befell the village pots at that time. ",borrowed,20,21,3,3
"And the girl was glad, and that night she was able to have supper herself, and next day another woman borrowed her pot, and then another and another, for never were known so many accidents as befell the village pots at that time. ",borrowed,BEFORE,"She soon grew quite fat with all the corn she earned with the help of her pot, and then one evening she picked up a pumpkin seed in a corner, and planted it near her well, and it sprang up, and gave her many pumpkins. ",gave,21,22,3,5
"She soon grew quite fat with all the corn she earned with the help of her pot, and then one evening she picked up a pumpkin seed in a corner, and planted it near her well, and it sprang up, and gave her many pumpkins. ",gave,BEFORE,"At last it happened that a youth from her village passed through the place where the girl's brother was, and the two met and talked. ",happened,22,23,5,0
"At last it happened that a youth from her village passed through the place where the girl's brother was, and the two met and talked. ",happened,BEFORE,"asked the young man, with whom things had gone badly, for he was idle. ",asked,23,25,0,0
"asked the young man, with whom things had gone badly, for he was idle. ",asked,AFTER,"'She is fat and well-liking,' replied the youth, 'for the women borrow her mortar to clean their corn, and borrow her pot to cook it in, and for al this they give her more food than she can eat.' ",clean,25,26,0,4
"'She is fat and well-liking,' replied the youth, 'for the women borrow her mortar to clean their corn, and borrow her pot to cook it in, and for al this they give her more food than she can eat.' ",clean,BEFORE,And he went his way. ,went,26,27,4,0
And he went his way. ,went,BEFORE,"Now the brother was filled with envy at the words of the man, and he set out at once, and before dawn he had reached the hut, and saw the pot and the mortar were standing outside. ",saw,27,28,0,5
"Now the brother was filled with envy at the words of the man, and he set out at once, and before dawn he had reached the hut, and saw the pot and the mortar were standing outside. ",saw,BEFORE,"He slung them over his shoulders and departed, pleased with his own cleverness; ",slung,28,29,5,0
"He slung them over his shoulders and departed, pleased with his own cleverness; ",slung,BEFORE," but when his sister awoke and sought for the pot to cook her corn for breakfast, she could find it nowhere. ",cook,29,30,0,2
" but when his sister awoke and sought for the pot to cook her corn for breakfast, she could find it nowhere. ",cook,AFTER,"At length she said to herself, 'Well, some thief must have stolen them while I slept. ",slept,30,31,2,4
"At length she said to herself, 'Well, some thief must have stolen them while I slept. ",slept,BEFORE,I will go and see if any of my pumpkins are ripe.' ,go,31,32,4,1
I will go and see if any of my pumpkins are ripe.' ,go,BEFORE,"So she ate what she wanted and took the others to the village, and gave them in exchange for corn, and the women said that no pumpkins were as sweet as these, and that she was to bring every day all that she had. ",bring,32,34,1,7
"So she ate what she wanted and took the others to the village, and gave them in exchange for corn, and the women said that no pumpkins were as sweet as these, and that she was to bring every day all that she had. ",bring,AFTER,"In this way she earned more than she needed for herself, and soon was able to get another mortar and cooking pot in exchange for her corn. ",earned,34,35,7,0
"In this way she earned more than she needed for herself, and soon was able to get another mortar and cooking pot in exchange for her corn. ",earned,BEFORE,Then she thought she was quite rich. ,thought,35,36,0,0
Then she thought she was quite rich. ,thought,BEFORE,"Unluckily someone else thought so too, and this was her brother's wife, who had heard all about the pumpkin tree, and sent her slave with a handful of grain to buy her a pumpkin. ",thought,36,37,0,0
"Unluckily someone else thought so too, and this was her brother's wife, who had heard all about the pumpkin tree, and sent her slave with a handful of grain to buy her a pumpkin. ",thought,BEFORE,At first the girl told him that so few were left that she could not spare any; ,told,37,38,0,0
At first the girl told him that so few were left that she could not spare any; ,told,BEFORE," but when she found that he belonged to her brother, she changed her mind, and went out to the tree and gathered the largest and the ripest that was there. ",gathered,38,39,0,4
" but when she found that he belonged to her brother, she changed her mind, and went out to the tree and gathered the largest and the ripest that was there. ",gathered,BEFORE,"'Take this one,' she said to the slave, 'and carry it back to your mistress, but tell her to keep the corn, as the pumpkin is a gift.' ",tell,39,40,4,3
"'Take this one,' she said to the slave, 'and carry it back to your mistress, but tell her to keep the corn, as the pumpkin is a gift.' ",tell,BEFORE,"The brother's wife was overjoyed at the sight of the fruit, and when she tasted it, she declared it was the nicest she had ever eaten. ",declared,40,41,3,3
"The brother's wife was overjoyed at the sight of the fruit, and when she tasted it, she declared it was the nicest she had ever eaten. ",declared,BEFORE,"Indeed, all night she thought of nothing else, and early in the morning she called another slave (for she was a rich woman) and bade him go and ask for another pumpkin. ",bade,41,42,3,3
"Indeed, all night she thought of nothing else, and early in the morning she called another slave (for she was a rich woman) and bade him go and ask for another pumpkin. ",bade,BEFORE,"But the girl, who had just been out to look at her tree, told him that they were all eaten, so he went back empty-handed to his mistress. ",told,42,43,3,3
"But the girl, who had just been out to look at her tree, told him that they were all eaten, so he went back empty-handed to his mistress. ",told,BEFORE,"In the evening her husband returned from hunting a long way off, and found his wife in tears. ",returned,43,44,3,0
"In the evening her husband returned from hunting a long way off, and found his wife in tears. ",returned,BEFORE,asked he. ,asked,44,46,0,0
asked he. ,asked,BEFORE,"'I sent a slave with some grain to your sister to buy some pumpkins, but she would not sell me any, and told me there were none, though I know she lets other people buy them.' ",told,46,47,0,4
"'I sent a slave with some grain to your sister to buy some pumpkins, but she would not sell me any, and told me there were none, though I know she lets other people buy them.' ",told,BEFORE,"'Well, never mind now--go to sleep,' said he, 'and to-morrow I will go and pull up the pumpkin tree, and that will punish her for treating you so badly.' ",punish,47,48,4,7
"'Well, never mind now--go to sleep,' said he, 'and to-morrow I will go and pull up the pumpkin tree, and that will punish her for treating you so badly.' ",punish,AFTER,"So before sunrise he got up and set out for his sister's house, and found her cleaning some corn. ",cleaning,48,49,7,3
"So before sunrise he got up and set out for his sister's house, and found her cleaning some corn. ",cleaning,AFTER,'Why did you refuse to sell my wife a pumpkin yesterday when she wanted one?' ,wanted,49,50,3,3
'Why did you refuse to sell my wife a pumpkin yesterday when she wanted one?' ,wanted,BEFORE,he asked. ,asked,50,51,3,0
he asked. ,asked,BEFORE,"'The old ones are finished, and the new ones are not yet come,' answered the girl. ",answered,51,52,0,4
"'The old ones are finished, and the new ones are not yet come,' answered the girl. ",answered,AFTER,"'When her slave arrived two days ago, there were only four left; ",arrived,52,53,4,0
"'When her slave arrived two days ago, there were only four left; ",arrived,BEFORE," but I gave him one, and would take no corn for it.' ",gave,53,54,0,0
" but I gave him one, and would take no corn for it.' ",gave,BEFORE,'I do not believe you; ,believe,54,55,0,1
'I do not believe you; ,believe,AFTER, you have sold them all to other people. ,sold,55,56,1,1
 you have sold them all to other people. ,sold,BEFORE,"I shall go and cut down the pumpkin,' cried her brother in a rage. ",cried,56,57,1,3
"I shall go and cut down the pumpkin,' cried her brother in a rage. ",cried,BEFORE,"'If you cut down the pumpkin you shall cut off my hand with it,' exclaimed the girl, running up to her tree and catching hold of it. ",running,57,58,3,4
"'If you cut down the pumpkin you shall cut off my hand with it,' exclaimed the girl, running up to her tree and catching hold of it. ",running,BEFORE,"But her brother followed, and with one blow cut off the pumpkin and her hand too. ",followed,58,59,4,0
"But her brother followed, and with one blow cut off the pumpkin and her hand too. ",followed,BEFORE,"Then he went into the house and took away everything he could find, and sold the house to a friend of his who had long wished to have it, and his sister had no home to go to. ",sold,59,60,0,4
"Then he went into the house and took away everything he could find, and sold the house to a friend of his who had long wished to have it, and his sister had no home to go to. ",sold,AFTER,"Meanwhile she had bathed her arm carefully, and bound on it some healing leaves that grew near by, and wrapped a cloth round the leaves, and went to hide in the forest, that her brother might not find her again. ",bound,60,61,4,2
"Meanwhile she had bathed her arm carefully, and bound on it some healing leaves that grew near by, and wrapped a cloth round the leaves, and went to hide in the forest, that her brother might not find her again. ",bound,BEFORE,"For seven days she wandered about, eating only the fruit that hung from the trees above her, and every night she climbed up and tucked herself safely among the creepers which bound together the big branches, so that neither lions nor tigers nor panthers might get at her. ",climbed,61,62,2,3
"For seven days she wandered about, eating only the fruit that hung from the trees above her, and every night she climbed up and tucked herself safely among the creepers which bound together the big branches, so that neither lions nor tigers nor panthers might get at her. ",climbed,BEFORE,When she woke up on the seventh morning she saw from her perch smoke coming up from a little town on the edge of the forest. ,coming,62,63,3,2
When she woke up on the seventh morning she saw from her perch smoke coming up from a little town on the edge of the forest. ,coming,BEFORE,The sight of the huts made her feel more lonely and helpless than before. ,feel,63,64,2,1
The sight of the huts made her feel more lonely and helpless than before. ,feel,BEFORE,"She longed desperately for a draught of milk from a gourd, for there were no streams in that part, and she was very thirsty, but how was she to earn anything with only one hand? ",earn,64,65,1,4
"She longed desperately for a draught of milk from a gourd, for there were no streams in that part, and she was very thirsty, but how was she to earn anything with only one hand? ",earn,BEFORE,"And at this thought her courage failed, and she began to cry bitterly. ",cry,65,66,4,2
"And at this thought her courage failed, and she began to cry bitterly. ",cry,AFTER,"It happened that the king's son had come out from the town very early to shoot birds, and when the sun grew hot he left tired. ",shoot,66,67,2,3
"It happened that the king's son had come out from the town very early to shoot birds, and when the sun grew hot he left tired. ",shoot,BEFORE,"'I will lie here and rest under this tree,' he said to his attendants. ",said,67,68,3,3
"'I will lie here and rest under this tree,' he said to his attendants. ",said,BEFORE,"Away they went, and the young man fell asleep, and slept long. ",slept,68,70,3,2
"Away they went, and the young man fell asleep, and slept long. ",slept,BEFORE,Suddenly he was awakened by something wet and salt falling on his face. ,awakened,70,71,2,1
Suddenly he was awakened by something wet and salt falling on his face. ,awakened,BEFORE,he said to his slave. ,said,71,74,1,0
he said to his slave. ,said,BEFORE,"'No, master, it is not raining,' answered the slave. ",answered,74,76,0,2
"'No, master, it is not raining,' answered the slave. ",answered,BEFORE,"'Then climb up the tree and see what it is,' and the slave climbed up, and came back and told his master that a beautiful girl was sitting up there, and that it must have been her tears which had fallen on the face of the king's son. ",told,76,77,2,5
"'Then climb up the tree and see what it is,' and the slave climbed up, and came back and told his master that a beautiful girl was sitting up there, and that it must have been her tears which had fallen on the face of the king's son. ",told,AFTER,'Why was she crying?' ,crying,77,78,5,1
'Why was she crying?' ,crying,BEFORE,inquired the prince. ,inquired,78,79,1,0
inquired the prince. ,inquired,BEFORE,'I cannot tell--I did not dare to ask her; ,ask,79,80,0,4
'I cannot tell--I did not dare to ask her; ,ask,BEFORE, but perhaps she would tell you.' ,tell,80,81,4,1
 but perhaps she would tell you.' ,tell,AFTER,"And the master, greatly wondering, climbed up the tree. ",climbed,81,82,1,1
"And the master, greatly wondering, climbed up the tree. ",climbed,BEFORE,"said he gently, and, as she only sobbed louder, he continued: 'Are you a woman, or a spirit of the woods?' ",sobbed,82,84,1,1
"said he gently, and, as she only sobbed louder, he continued: 'Are you a woman, or a spirit of the woods?' ",sobbed,BEFORE,"'I am a woman,' she answered slowly, wiping her eyes with a leaf of the creeper that hung about her. ",answered,84,85,1,1
"'I am a woman,' she answered slowly, wiping her eyes with a leaf of the creeper that hung about her. ",answered,AFTER,'Then why do you cry?' ,cry,85,86,1,1
'Then why do you cry?' ,cry,BEFORE,he persisted. ,persisted,86,87,1,0
he persisted. ,persisted,BEFORE,"'I have many things to cry for,' she replied, 'more than you could ever guess.' ",replied,87,88,0,2
"'I have many things to cry for,' she replied, 'more than you could ever guess.' ",replied,BEFORE,"'Come home with me,' said the prince; ",said,88,89,2,1
"'Come home with me,' said the prince; ",said,BEFORE,"she said, opening her eyes and staring at him. ",staring,89,94,1,2
"she said, opening her eyes and staring at him. ",staring,BEFORE,"'Once every month I and my friends shoot birds in the forest,' he answered, 'but I was tired and bade them leave me to rest. ",answered,94,95,2,1
"'Once every month I and my friends shoot birds in the forest,' he answered, 'but I was tired and bade them leave me to rest. ",answered,AFTER,And you--what are you doing up in this tree?' ,doing,95,96,1,1
And you--what are you doing up in this tree?' ,doing,BEFORE,"At that she began to cry again, and told the king's son all that had befallen her since the death of her mother. ",told,96,97,1,2
"At that she began to cry again, and told the king's son all that had befallen her since the death of her mother. ",told,BEFORE,"'I cannot come down with you, for I do not like anyone to see me,' she ended with a sob. ",ended,97,98,2,5
"'I cannot come down with you, for I do not like anyone to see me,' she ended with a sob. ",ended,BEFORE,"I will manage all that,' said the king's son, and swinging himself to a lower branch, he bade his slave go quickly into the town, and bring back with him four strong men and a curtained litter. ",bade,98,100,5,4
"I will manage all that,' said the king's son, and swinging himself to a lower branch, he bade his slave go quickly into the town, and bring back with him four strong men and a curtained litter. ",bade,BEFORE,"When the man was gone, the girl climbed down, and hid herself on the ground in some bushes. ",hid,100,101,4,3
"When the man was gone, the girl climbed down, and hid herself on the ground in some bushes. ",hid,BEFORE,"Very soon the slave returned with the litter, which was placed on the ground close to the bushes where the girl lay. ",returned,101,102,3,0
"Very soon the slave returned with the litter, which was placed on the ground close to the bushes where the girl lay. ",returned,BEFORE,"'Now go, all of you, and call my attendants, for I do not wish to say here any longer,' he said to the men, and as soon as they were out of sight he bade the girl get into the litter, and fasten the curtains tightly. ",bade,102,103,0,7
"'Now go, all of you, and call my attendants, for I do not wish to say here any longer,' he said to the men, and as soon as they were out of sight he bade the girl get into the litter, and fasten the curtains tightly. ",bade,BEFORE,"asked they, breathless with running. ",asked,103,106,7,0
"asked they, breathless with running. ",asked,BEFORE,'I think I am ill; ,think,106,107,0,0
'I think I am ill; ,think,BEFORE," I am cold,' he said, and signing to the bearers, he drew the curtains, and was carried through the forest right inside his own house. ",carried,107,108,0,5
" I am cold,' he said, and signing to the bearers, he drew the curtains, and was carried through the forest right inside his own house. ",carried,BEFORE,"'Tell my father and mother that I have a fever, and want some gruel,' said he, 'and bid them send it quickly.' ",bid,108,109,5,4
"'Tell my father and mother that I have a fever, and want some gruel,' said he, 'and bid them send it quickly.' ",bid,BEFORE,"So the slave hastened to the king's palace and gave his message, which troubled both the king and the queen greatly. ",gave,109,110,4,1
"So the slave hastened to the king's palace and gave his message, which troubled both the king and the queen greatly. ",gave,BEFORE,"A pot of hot gruel was instantly prepared, and carried over to the sick man, and as soon as the council which was sitting was over, the king and his ministers went to pay him a visit, bearing a message from the queen that she would follow a little later. ",went,110,111,1,6
"A pot of hot gruel was instantly prepared, and carried over to the sick man, and as soon as the council which was sitting was over, the king and his ministers went to pay him a visit, bearing a message from the queen that she would follow a little later. ",went,AFTER,"Now the prince had pretended to be ill in order to soften his parent's hearts, and the next day he declared he felt better, and, getting into his litter, was carried to the palace in state, drums being beaten all along the road. ",felt,111,112,6,5
"Now the prince had pretended to be ill in order to soften his parent's hearts, and the next day he declared he felt better, and, getting into his litter, was carried to the palace in state, drums being beaten all along the road. ",felt,BEFORE,"He dismounted at the foot of the steps and walked up, a great parasol being held over his head by a slave. ",held,112,113,5,3
"He dismounted at the foot of the steps and walked up, a great parasol being held over his head by a slave. ",held,BEFORE,"Then he entered the cool, dark room where his father and mother were sitting, and said to them: 'I saw a girl yesterday in the forest whom I wish to marry, and, unknown to my attendants, I brought her back to my house in a litter. ",saw,113,114,3,4
"Then he entered the cool, dark room where his father and mother were sitting, and said to them: 'I saw a girl yesterday in the forest whom I wish to marry, and, unknown to my attendants, I brought her back to my house in a litter. ",saw,BEFORE,"Give me your consent, I beg, for no other woman pleases me as well, even though she has but one hand!' ",beg,114,115,4,1
"Give me your consent, I beg, for no other woman pleases me as well, even though she has but one hand!' ",beg,BEFORE,"Of course the king and queen would have preferred a daughter-in-law with two hands, and one who could have brought riches with her, but they could not bear to say 'No' to their son, so they told him it should be as he chose, and that the wedding feast should be prepared immediately. ",told,115,116,1,9
"Of course the king and queen would have preferred a daughter-in-law with two hands, and one who could have brought riches with her, but they could not bear to say 'No' to their son, so they told him it should be as he chose, and that the wedding feast should be prepared immediately. ",told,BEFORE,"The girl could scarcely believe her good fortune, and, in gratitude for all the kindness shown her, was so useful and pleasant to her husband's parents that they soon loved her. ",believe,116,117,9,1
"The girl could scarcely believe her good fortune, and, in gratitude for all the kindness shown her, was so useful and pleasant to her husband's parents that they soon loved her. ",believe,BEFORE,"By and bye a baby was born to her, and soon after that the prince was sent on a journey by his father to visit some of the distant towns of the kingdom, and to set right things that had gone wrong. ",sent,117,118,1,3
"By and bye a baby was born to her, and soon after that the prince was sent on a journey by his father to visit some of the distant towns of the kingdom, and to set right things that had gone wrong. ",sent,BEFORE,"No sooner had he started than the girl's brother, who had wasted all the riches his wife had brought him in recklessness and folly, and was now very poor, chanced to come into the town, and as he passed he heard a man say, 'Do you know that the king's son has married a woman who has lost one of her hands?' ",know,118,119,3,13
