sentence1,event1,te_rel,sentence2,event2,s_id,s_id2,e_id,e_id2
"No sooner had he started than the girl's brother, who had wasted all the riches his wife had brought him in recklessness and folly, and was now very poor, chanced to come into the town, and as he passed he heard a man say, 'Do you know that the king's son has married a woman who has lost one of her hands?' ",know,BEFORE,"On hearing these words the brother stopped and asked, 'Where did he find such a woman?' ",asked,119,120,13,2
"On hearing these words the brother stopped and asked, 'Where did he find such a woman?' ",asked,BEFORE,"'In the forest,' answered the man, and the cruel brother guessed at once it must be his sister. ",answered,120,121,2,0
"'In the forest,' answered the man, and the cruel brother guessed at once it must be his sister. ",answered,AFTER,"A great rage took possession of his soul as he thought of the girl whom he had tried to ruin being after all so much better off than himself, and he vowed that he would work her ill. ",tried,121,122,0,3
"A great rage took possession of his soul as he thought of the girl whom he had tried to ruin being after all so much better off than himself, and he vowed that he would work her ill. ",tried,BEFORE,Therefore that very afternoon he made his way to the palace and asked to see the king. ,asked,122,123,3,1
Therefore that very afternoon he made his way to the palace and asked to see the king. ,asked,BEFORE,"When he was admitted to his presence, he knelt down and touched the ground with his forehead, and the king bade him stand up and tell wherefore he had come. ",bade,123,124,1,4
"When he was admitted to his presence, he knelt down and touched the ground with his forehead, and the king bade him stand up and tell wherefore he had come. ",bade,BEFORE,"'By the kindness of your heart have you been deceived, O king,' said he. ",said,124,125,4,3
"'By the kindness of your heart have you been deceived, O king,' said he. ",said,AFTER,'Your son has married a girl who has lost a hand. ,married,125,126,3,1
'Your son has married a girl who has lost a hand. ,married,BEFORE,Do you know why she had lost it? ,know,126,127,1,1
Do you know why she had lost it? ,know,AFTER,"She was a witch, and has wedded three husbands, and each husband she has put to death with her arts. ",wedded,127,128,1,2
"She was a witch, and has wedded three husbands, and each husband she has put to death with her arts. ",wedded,BEFORE,"Then the people of the town cut off her hand, and turned her into the forest. ",turned,128,129,2,1
"Then the people of the town cut off her hand, and turned her into the forest. ",turned,BEFORE,"And what I say is true, for her town is my town also.' ",say,129,130,1,0
"And what I say is true, for her town is my town also.' ",say,BEFORE,"The king listened, and his face grew dark. ",grew,130,131,0,1
"The king listened, and his face grew dark. ",grew,BEFORE,"Unluckily he had a hasty temper, and did not stop to reason, and, instead of sending to the town, and discovering people who knew his daughter-in-law and could have told him how hard she had worked and how poor she had been, he believed all the brother's lying words, and made the queen believe them too. ",told,131,132,1,8
"Unluckily he had a hasty temper, and did not stop to reason, and, instead of sending to the town, and discovering people who knew his daughter-in-law and could have told him how hard she had worked and how poor she had been, he believed all the brother's lying words, and made the queen believe them too. ",told,BEFORE,"Together they took counsel what they should do, and in the end they decided that they also would put her out of the town. ",decided,132,133,8,3
"Together they took counsel what they should do, and in the end they decided that they also would put her out of the town. ",decided,BEFORE,But this did not content the brother. ,content,133,134,3,1
But this did not content the brother. ,content,BEFORE,"'Kill her,' he said. ",said,134,135,1,1
"'Kill her,' he said. ",said,AFTER,'It is no more than she deserves for daring to marry the king's son. ,marry,135,136,1,3
'It is no more than she deserves for daring to marry the king's son. ,marry,BEFORE,Then she can do no more hurt to anyone.' ,do,136,137,3,1
Then she can do no more hurt to anyone.' ,do,BEFORE,"'We cannot kill her,' answered they; ",kill,137,138,1,1
"'We cannot kill her,' answered they; ",kill,BEFORE," 'if we did, our son would assuredly kill us. ",kill,138,139,1,2
" 'if we did, our son would assuredly kill us. ",kill,BEFORE,"Let us do as the others did, and put her out of the town. ",Let,139,140,2,0
"Let us do as the others did, and put her out of the town. ",Let,BEFORE,And with this the envious brother was forced to be content.' ,forced,140,141,0,1
And with this the envious brother was forced to be content.' ,forced,AFTER,"The poor girl loved her husband very much, but just then the baby was more to her than all else in the world, and as long as she had him with her, she did not very much mind anything. ",mind,141,142,1,4
"The poor girl loved her husband very much, but just then the baby was more to her than all else in the world, and as long as she had him with her, she did not very much mind anything. ",mind,BEFORE,"So, taking her son on her arm, and hanging a little earthen pot for cooking round her neck, she left her house with its great peacock fans and slaves and seats of ivory, and plunged into the forest. ",left,142,143,4,3
"So, taking her son on her arm, and hanging a little earthen pot for cooking round her neck, she left her house with its great peacock fans and slaves and seats of ivory, and plunged into the forest. ",left,BEFORE,"For a while she walked, not knowing whither she went, then by and bye she grew tired, and sat under a tree to rest and to hush her baby to sleep. ",went,143,144,3,2
"For a while she walked, not knowing whither she went, then by and bye she grew tired, and sat under a tree to rest and to hush her baby to sleep. ",went,BEFORE,"Suddenly she raised her eyes, and saw a snake wriggling from under the bushes towards her. ",saw,144,145,2,1
"Suddenly she raised her eyes, and saw a snake wriggling from under the bushes towards her. ",saw,BEFORE,"'I am a dead woman,' she said to herself, and stayed quite still, for indeed she was too frightened to move. ",stayed,145,146,1,2
"'I am a dead woman,' she said to herself, and stayed quite still, for indeed she was too frightened to move. ",stayed,BEFORE,"In another minute the snake had reached her side, and to her surprise he spoke. ",reached,146,147,2,1
"In another minute the snake had reached her side, and to her surprise he spoke. ",reached,BEFORE,"'Open your earthen pot, and let me go in. ",Open,147,148,1,0
"'Open your earthen pot, and let me go in. ",Open,BEFORE,"Save me from sun, and I will save you from rain,' and she opened the pot, and when the snake had slipped in, she put on the cover. ",save,148,149,0,2
"Save me from sun, and I will save you from rain,' and she opened the pot, and when the snake had slipped in, she put on the cover. ",save,BEFORE,"Soon she beheld another snake coming after the other one, and when it had reached her it stopped and said, 'Did you see a small grey snake pass this way just now?' ",said,149,150,2,5
"Soon she beheld another snake coming after the other one, and when it had reached her it stopped and said, 'Did you see a small grey snake pass this way just now?' ",said,BEFORE,"'Yes,' she answered, 'it was going very quickly.' ",answered,150,151,5,0
"'Yes,' she answered, 'it was going very quickly.' ",answered,BEFORE,"'Ah, I must hurry and catch it up,' replied the second snake, and it hastened on. ",replied,151,152,0,3
"'Ah, I must hurry and catch it up,' replied the second snake, and it hastened on. ",replied,BEFORE,"When it was out of sight, a voice from the pot said: 'Uncover me,' and she lifted the lid, and the little grey snake slid rapidly to the ground. ",lifted,152,153,3,3
"When it was out of sight, a voice from the pot said: 'Uncover me,' and she lifted the lid, and the little grey snake slid rapidly to the ground. ",lifted,BEFORE,"'But tell me, where are you going?' ",tell,153,155,3,0
"'But tell me, where are you going?' ",tell,BEFORE,"'I cannot tell you, for I do not know,' she answered. ",answered,155,156,0,4
"'I cannot tell you, for I do not know,' she answered. ",answered,BEFORE,"'Follow me, and let us go home together,' said the snake, and the girl followed his through the forest and along the green paths, till they came to a great lake, where they stopped to rest. ",followed,156,158,4,4
"'Follow me, and let us go home together,' said the snake, and the girl followed his through the forest and along the green paths, till they came to a great lake, where they stopped to rest. ",followed,AFTER,"'The sun is hot,' said the snake, 'and you have walked far. ",walked,158,159,4,3
"'The sun is hot,' said the snake, 'and you have walked far. ",walked,BEFORE,Take your baby and bathe in that cool place where the boughs of the tree stretch far over the water.' ,Take,159,160,3,0
Take your baby and bathe in that cool place where the boughs of the tree stretch far over the water.' ,Take,BEFORE,"'Yes, I will,' answered she, and they went in. ",answered,160,161,0,1
"'Yes, I will,' answered she, and they went in. ",answered,BEFORE,"The baby splashed and crowed with delight, and then he gave a spring and fell right in, down, down, down, and his mother could not find him, though she searched all among the reeds. ",gave,161,162,1,2
"The baby splashed and crowed with delight, and then he gave a spring and fell right in, down, down, down, and his mother could not find him, though she searched all among the reeds. ",gave,BEFORE,"Full of terror, she made her way back to the bank, and called to the snake, 'My baby is gone!--he is drowned, and never shall I see him again.' ",drowned,162,163,2,4
"Full of terror, she made her way back to the bank, and called to the snake, 'My baby is gone!--he is drowned, and never shall I see him again.' ",drowned,BEFORE,"'Go in once more,' said the snake, 'and feel everywhere, even among the trees that have their roots in the water, lest perhaps he may be held fast there.' ",held,163,164,4,6
"'Go in once more,' said the snake, 'and feel everywhere, even among the trees that have their roots in the water, lest perhaps he may be held fast there.' ",held,BEFORE,"Swiftly she went back and felt everywhere with her whole hand, even putting her fingers into the tiniest crannies, where a crab could hardly have taken shelter. ",felt,164,165,6,1
"Swiftly she went back and felt everywhere with her whole hand, even putting her fingers into the tiniest crannies, where a crab could hardly have taken shelter. ",felt,BEFORE,"'No, he is not here,' she cried. ",cried,165,166,1,1
"'No, he is not here,' she cried. ",cried,BEFORE,"But the snake took no notice, and only answered, 'Put in your other arm too.' ",answered,166,168,1,1
"But the snake took no notice, and only answered, 'Put in your other arm too.' ",answered,BEFORE,"she asked, 'when it has no hand to feel with?' ",asked,168,170,1,0
"she asked, 'when it has no hand to feel with?' ",asked,BEFORE,"but all the same she did as she was bid, and in an instant the wounded arm touched something round and soft, lying between two stones in a clump of reeds. ",touched,170,171,0,4
"but all the same she did as she was bid, and in an instant the wounded arm touched something round and soft, lying between two stones in a clump of reeds. ",touched,BEFORE,"she shouted, and lifted him up, merry and laughing, and not a bit hurt or frightened. ",shouted,171,173,4,0
"she shouted, and lifted him up, merry and laughing, and not a bit hurt or frightened. ",shouted,BEFORE,'Have you found him this time?' ,found,173,174,0,1
'Have you found him this time?' ,found,BEFORE,asked the snake. ,asked,174,175,1,0
asked the snake. ,asked,BEFORE,"she answered, 'and, why--why--I have got my hand back again!' ",answered,175,177,0,0
"she answered, 'and, why--why--I have got my hand back again!' ",answered,BEFORE,and from sheer joy she burst into tears. ,burst,177,178,0,0
and from sheer joy she burst into tears. ,burst,BEFORE,"The snake let her weep for a little while, and then he said-- 'Now we will journey on to my family, and we will all repay you for the kindness you showed to me.' ",let,178,179,0,0
"The snake let her weep for a little while, and then he said-- 'Now we will journey on to my family, and we will all repay you for the kindness you showed to me.' ",let,BEFORE,"'You have done more than enough in giving me back my hand,' replied the girl; ",replied,179,180,0,3
"'You have done more than enough in giving me back my hand,' replied the girl; ",replied,BEFORE, but the snake only smiled. ,smiled,180,181,3,0
 but the snake only smiled. ,smiled,BEFORE,"'Be quick, lest the sun should set,' he answered, and began to wriggle along so fast that the girl could hardly follow him. ",answered,181,182,0,3
"'Be quick, lest the sun should set,' he answered, and began to wriggle along so fast that the girl could hardly follow him. ",answered,AFTER,"By and bye they arrived at the house in a tree where the snake lived, when he was not travelling with his father and mother. ",travelling,182,183,3,3
"By and bye they arrived at the house in a tree where the snake lived, when he was not travelling with his father and mother. ",travelling,BEFORE,"And he told them all his adventures, and how he had escaped from his enemy. ",told,183,184,3,0
"And he told them all his adventures, and how he had escaped from his enemy. ",told,BEFORE,The father and mother snake could not do enough to show their gratitude. ,do,184,185,0,1
The father and mother snake could not do enough to show their gratitude. ,do,BEFORE,"They made their guest lie down on a hammock woven of the strong creepers which hung from bough to bough, till she was quite rested after her wanderings, while they watched the baby and gave him milk to drink from the cocoa-nuts which they persuaded their friends the monkeys to crack for them. ",gave,185,186,1,6
"They made their guest lie down on a hammock woven of the strong creepers which hung from bough to bough, till she was quite rested after her wanderings, while they watched the baby and gave him milk to drink from the cocoa-nuts which they persuaded their friends the monkeys to crack for them. ",gave,BEFORE,"They even managed to carry small fruit tied up in their tails for the baby's mother, who felt at last that she was safe and at peace. ",carry,186,187,6,1
"They even managed to carry small fruit tied up in their tails for the baby's mother, who felt at last that she was safe and at peace. ",carry,AFTER,"Not that she forgot her husband, for she often thought of him and longed to show him her son, and in the night she would sometimes lie awake and wonder where he was. ",longed,187,188,1,2
"Not that she forgot her husband, for she often thought of him and longed to show him her son, and in the night she would sometimes lie awake and wonder where he was. ",longed,BEFORE,And what was the prince doing? ,doing,188,190,2,1
And what was the prince doing? ,doing,BEFORE,"Well, he had fallen very ill when he was on the furthest border of the kingdom, and he was nursed by some kind people who did not know who he was, so that the king and queen heard nothing about him. ",know,190,191,1,6
"Well, he had fallen very ill when he was on the furthest border of the kingdom, and he was nursed by some kind people who did not know who he was, so that the king and queen heard nothing about him. ",know,BEFORE,"When he was better he made his way home again, and into his father's palace, where he found a strange man standing behind the throne with the peacock's feathers. ",standing,191,192,6,3
"When he was better he made his way home again, and into his father's palace, where he found a strange man standing behind the throne with the peacock's feathers. ",standing,AFTER,"This was his wife's brother, whom the king had taken into high favour, though, of course, the prince was quite ignorant of what had happened. ",taken,192,193,3,2
"This was his wife's brother, whom the king had taken into high favour, though, of course, the prince was quite ignorant of what had happened. ",taken,BEFORE,"For a moment the king and queen stared at their son, as if he had been unknown to them; ",stared,193,194,2,0
"For a moment the king and queen stared at their son, as if he had been unknown to them; ",stared,AFTER, he had grown so thin and weak during his illness that his shoulders were bowed like those of an old man. ,bowed,194,195,0,3
 he had grown so thin and weak during his illness that his shoulders were bowed like those of an old man. ,bowed,BEFORE,'Have you forgotten me so soon?' ,forgotten,195,196,3,1
'Have you forgotten me so soon?' ,forgotten,BEFORE,"At the sound of his voice they gave a cry and ran towards him, and poured out questions as to what had happened, and why he looked like that. ",looked,196,198,1,5
"At the sound of his voice they gave a cry and ran towards him, and poured out questions as to what had happened, and why he looked like that. ",looked,BEFORE,But the prince did not answer any of them. ,answer,198,199,5,1
But the prince did not answer any of them. ,answer,BEFORE,Then the queen replied: 'She is dead.' ,replied,199,203,1,0
Then the queen replied: 'She is dead.' ,replied,BEFORE,"he repeated, stepping a little backwards. ",stepping,203,205,0,1
"he repeated, stepping a little backwards. ",stepping,BEFORE,The young man stood silent. ,stood,205,208,1,0
The young man stood silent. ,stood,BEFORE,"Then he said, 'Show me their graves.' ",said,208,209,0,0
"Then he said, 'Show me their graves.' ",said,BEFORE,"At these words the king, who had been feeling rather uncomfortable, took heart again, for had he not prepared two beautiful tombs for his son to see, so that he might never, never guess what had been done to his wife? ",guess,209,210,0,8
"At these words the king, who had been feeling rather uncomfortable, took heart again, for had he not prepared two beautiful tombs for his son to see, so that he might never, never guess what had been done to his wife? ",guess,AFTER,All these months the king and queen had been telling each other how good and merciful they had been not to take her brother's advice and to put her to death. ,telling,210,211,8,2
All these months the king and queen had been telling each other how good and merciful they had been not to take her brother's advice and to put her to death. ,telling,BEFORE,"Then the king led the way to the courtyard just behind the palace, and through the gate into a beautiful garden where stood two splendid tombs in a green space under the trees. ",led,211,213,2,0
"Then the king led the way to the courtyard just behind the palace, and through the gate into a beautiful garden where stood two splendid tombs in a green space under the trees. ",led,BEFORE,"The prince advanced alone, and, resting his head against the stone, he burst into tears. ",resting,213,214,0,1
"The prince advanced alone, and, resting his head against the stone, he burst into tears. ",resting,BEFORE,His father and mother stood silently behind with a curious pang in their souls which they did not quite understand. ,stood,214,215,1,0
His father and mother stood silently behind with a curious pang in their souls which they did not quite understand. ,stood,BEFORE,"But after a while the prince turned round, and walking past them in to the palace he bade the slaves bring him mourning. ",bade,215,217,0,2
"But after a while the prince turned round, and walking past them in to the palace he bade the slaves bring him mourning. ",bade,BEFORE,"For seven days no one saw him, but at the end of them he went out hunting, and helped his father rule his people. ",saw,217,218,2,0
"For seven days no one saw him, but at the end of them he went out hunting, and helped his father rule his people. ",saw,BEFORE,Only no one dared to speak to him of his wife and son. ,speak,218,219,0,1
Only no one dared to speak to him of his wife and son. ,speak,BEFORE,"At last one morning, after the girl had been lying awake all night thinking of her husband, she said to her friend the snake: 'You have all shown me much kindness, but now I am well again, and want to go home and hear some news of my husband, and if he still mourns for me!' ",mourns,219,220,1,10
"At last one morning, after the girl had been lying awake all night thinking of her husband, she said to her friend the snake: 'You have all shown me much kindness, but now I am well again, and want to go home and hear some news of my husband, and if he still mourns for me!' ",mourns,BEFORE,"Now the heart of the snake was sad at her words, but he only said: 'Yes, thus it must be; ",said,220,221,10,1
"Now the heart of the snake was sad at her words, but he only said: 'Yes, thus it must be; ",said,AFTER," go and bid farewell to my father and mother, but if they offer you a present, see that you take nothing but my father's ring and my mother's casket.' ",bid,221,222,1,1
" go and bid farewell to my father and mother, but if they offer you a present, see that you take nothing but my father's ring and my mother's casket.' ",bid,BEFORE,"So she went to the parent snakes, who wept bitterly at the thought of losing her, and offered her gold and jewels as much as she could carry in remembrance of them. ",offered,222,223,1,3
"So she went to the parent snakes, who wept bitterly at the thought of losing her, and offered her gold and jewels as much as she could carry in remembrance of them. ",offered,BEFORE,But the girl shook her head and pushed the shining heap away from her. ,shook,223,224,3,0
But the girl shook her head and pushed the shining heap away from her. ,shook,BEFORE,"'I shall never forget you, never,' she said in a broken voice, 'but the only tokens I will accept from you are that little ring and this old casket.' ",accept,224,225,0,4
"'I shall never forget you, never,' she said in a broken voice, 'but the only tokens I will accept from you are that little ring and this old casket.' ",accept,BEFORE,The two snakes looked at each other in dismay. ,looked,225,226,4,0
The two snakes looked at each other in dismay. ,looked,AFTER,The ring and the casket were the only things they did not want her to have. ,want,226,227,0,2
The ring and the casket were the only things they did not want her to have. ,want,BEFORE,Then after a short pause they spoke. ,spoke,227,228,2,0
Then after a short pause they spoke. ,spoke,AFTER,'Why do you want the ring and casket so much? ,want,228,229,0,1
'Why do you want the ring and casket so much? ,want,BEFORE,Who has told you of them?' ,told,229,230,1,1
Who has told you of them?' ,told,BEFORE," it is just my fancy,' answered she. ",answered,230,232,1,1
" it is just my fancy,' answered she. ",answered,BEFORE,But the old snakes shook their heads and replied: 'Not so; ,replied,232,233,1,1
But the old snakes shook their heads and replied: 'Not so; ,replied,BEFORE," it is our son who told you, and, as he said, so it must be. ",said,233,234,1,2
" it is our son who told you, and, as he said, so it must be. ",said,AFTER,"If you need food, or clothes, or a house, tell the ring and it will find them for you. ",need,234,235,2,0
"If you need food, or clothes, or a house, tell the ring and it will find them for you. ",need,BEFORE,"Then they both gave her their blessing, and she picked up her baby and went her way. ",went,235,237,0,2
"Then they both gave her their blessing, and she picked up her baby and went her way. ",went,BEFORE,"She walked for a long time, till at length she came near the town where her husband and his father dwelt. ",walked,237,238,2,0
"She walked for a long time, till at length she came near the town where her husband and his father dwelt. ",walked,BEFORE,"Here she stopped under a grove of palm trees, and told the ring that she wanted a house. ",told,238,239,0,1
"Here she stopped under a grove of palm trees, and told the ring that she wanted a house. ",told,BEFORE,"'It is ready, mistress,' whispered a queer little voice which made her jump, and, looking behind her, she saw a lovely palace made of the finest woods, and a row of slaves with tall fans bowing before the door. ",saw,239,240,1,4
"'It is ready, mistress,' whispered a queer little voice which made her jump, and, looking behind her, she saw a lovely palace made of the finest woods, and a row of slaves with tall fans bowing before the door. ",saw,BEFORE,"Glad indeed was she to enter, for she was very tired, and, after eating a good supper of fruit and milk which she found in one of the rooms, she flung herself down on a pile of cushions and went to sleep with her baby beside her. ",sleep,240,241,4,7
"Glad indeed was she to enter, for she was very tired, and, after eating a good supper of fruit and milk which she found in one of the rooms, she flung herself down on a pile of cushions and went to sleep with her baby beside her. ",sleep,BEFORE,"Here she stayed quietly, and every day the baby grew taller and stronger, and very soon he could run about and even talk. ",stayed,241,242,7,0
"Here she stayed quietly, and every day the baby grew taller and stronger, and very soon he could run about and even talk. ",stayed,BEFORE,"Of course the neighbours had a great deal to say about the house which had been built so quickly--so very quickly--on the outskirts of the town, and invented all kinds of stories about the rich lady who lived in it. ",invented,242,243,0,5
"Of course the neighbours had a great deal to say about the house which had been built so quickly--so very quickly--on the outskirts of the town, and invented all kinds of stories about the rich lady who lived in it. ",invented,BEFORE,"And by and bye, when the king returned with his son from the wars, some of these tales reached his ears. ",reached,243,244,5,1
