sentence1,event1,te_rel,sentence2,event2,s_id,s_id2,e_id,e_id2
"And by and bye, when the king returned with his son from the wars, some of these tales reached his ears. ",reached,BEFORE,"'It is really very odd about that house under the palms,' he said to the queen; ",said,244,245,1,1
"'It is really very odd about that house under the palms,' he said to the queen; ",said,AFTER,"I daresay it is not a lady at all, but a gang of conspirators who want to get possession of my throne. ",want,245,247,1,2
"I daresay it is not a lady at all, but a gang of conspirators who want to get possession of my throne. ",want,BEFORE,To-morrow I shall take my son and my chief ministers and insist on getting inside.' ,insist,247,248,2,2
To-morrow I shall take my son and my chief ministers and insist on getting inside.' ,insist,AFTER,"Soon after sunrise next day the prince's wife was standing on a little hill behind the house, when she saw a cloud of dust coming through the town. ",saw,248,249,2,2
"Soon after sunrise next day the prince's wife was standing on a little hill behind the house, when she saw a cloud of dust coming through the town. ",saw,BEFORE,"A moment afterwards she heard faintly the roll of the drums that announced the king's presence, and saw a crowd of people approaching the grove of palms. ",saw,249,250,2,2
"A moment afterwards she heard faintly the roll of the drums that announced the king's presence, and saw a crowd of people approaching the grove of palms. ",saw,BEFORE,Her heart beat fast. ,beat,250,251,2,0
Her heart beat fast. ,beat,BEFORE,In any case they must not discover her there; ,discover,251,253,0,1
In any case they must not discover her there; ,discover,AFTER," so just bidding the ring prepare some food for them, she ran inside, and bound a veil of golden gauze round her head and face. ",bidding,253,254,1,0
" so just bidding the ring prepare some food for them, she ran inside, and bound a veil of golden gauze round her head and face. ",bidding,BEFORE,"Then, taking the child's hand, she went to the door and waited. ",went,254,255,0,1
"Then, taking the child's hand, she went to the door and waited. ",went,BEFORE,"In a few minutes the whole procession came up, and she stepped forward and begged them to come in and rest. ",rest,255,256,1,4
"In a few minutes the whole procession came up, and she stepped forward and begged them to come in and rest. ",rest,BEFORE,"'Willingly,' answered the king; ",answered,256,257,4,0
"'Willingly,' answered the king; ",answered,BEFORE," 'go first, and we will follow you.' ",follow,257,258,0,2
" 'go first, and we will follow you.' ",follow,AFTER,"They followed her into a long dark room, in which was a table covered with gold cups and baskets filled with dates and cocoa-nuts and all kinds of ripe yellow fruits, and the king and the prince sat upon cushions and were served by slaves, while the ministers, among whom she recognised her own brother, stood behind. ",followed,258,259,2,0
"They followed her into a long dark room, in which was a table covered with gold cups and baskets filled with dates and cocoa-nuts and all kinds of ripe yellow fruits, and the king and the prince sat upon cushions and were served by slaves, while the ministers, among whom she recognised her own brother, stood behind. ",followed,BEFORE,"'Ah, I owe all my misery to him,' she said to herself. ",said,259,260,0,1
"'Ah, I owe all my misery to him,' she said to herself. ",said,AFTER,"'From the first he has hated me,' but outwardly she showed nothing. ",hated,260,261,1,1
"'From the first he has hated me,' but outwardly she showed nothing. ",hated,BEFORE,And when the king asked her what news there was in the town she only answered: 'You have ridden far; ,answered,261,262,1,2
And when the king asked her what news there was in the town she only answered: 'You have ridden far; ,answered,BEFORE," eat first, and drink, for you must be hungry and thirsty, and then I will tell you my news.' ",tell,262,263,2,5
" eat first, and drink, for you must be hungry and thirsty, and then I will tell you my news.' ",tell,AFTER,"'You speak sense,' answered the king, and silence prevailed for some time longer. ",answered,263,264,5,1
"'You speak sense,' answered the king, and silence prevailed for some time longer. ",answered,BEFORE,"Then he said: 'Now, lady, I have finished, and am refreshed, therefore tell me, I pray you, who you are, and whence you come? ",tell,264,265,1,5
"Then he said: 'Now, lady, I have finished, and am refreshed, therefore tell me, I pray you, who you are, and whence you come? ",tell,BEFORE,"She bowed her head and sat down on a big scarlet cushion, drawing her little boy, who was asleep in a corner, on to her knee, and began to tell the story of her life. ",tell,265,267,5,5
"She bowed her head and sat down on a big scarlet cushion, drawing her little boy, who was asleep in a corner, on to her knee, and began to tell the story of her life. ",tell,BEFORE,"As her brother listened, he would fain have left the house and hidden himself in the forest, but it was his duty to wave the fan of peacock's feathers over the king's head to keep off the flies, and he knew he would be seized by the royal guards if he tried to desert his post. ",tried,267,268,5,13
"As her brother listened, he would fain have left the house and hidden himself in the forest, but it was his duty to wave the fan of peacock's feathers over the king's head to keep off the flies, and he knew he would be seized by the royal guards if he tried to desert his post. ",tried,BEFORE,"He must stay where he was, there was no help for it, and luckily for him the king was too much interested in the tale to notice that the fan had ceased moving, and that flies were dancing right on the top of his thick curly hair. ",stay,268,269,13,1
"He must stay where he was, there was no help for it, and luckily for him the king was too much interested in the tale to notice that the fan had ceased moving, and that flies were dancing right on the top of his thick curly hair. ",stay,BEFORE,"The story went on, but the story-teller never once looked at the prince, even through her veil, though he on his side never moved his eyes from her. ",looked,269,270,1,1
"The story went on, but the story-teller never once looked at the prince, even through her veil, though he on his side never moved his eyes from her. ",looked,AFTER,"When she reached the part where she had sat weeping in the tree, the king's son could restrain himself no longer. ",sat,270,271,1,2
"When she reached the part where she had sat weeping in the tree, the king's son could restrain himself no longer. ",sat,BEFORE,"'It is my wife,' he cried, springing to where she sat with the sleeping child in her lap. ",cried,271,272,2,1
"'It is my wife,' he cried, springing to where she sat with the sleeping child in her lap. ",cried,AFTER,"'They have lied to me, and you are not dead after all, nor the boy either! ",lied,272,273,1,1
"'They have lied to me, and you are not dead after all, nor the boy either! ",lied,BEFORE,Why did they lie to me? ,lie,273,275,1,1
Why did they lie to me? ,lie,BEFORE,and why did you leave my house where you were safe?' ,leave,275,276,1,1
and why did you leave my house where you were safe?' ,leave,BEFORE,And he turned and looked fiercely at his father. ,looked,276,277,1,1
And he turned and looked fiercely at his father. ,looked,BEFORE,"'Let me finish my tale first, and then you will know,' answered she, throwing back her veil, and she told how her brother had come to the palace and accused her of being a witch, and had tried to persuade the king to slay her. ",answered,277,278,1,4
"'Let me finish my tale first, and then you will know,' answered she, throwing back her veil, and she told how her brother had come to the palace and accused her of being a witch, and had tried to persuade the king to slay her. ",answered,BEFORE,"'But he would not do that,' she continued softly, 'and after all, if I had stayed on in your house, I should never have met the snake, nor have got my hand back again. ",continued,278,279,4,2
"'But he would not do that,' she continued softly, 'and after all, if I had stayed on in your house, I should never have met the snake, nor have got my hand back again. ",continued,AFTER,our son is growing quite a big boy.' ,growing,279,281,2,1
our son is growing quite a big boy.' ,growing,BEFORE,'And what shall be done to your brother?' ,done,281,282,1,2
'And what shall be done to your brother?' ,done,AFTER,"asked the king, who was glad to think that someone had acted in this matter worse than himself. ",asked,282,283,2,0
"asked the king, who was glad to think that someone had acted in this matter worse than himself. ",asked,BEFORE,"'Put him out of the town,' answered she.",answered,283,284,0,1
