sentence1,event1,te_rel,sentence2,event2,s_id,s_id2,e_id,e_id2
"What a pity that we could not obtain the lime while we were there!"" ",obtain,BEFORE,"Aduan sold his pearl, for which a merchant from foreign parts gave him an enormous sum. ",sold,152,153,1,0
"Aduan sold his pearl, for which a merchant from foreign parts gave him an enormous sum. ",sold,BEFORE,Thus his family grew very wealthy. ,grew,153,154,0,0
Thus his family grew very wealthy. ,grew,AFTER,"Once, on his mother's birthday, he danced with his wife and sang, in order to please her. ",danced,154,155,0,0
"Once, on his mother's birthday, he danced with his wife and sang, in order to please her. ",danced,BEFORE,The news reached the castle of the Dragon Prince and he thought to carry off Rose of Evening by force. ,thought,155,156,0,1
The news reached the castle of the Dragon Prince and he thought to carry off Rose of Evening by force. ,thought,BEFORE,"But Aduan, alarmed, went to the Prince, and declared that both he and his wife were departed spirits. ",declared,156,157,1,2
"But Aduan, alarmed, went to the Prince, and declared that both he and his wife were departed spirits. ",declared,AFTER,"They examined him and since he cast no shadow, his word was taken, and he was not robbed of Rose of Evening.",cast,157,158,2,1
