sentence1,event1,te_rel,sentence2,event2,s_id,s_id2,e_id,e_id2
"In spite of this, however, he was willing to make an attempt, and talked it over with his servant Unfaithful. ",make,BEFORE,"""Why, that is easily done,"" said the latter, ""for Faithful boasted to me that he could get the queen's keys without any difficulty if he wished."" ",boasted,112,113,1,3
"""Why, that is easily done,"" said the latter, ""for Faithful boasted to me that he could get the queen's keys without any difficulty if he wished."" ",boasted,BEFORE,"""Then I shall compel him to keep his word,"" said the king. ",said,113,114,3,3
"""Then I shall compel him to keep his word,"" said the king. ",said,BEFORE,"And he at once ordered Faithful, on pain of death, to get the queen's keys out of the lake by the troll's hill without delay. ",ordered,114,115,3,0
"And he at once ordered Faithful, on pain of death, to get the queen's keys out of the lake by the troll's hill without delay. ",ordered,BEFORE,"This time the youth was not so depressed, for he thought to himself: ""My wise horse will be able to help me."" ",thought,115,116,0,1
"This time the youth was not so depressed, for he thought to himself: ""My wise horse will be able to help me."" ",thought,BEFORE,"And so he was, for he advised him to go along playing his fiddle, and to wait for what might happen. ",playing,116,117,1,3
"And so he was, for he advised him to go along playing his fiddle, and to wait for what might happen. ",playing,AFTER,"After the youth had played for a while, the pike he had saved thrust his head out of the water, recognized him, and asked whether he could be of any service to him. ",played,117,118,3,1
"After the youth had played for a while, the pike he had saved thrust his head out of the water, recognized him, and asked whether he could be of any service to him. ",played,BEFORE,"said the youth, and told him what it was he wanted. ",told,118,120,1,1
"said the youth, and told him what it was he wanted. ",told,BEFORE,"The pike at once dived, quickly rose to the surface of the water with the golden keys in his mouth, and gave them to his deliverer. ",gave,120,121,1,2
"The pike at once dived, quickly rose to the surface of the water with the golden keys in his mouth, and gave them to his deliverer. ",gave,BEFORE,"The latter hastened back with them, and now the queen could open the great chests in the golden hall to her heart's content. ",open,121,122,2,2
"The latter hastened back with them, and now the queen could open the great chests in the golden hall to her heart's content. ",open,AFTER,"Notwithstanding, the king's wife was as sorrowful as ever, and when the king complained about it to Unfaithful, the latter said: ""No doubt it is because she loves Faithful. ",loves,122,123,2,4
"Notwithstanding, the king's wife was as sorrowful as ever, and when the king complained about it to Unfaithful, the latter said: ""No doubt it is because she loves Faithful. ",loves,BEFORE,I would therefore advise that my lord have him beheaded. ,beheaded,123,124,4,3
I would therefore advise that my lord have him beheaded. ,beheaded,BEFORE,"This advice suited the king well, and he determined to carry it out shortly. ",carry,124,126,3,2
"This advice suited the king well, and he determined to carry it out shortly. ",carry,BEFORE,"But one day Faithful's horse said to him: ""The king is going to have your head chopped off. ",said,126,127,2,0
"But one day Faithful's horse said to him: ""The king is going to have your head chopped off. ",said,BEFORE,"So hurry to the wood, play your fiddle, and beg the two doves to bring you a bottle of the water of life. ",play,127,128,0,1
"So hurry to the wood, play your fiddle, and beg the two doves to bring you a bottle of the water of life. ",play,BEFORE,"Then go to the queen and ask her to set your head on your body and to sprinkle you with the water when you have been beheaded."" ",sprinkle,128,129,1,3
"Then go to the queen and ask her to set your head on your body and to sprinkle you with the water when you have been beheaded."" ",sprinkle,BEFORE,"He took it back home with him and gave it to the queen, so that she might sprinkle him with it after he had been beheaded. ",sprinkle,129,132,3,3
"He took it back home with him and gave it to the queen, so that she might sprinkle him with it after he had been beheaded. ",sprinkle,BEFORE,"She did so, and at once Faithful rose again, as full of life as ever; ",did,132,133,3,0
"She did so, and at once Faithful rose again, as full of life as ever; ",did,BEFORE,"The king was astonished at what he had seen, and told the queen to cut off his own head and then sprinkle him with the water. ",sprinkle,133,135,0,6
"The king was astonished at what he had seen, and told the queen to cut off his own head and then sprinkle him with the water. ",sprinkle,BEFORE,"She at once seized the sword, and in a moment the king's head rolled to the ground. ",rolled,135,136,6,1
"She at once seized the sword, and in a moment the king's head rolled to the ground. ",rolled,BEFORE,"But she sprinkled none of the water of life upon it, and the king's body was quickly carried out and buried. ",sprinkled,136,137,1,0
"But she sprinkled none of the water of life upon it, and the king's body was quickly carried out and buried. ",sprinkled,BEFORE,Then the queen and Faithful celebrated their wedding with great pomp; ,celebrated,137,138,0,0
Then the queen and Faithful celebrated their wedding with great pomp; ,celebrated,BEFORE,"The wise horse dwelt contentedly in a wonderful chamber, and the king and queen kept the magic fiddle, the golden hall, and the troll's other valuables, and lived in peace and happiness day after day.",kept,138,140,0,0
