sentence_id,text,start,end
255,When I looked on him he was howling with pain. ,21391,21438
256,I said that I would not leave him in pain long. ,21438,21486
257,The thief had only one eye in his forehead. ,21486,21530
258,"I took a bar of iron, and put it in the fire till it was red, and I said to the hag, ""He will be howling at first, but will fall asleep presently, and do not wake him until he has slept as much as he wants. ",21530,21737
259,"I will close the door when I am going out."" ",21737,21781
260,"I took the bar with me, and I stood over him, and I turned it across through his eye as far as I could. ",21781,21885
261,"He began to bellow, and tried to catch me, but I was out and away, having closed the door. ",21885,21976
262,"The hag asked me, ""Why is he bellowing?"" ",21976,22017
263,"""Oh, he will be quiet presently, and will sleep for a good while, and I'll come again to have a look at him. ",22017,22126
264,"Bring me out the young men and the young women."" ",22126,22175
265,"I took them with me, and I said to her, ""Tell me where you got them."" ",22175,22245
266,"""Oh, my son brought them with him, and they are the offspring of the one King."" ",22245,22325
267,"I was well satisfied, and I had no liking for delay to get myself free from the hag, and I took them on board the ship, and the child I had myself. ",22325,22473
268,I thought the King might leave me the child I nursed myself. ,22473,22534
269,"But when I came to land, and all those young people with me, the King and Queen were out walking. ",22534,22632
270,"The King was very aged, and the Queen aged likewise. ",22632,22685
271,"When I came to converse with them, and the twelve with me, the King and Queen began to cry. ",22685,22777
272,"I asked, ""Why are you crying?"" ",22777,22808
273,"""Oh, it is for good cause I am crying. ",22808,22847
274,"As many children as these I should have, and now I am withered, grey, at the end of my life, and I have not one at all."" ",22847,22968
275,"""Oh, belike, you will yet have plenty."" ",22968,23008
276,"I told him all I went through, and I gave him the child in his hand, and: ""These are your other children who were stolen from you, whom I am giving to you safe. ",23008,23169
277,"They are gently reared."" ",23169,23194
278,"When the King heard who they were, he smothered them with kisses and drowned them with tears, and dried them with fine cloths, silken, and the hairs of his own head, and so also did their mother, and great was his welcome for me, as it was I who found them all. ",23194,23456
279,"And the King said to me, ""I will give you your own child, as it is you who have earned him best; ",23456,23553
280," but you must come to my court every year, and the child with you, and I will share with you my possessions."" ",23552,23662
281,"""Oh, I have enough of my own, and after my death I will leave it to the child."" ",23662,23742
282,"I spent a time till my visit was over, and I told the King all the troubles I went through, only I said nothing about my wife. ",23742,23869
283,"And now you have the story of the death of Anshgayliacht, the hag's son. ",23869,23942
284,"And Morraha thanked Rough Niall for the story, and he struck the ground with the Sword of Light, and Brown Allree was beside of him and she said to him, ""Sit up, now, riding, and take good heed of yourself,"" and at one leap she cleared the sea and at the next the three miles of hill covered with steel thistles and at the third the three miles of fire, and then he was home and he told the tale of the death of Anshgayliacht to the Slender Red Champion and gave him the Sword of Light, and he was well pleased to get them, and he took the spells of Morraha, and he had his wife and his castle back again, and by-and-by the five children; ",23942,24581
285, but he never put his hand to card-playing with strangers again.,24580,24645
