sentence1,event1,te_rel,sentence2,event2,s_id,s_id2,e_id,e_id2
"He was thankful to the Great Spirit for this act of goodness, and in his heart he felt assured that in time the boy would show great virtue, and in some way avenge him on the wicked Weendigo who had destroyed the companion of his lodge. ",avenge,AFTER,"The hunter grew at ease in his spirit, and gave all of the time he could spare from the chase to the society of the two children; ",grew,120,121,5,0
"The hunter grew at ease in his spirit, and gave all of the time he could spare from the chase to the society of the two children; ",grew,BEFORE," but, what affected him the most, both of his sons, although they were well-formed and beautiful, grew no more in stature, but remained children still. ",grew,121,122,0,3
" but, what affected him the most, both of his sons, although they were well-formed and beautiful, grew no more in stature, but remained children still. ",grew,BEFORE,"Every day they resembled each other more and more, and they never ceased to sport and divert themselves in the innocent ways of childhood. ",sport,122,123,3,2
"Every day they resembled each other more and more, and they never ceased to sport and divert themselves in the innocent ways of childhood. ",sport,BEFORE,"One day the hunter had gone abroad with his bow and arrows, leaving, at the request of the strange boy, one of the two shafts which the friendly Weendigo had given to him, behind in the lodge. ",leaving,123,124,2,2
"One day the hunter had gone abroad with his bow and arrows, leaving, at the request of the strange boy, one of the two shafts which the friendly Weendigo had given to him, behind in the lodge. ",leaving,BEFORE,"When he returned, what were his surprise and joy to see stretched dead by his lodge-door, the black giant who had slain his wife. ",returned,124,125,2,0
"When he returned, what were his surprise and joy to see stretched dead by his lodge-door, the black giant who had slain his wife. ",returned,BEFORE," and ever after the boy, or the Bone-Dwarf as he was called, was the guardian and good genius of the lodge, and no evil spirit, giant, or Weendigo, dared approach it to mar their peace.",called,125,127,0,1
